"position.page","position.position","position.global_position","asin","price.discounted","price.current_price","price.currency","price.before_price","price.savings_amount","price.savings_percent","reviews.total_reviews","reviews.rating","url","score","sponsored","amazonChoice","bestSeller","amazonPrime","title","thumbnail"
32,2,275,"B075H2QT9D",true,0,"USD",13.49,13.49,100,37372,4.7,"https://www.amazon.com/dp/B075H2QT9D","175648.40",false,false,false,false,"The Perks of Being a Wallflower","https://m.media-amazon.com/images/I/81v7hHaATrL._AC_UY218_.jpg"
32,4,277,"B09M7BPM5X",false,0,"USD",0,0,0,5,4,"https://www.amazon.com/dp/B09M7BPM5X","20.00",false,false,false,false,"Horror Stories To Tell In The Dark Book 3: Short Scary Anthology For Teenagers And Young Adults (Tales Of Terror)","https://m.media-amazon.com/images/I/71LzlulZp3L._AC_UY218_.jpg"
32,5,278,"B0035H3TVC",true,0,"USD",19.6,19.6,100,10959,4.7,"https://www.amazon.com/dp/B0035H3TVC","51507.30",false,false,true,false,"Are You There God? It's Me, Margaret (Movie Tie-In Edition)","https://m.media-amazon.com/images/I/61TaSxE7yTL._AC_UY218_.jpg"
32,6,279,"1642508772",true,8.99,"USD",9.99,1,10.01,14,4.4,"https://www.amazon.com/dp/1642508772","61.60",false,false,false,false,"Baseball Memories & Dreams: Reflections on the National Pastime from the Baseball Hall of Fame","https://m.media-amazon.com/images/I/81hbZnOnUFL._AC_UY218_.jpg"
32,7,280,"1518621686",true,7.24,"USD",9.99,2.75,27.53,1683,4.6,"https://www.amazon.com/dp/1518621686","7741.80",false,false,true,false,"Amazing Dogs: Adult Coloring Book (Stress Relieving Creative Fun Drawings to Calm Down, Reduce Anxiety & Relax. Great Chri...","https://m.media-amazon.com/images/I/61oRfAAZSlS._AC_UY218_.jpg"
32,8,281,"0062918060",false,0,"USD",0,0,0,8725,4.3,"https://www.amazon.com/dp/0062918060","37517.50",false,false,false,false,"The Upside of Falling","https://m.media-amazon.com/images/I/710w-t-k6HL._AC_UY218_.jpg"
33,1,282,"1955262691",true,6.9,"USD",12.9,6,46.51,24,4.5,"https://www.amazon.com/dp/1955262691","108.00",false,false,false,false,"My Islamic Activity Book for Adults and Teenagers: Learn Islamic Concepts in a Fun and Engaging Way While Challenging Your...","https://m.media-amazon.com/images/I/713no9Ut10L._AC_UY218_.jpg"
33,2,283,"1913484203",false,0,"USD",0,0,0,1686,4.8,"https://www.amazon.com/dp/1913484203","8092.80",false,false,false,false,"Guinness World Records 2023","https://m.media-amazon.com/images/I/91OBt05JVeL._AC_UY218_.jpg"
33,4,285,"B01KBD4OCA",true,0,"USD",13.99,13.99,100,849,4.4,"https://www.amazon.com/dp/B01KBD4OCA","3735.60",false,false,false,false,"Wolf Boys: Two American Teenagers and Mexico's Most Dangerous Drug Cartel","https://m.media-amazon.com/images/I/A1x3j5QWBoL._AC_UY218_.jpg"
33,5,286,"9916416222",false,0,"USD",0,0,0,20,4.9,"https://www.amazon.com/dp/9916416222","98.00",false,false,false,false,"You Can Be It!: A Bright Teen Girl's Guide to Career Planning and Future Success: Dare to Dream Big, Unlock Your Potentia...","https://m.media-amazon.com/images/I/61ojkHSIk5L._AC_UY218_.jpg"
33,6,287,"1595147586",true,53.99,"USD",71.94,17.95,24.95,4725,4.8,"https://www.amazon.com/dp/1595147586","22680.00",false,false,false,false,"Vampire Academy Box Set 1-6","https://m.media-amazon.com/images/I/81NeF+7MpBL._AC_UY218_.jpg"
33,7,288,"B0C1239MYC",false,0,"USD",0,0,0,1,5,"https://www.amazon.com/dp/B0C1239MYC","5.00",false,false,false,false,"Creepy Girl Coloring Book: Spooky Illustrations of Adorable girls, Scary Themed Papers to Explore Horror Imagination World...","https://m.media-amazon.com/images/I/71ZmSfKsd2L._AC_UY218_.jpg"
33,8,289,"0545852501",false,7.99,"USD",0,0,0,16843,4.8,"https://www.amazon.com/dp/0545852501","80846.40",false,false,true,false,"Guts: A Graphic Novel","https://m.media-amazon.com/images/I/51+kct9uRfL._AC_UY218_.jpg"
34,1,290,"B08TTGWQ5L",false,16.47,"USD",0,0,0,25215,4.7,"https://www.amazon.com/dp/B08TTGWQ5L","118510.50",false,false,false,false,"Adult Coloring Book Stress Relieving Designs, Animals, Mandalas, Plants, Patterns, Still Life, and So Much More","https://m.media-amazon.com/images/I/71JbPYlWAWL._AC_UY218_.jpg"
34,2,291,"0593179781",true,8.99,"USD",9.99,1,10.01,182,4.4,"https://www.amazon.com/dp/0593179781","800.80",false,false,false,false,"The Game (Underlined Paperbacks)","https://m.media-amazon.com/images/I/A1ejl0xzEQL._AC_UY218_.jpg"
34,3,292,"1577944569",false,6.75,"USD",0,0,0,20,4.3,"https://www.amazon.com/dp/1577944569","86.00",false,false,false,false,"Every Teenager's Little Black Book on Sex and Dating (Little Black Books) (Little Black Books (Harrison House)) (Little Bl...","https://m.media-amazon.com/images/I/51fqkHwS3uL._AC_UY218_.jpg"
34,4,293,"1520969643",false,11.42,"USD",0,0,0,189,4.4,"https://www.amazon.com/dp/1520969643","831.60",false,false,false,false,"Coloring Book for Teenage Boys (Fun Illustrations for Relaxation of Teen Boys)","https://m.media-amazon.com/images/I/71TTyam3-2L._AC_UY218_.jpg"
34,5,294,"1734879734",false,0,"USD",0,0,0,129,4.7,"https://www.amazon.com/dp/1734879734","606.30",false,false,false,false,"Mom and Teen: A Back and Forth Journal for Mother and Son","https://m.media-amazon.com/images/I/71MQrAt+rhL._AC_UY218_.jpg"
34,6,295,"1590389328",true,6.49,"USD",7.99,1.5,18.77,67,4.7,"https://www.amazon.com/dp/1590389328","314.90",false,false,false,false,"How to Be an Extraordinary Teenager","https://m.media-amazon.com/images/I/51C1axQ5IQL._AC_UY218_.jpg"
34,7,296,"0787983446",true,11.99,"USD",17.99,6,33.35,427,4.6,"https://www.amazon.com/dp/0787983446","1964.20",false,false,false,false,"American Medical Association Girl's Guide to Becoming a Teen","https://m.media-amazon.com/images/I/51VyaIGNxmL._AC_UY218_.jpg"
34,8,297,"0465094287",true,12.01,"USD",18.99,6.98,36.76,1002,4.7,"https://www.amazon.com/dp/0465094287","4709.40",false,false,false,false,"The Collapse of Parenting: How We Hurt Our Kids When We Treat Them Like Grown-Ups","https://m.media-amazon.com/images/I/51OGQR1OWEL._AC_UY218_.jpg"
35,1,298,"480531396X",true,8.83,"USD",14.99,6.16,41.09,296,4.6,"https://www.amazon.com/dp/480531396X","1361.60",false,false,false,false,"Diary of a Tokyo Teen: A Japanese-American Girl Travels to the Land of Trendy Fashion, High-Tech Toilets and Maid Cafes","https://m.media-amazon.com/images/I/91U0+lqm7kL._AC_UY218_.jpg"
35,2,299,"1638788839",true,10.99,"USD",14.99,4,26.68,22,4.5,"https://www.amazon.com/dp/1638788839","99.00",false,false,false,false,"Parenting Your Transgender Teen: Positive Parenting Strategies for Raising Transgender, Nonbinary, and Gender Nonconformin...","https://m.media-amazon.com/images/I/81iQBYVmkcL._AC_UY218_.jpg"
35,3,300,"B0B5FBXS7H",false,0,"USD",0,0,0,5,5,"https://www.amazon.com/dp/B0B5FBXS7H","25.00",false,false,false,false,"Jesus is Better: Idolatry, Struggle, and the Challenge of Being a Teenager in a Disenchanted World","https://m.media-amazon.com/images/I/71mW+kVvgsL._AC_UY218_.jpg"
35,4,301,"1108718779",true,14.2,"USD",14.95,0.75,5.02,642,4.6,"https://www.amazon.com/dp/1108718779","2953.20",false,false,false,false,"The Body Image Book for Girls: Love Yourself and Grow Up Fearless","https://m.media-amazon.com/images/I/51ZCbJ3lbeL._AC_UY218_.jpg"
35,5,302,"0358577357",true,18.99,"USD",35.99,17,47.24,14,5,"https://www.amazon.com/dp/0358577357","70.00",false,false,false,false,"The Carl Deuker Collection 4-Book Boxed Set","https://m.media-amazon.com/images/I/71EEATUl9kL._AC_UY218_.jpg"
35,6,303,"1700813552",true,8.04,"USD",39.99,31.95,79.89,3996,4.8,"https://www.amazon.com/dp/1700813552","19180.80",false,false,false,false,"Bible Verse Coloring Book for Girls: 35 Color Pages of Lettering Art of Inspirational & Motivational Scripture with Mindfu...","https://m.media-amazon.com/images/I/61BcRdXahbL._AC_UY218_.jpg"
35,7,304,"1711617962",false,0,"USD",0,0,0,499,4.3,"https://www.amazon.com/dp/1711617962","2145.70",false,false,false,false,"Try Not to Laugh Challenge Joke Book 13 Year Old Edition: is a Hilarious Interactive Joke Book Game for Teenagers! Funny J...","https://m.media-amazon.com/images/I/51uUYYBLUCL._AC_UY218_.jpg"
35,8,305,"1510722629",false,14.99,"USD",0,0,0,10,4.4,"https://www.amazon.com/dp/1510722629","44.00",false,false,false,false,"It's Not What You're Eating, It's What's Eating You: A Teenager's Guide to Preventing Eating Disorders―and Loving Yourself","https://m.media-amazon.com/images/I/71lDbyo5wmL._AC_UY218_.jpg"
36,1,306,"195751521X",true,0,"USD",13,13,100,77,4.8,"https://www.amazon.com/dp/195751521X","369.60",false,false,false,false,"Epic Stories For Kids and Family - Accidental Discoveries That Changed Our World: Fascinating Origins of Discoveries and I...","https://m.media-amazon.com/images/I/71nN-eQ6fOL._AC_UY218_.jpg"
36,2,307,"1786033658",true,12.98,"USD",14.99,2.01,13.41,277,4.6,"https://www.amazon.com/dp/1786033658","1274.20",false,false,false,false,"Yay! You're Gay! Now What?: A Gay Boy's Guide to Life","https://m.media-amazon.com/images/I/81LJLdI1izL._AC_UY218_.jpg"
36,3,308,"0802418678",true,0,"USD",15.21,15.21,100,197,4.8,"https://www.amazon.com/dp/0802418678","945.60",false,false,false,false,"Choose Greatness: 11 Wise Decisions that Brave Young Men Make","https://m.media-amazon.com/images/I/91ovh7AMpQL._AC_UY218_.jpg"
36,4,309,"B07T6BQV2L",false,0,"USD",0,0,0,62622,4.7,"https://www.amazon.com/dp/B07T6BQV2L","294323.40",false,false,false,false,"Catching Fire: The Hunger Games, Book 2","https://m.media-amazon.com/images/I/81SKNqIndVL._AC_UY218_.jpg"
36,5,310,"1557047642",true,14.44,"USD",16.99,2.55,15.01,700,4.4,"https://www.amazon.com/dp/1557047642","3080.00",false,false,false,false,"What's Happening to My Body? Book for Girls: Revised Edition","https://m.media-amazon.com/images/I/81FwvD3TSxL._AC_UY218_.jpg"
36,6,311,"B0BXNBD9J2",false,0,"USD",0,0,0,49,4.9,"https://www.amazon.com/dp/B0BXNBD9J2","240.10",false,false,false,false,"Brain Games & Relaxing Activity Book For Teens & Adults: 100 Large Print Stress Relief Puzzles Including Word Searches, Su...","https://m.media-amazon.com/images/I/71GzTzBgyXL._AC_UY218_.jpg"
36,7,312,"1662909195",true,4.99,"USD",12.95,7.96,61.47,114,4.8,"https://www.amazon.com/dp/1662909195","547.20",false,false,false,false,"Finance 102 for Kids: Practical Money Lessons Children Cannot Afford to Miss","https://m.media-amazon.com/images/I/7102I4xxEnS._AC_UY218_.jpg"
36,8,313,"1785927019",true,17.74,"USD",20.95,3.21,15.32,64,4.5,"https://www.amazon.com/dp/1785927019","288.00",false,false,false,false,"Parenting in the Eye of the Storm","https://m.media-amazon.com/images/I/514VLdb7x+L._AC_UY218_.jpg"
37,1,314,"1984896431",true,8.99,"USD",10.99,2,18.2,16556,4.6,"https://www.amazon.com/dp/1984896431","76157.60",false,false,false,false,"Good Girl, Bad Blood: The Sequel to A Good Girl's Guide to Murder","https://m.media-amazon.com/images/I/81Hm7zT8wsS._AC_UY218_.jpg"
37,2,315,"0316551368",true,37.99,"USD",52,14.01,26.94,3666,4.8,"https://www.amazon.com/dp/0316551368","17596.80",false,false,false,false,"The 100 Complete Boxed Set","https://m.media-amazon.com/images/I/916Erczn2yL._AC_UY218_.jpg"
37,3,316,"0385721609",true,12.88,"USD",17.95,5.07,28.25,67,4.4,"https://www.amazon.com/dp/0385721609","294.80",false,false,false,false,"The Primal Teen: What the New Discoveries about the Teenage Brain Tell Us about Our Kids","https://m.media-amazon.com/images/I/61Wd3Q4YFkL._AC_UY218_.jpg"
37,4,317,"1638074224",true,10.12,"USD",14.99,4.87,32.49,20,4.5,"https://www.amazon.com/dp/1638074224","90.00",false,false,false,false,"The Essential Sex Education Book for Parents: Guided Conversations to Have with Your Tweens and Teens","https://m.media-amazon.com/images/I/71X2VG1LtbL._AC_UY218_.jpg"
37,5,318,"1915542049",true,11.49,"USD",11.99,0.5,4.17,125,4.5,"https://www.amazon.com/dp/1915542049","562.50",false,false,false,false,"Adulting for Beginners - Life Skills for Adult Children, Teens, High School and College Students | The Grown-up's Survival...","https://m.media-amazon.com/images/I/71u59SWifYL._AC_UY218_.jpg"
37,6,319,"B07P7XSCXG",true,0,"USD",42,42,100,17268,4.6,"https://www.amazon.com/dp/B07P7XSCXG","79432.80",false,false,false,false,"The Book of Dust: The Secret Commonwealth: The Book of Dust, Volume 2","https://m.media-amazon.com/images/I/91Jiykr5oNL._AC_UY218_.jpg"
37,7,320,"0374534985",true,4.99,"USD",19,14.01,73.74,1098,4.5,"https://www.amazon.com/dp/0374534985","4941.00",false,false,false,false,"Spare Parts: Four Undocumented Teenagers, One Ugly Robot, and the Battle for the American Dream","https://m.media-amazon.com/images/I/81ySRQ2ShxL._AC_UY218_.jpg"
37,8,321,"1952842603",false,0,"USD",0,0,0,158,4.5,"https://www.amazon.com/dp/1952842603","711.00",false,false,false,false,"The Cute and Simple Drawing Book for Teens: An Easy Step-by-Step Guide to How to Draw Cute and Beautiful Things For Beginners","https://m.media-amazon.com/images/I/71t5rBN6+9L._AC_UY218_.jpg"
38,1,322,"0787983438",true,2.99,"USD",17.99,15,83.38,1289,4.6,"https://www.amazon.com/dp/0787983438","5929.40",false,false,true,false,"American Medical Association Boy's Guide to Becoming a Teen","https://m.media-amazon.com/images/I/51z334riGxL._AC_UY218_.jpg"
38,2,323,"B0BD3MLQDN",false,0,"USD",0,0,0,4,5,"https://www.amazon.com/dp/B0BD3MLQDN","20.00",false,false,false,false,"SLAM BOOK: Slam Book for Lovely Friends, Build Strong Friendship, Diary Slammed For Girls and Teenagers, With Exciting Que...","https://m.media-amazon.com/images/I/61xdZ1pLZLL._AC_UY218_.jpg"
38,3,324,"0143132393",true,0,"USD",16.49,16.49,100,803,4.7,"https://www.amazon.com/dp/0143132393","3774.10",false,false,false,false,"What Your ADHD Child Wishes You Knew: Working Together to Empower Kids for Success in School and Life","https://m.media-amazon.com/images/I/91SLh6MEmQL._AC_UY218_.jpg"
38,4,325,"B0BFWGRJQM",false,0,"USD",0,0,0,5,5,"https://www.amazon.com/dp/B0BFWGRJQM","25.00",false,false,false,false,"Large Print Bible Word Search: Bible Verse Activity Book for Adults and Teens","https://m.media-amazon.com/images/I/71WG2sn6rfL._AC_UY218_.jpg"
38,5,326,"9493276503",false,0,"USD",0,0,0,50,4.8,"https://www.amazon.com/dp/9493276503","240.00",false,false,false,false,"Running for Shelter: A True Story (Holocaust Books for Young Adults)","https://m.media-amazon.com/images/I/71b-E-mQyjL._AC_UY218_.jpg"
38,6,327,"0684868040",true,13.99,"USD",18,4.01,22.28,67,4.2,"https://www.amazon.com/dp/0684868040","281.40",false,false,false,false,"The Grieving Teen : A Guide for Teenagers and Their Friends","https://m.media-amazon.com/images/I/514Gwl7fxBL._AC_UY218_.jpg"
38,7,328,"1424556368",true,0,"USD",17.35,17.35,100,1935,4.6,"https://www.amazon.com/dp/1424556368","8901.00",false,false,false,false,"Adulting 101: #Wisdom4Life (Hardcover) – A Complete Guide on Life Planning, Responsibility and Goal Setting, Perfect Gift ...","https://m.media-amazon.com/images/I/91cpqIY4MyL._AC_UY218_.jpg"
38,8,329,"1915510341",false,0,"USD",0,0,0,6,4.8,"https://www.amazon.com/dp/1915510341","28.80",false,false,false,false,"I'm Fine - The Rest Of You Need Therapy: A Sarcastic Coloring Book for Teens with Sarcasm Quotes : Daily Dose of Sarcasm :...","https://m.media-amazon.com/images/I/71jYmmZWGsL._AC_UY218_.jpg"
39,1,330,"143368165X",true,5.38,"USD",6.99,1.61,23.03,1622,4.7,"https://www.amazon.com/dp/143368165X","7623.40",false,false,false,false,"Teen to Teen: 365 Daily Devotions by Teen Girls for Teen Girls","https://m.media-amazon.com/images/I/51-v9ToJzvL._AC_UY218_.jpg"
39,2,331,"1101903058",true,14.99,"USD",17.99,3,16.68,579,4.6,"https://www.amazon.com/dp/1101903058","2663.40",false,false,false,false,"Queen Bees and Wannabes, 3rd Edition: Helping Your Daughter Survive Cliques, Gossip, Boys, and the New Realities of Girl W...","https://m.media-amazon.com/images/I/814NY+hh1JL._AC_UY218_.jpg"
39,3,332,"0593435915",false,7.99,"USD",0,0,0,32,4.9,"https://www.amazon.com/dp/0593435915","156.80",false,false,false,false,"Would You Rather? Easter Edition: Hop into a Hilarious Springtime Game for Kids","https://m.media-amazon.com/images/I/71MDR-fDCXL._AC_UY218_.jpg"
39,4,333,"0593538331",true,0,"USD",9.49,9.49,100,107,4.5,"https://www.amazon.com/dp/0593538331","481.50",false,false,false,false,"First Phone: A Child's Guide to Digital Responsibility, Safety, and Etiquette","https://m.media-amazon.com/images/I/71W2nXEW2bL._AC_UY218_.jpg"
39,5,334,"0875526055",true,0,"USD",39.99,39.99,100,532,4.8,"https://www.amazon.com/dp/0875526055","2553.60",false,false,false,false,"Age of Opportunity: A Biblical Guide to Parenting Teens, Second Edition (Resources for Changing Lives)","https://m.media-amazon.com/images/I/517683CE7QL._AC_UY218_.jpg"
39,6,335,"1416985786",false,10.99,"USD",0,0,0,41,4.3,"https://www.amazon.com/dp/1416985786","176.30",false,false,false,false,"The American Muslim Teenager's Handbook","https://m.media-amazon.com/images/I/61nDN3w6IeL._AC_UY218_.jpg"
39,7,336,"B0B4K7WF21",false,0,"USD",0,0,0,111,4.8,"https://www.amazon.com/dp/B0B4K7WF21","532.80",false,false,false,false,"Adorable Goth Coloring Book: A Coloring Book Features Kawaii, Horror, Cute Spooky Gothic for Stress Relief & Relaxation","https://m.media-amazon.com/images/I/71ki8-m7M4L._AC_UY218_.jpg"
39,8,337,"B0716ZVP6D",true,0,"USD",21.7,21.7,100,5638,4.6,"https://www.amazon.com/dp/B0716ZVP6D","25934.80",false,false,false,false,"The Battlemage","https://m.media-amazon.com/images/I/81eSxb0orYL._AC_UY218_.jpg"
40,1,338,"162625382X",true,15.75,"USD",19.95,4.2,21.05,43,4.5,"https://www.amazon.com/dp/162625382X","193.50",false,false,false,false,"Mindfulness for Teen Depression: A Workbook for Improving Your Mood","https://m.media-amazon.com/images/I/71gNGQV2j0L._AC_UY218_.jpg"
40,2,339,"B09NRBY57W",true,0,"USD",13,13,100,46,4.8,"https://www.amazon.com/dp/B09NRBY57W","220.80",false,false,false,false,"""Mom's Guide"" Parenting Your Teenage Daughter: Build a Better Connection with Your Teen Girl Tackling Anxiety, Intense Emo...","https://m.media-amazon.com/images/I/71YBfGLs1lL._AC_UY218_.jpg"
40,3,340,"0486824039",false,0,"USD",0,0,0,269,4.7,"https://www.amazon.com/dp/0486824039","1264.30",false,false,false,false,"Around the World Word Search Puzzles (Dover Puzzle Games)","https://m.media-amazon.com/images/I/91tKajNCSIL._AC_UY218_.jpg"
40,5,342,"B0BMT2NYST",false,0,"USD",0,0,0,29,4.7,"https://www.amazon.com/dp/B0BMT2NYST","136.30",false,false,false,false,"Social Skills for Tweens: Boost Confidence, Tackle Social Anxiety, Charm People around You, Build Genuine Relationships, a...","https://m.media-amazon.com/images/I/71aNwkXgQlL._AC_UY218_.jpg"
40,6,343,"1681882671",true,1.99,"USD",9.99,8,80.08,452,4.7,"https://www.amazon.com/dp/1681882671","2124.40",false,false,false,false,"Junior Baker: Fun Recipes for Delicious Cakes, Cookies, Cupcakes & More (Williams Sonoma)","https://m.media-amazon.com/images/I/81NDCPxrdbL._AC_UY218_.jpg"
40,7,344,"0740791680",true,4.99,"USD",9.99,5,50.05,105,4.5,"https://www.amazon.com/dp/0740791680","472.50",false,false,false,false,"A Zits Guide to Living With Your Teenager (Volume 23)","https://m.media-amazon.com/images/I/61sUysEC7kL._AC_UY218_.jpg"
40,8,345,"B08RX5L8KX",false,0,"USD",0,0,0,88,4.1,"https://www.amazon.com/dp/B08RX5L8KX","360.80",false,false,false,false,"Country Cussin' Adult Coloring Book: A Clean Swear Word Coloring Book for Adults and Teenagers Great for Stress Relief","https://m.media-amazon.com/images/I/711ce6ueh9L._AC_UY218_.jpg"
4,9,346,"B0BTRFR9JN",false,0,"USD",0,0,0,584,5,"https://www.amazon.com/dp/B0BTRFR9JN","2920.00",false,false,true,false,"The Complete Cookbook for Teen Chefs: 200 Super Easy, Fast, and Delicious Recipes to Level Up Your Kitchen Game | For Teen...","https://m.media-amazon.com/images/I/71aKjOO6IHL._AC_UY218_.jpg"
4,10,347,"B0BMT2PSV6",true,0,"USD",14.95,14.95,100,128,4.9,"https://www.amazon.com/dp/B0BMT2PSV6","627.20",false,false,true,false,"Building Unstoppable Self-Confidence for Teens: The Fail-Safe Formula for Finding Yourself, Overcoming Limitations and Cre...","https://m.media-amazon.com/images/I/71H8aEFcCTL._AC_UY218_.jpg"
41,1,348,"1572246111",true,10.99,"USD",15.15,4.16,27.46,384,4.5,"https://www.amazon.com/dp/1572246111","1728.00",false,false,false,false,"Beyond the Blues: A Workbook to Help Teens Overcome Depression","https://m.media-amazon.com/images/I/51WPfWdXHsL._AC_UY218_.jpg"
4,11,349,"0310270456",true,9.5,"USD",19.99,10.49,52.48,1150,4.7,"https://www.amazon.com/dp/0310270456","5405.00",false,false,false,false,"Boundaries with Teens: When to Say Yes, How to Say No","https://m.media-amazon.com/images/I/61LB4tOB2qL._AC_UY218_.jpg"
41,2,350,"0063283824",false,0,"USD",0,0,0,16,4.8,"https://www.amazon.com/dp/0063283824","76.80",false,false,false,false,"Realm Breaker 2-Book Hardcover Box Set: Realm Breaker, Blade Breaker","https://m.media-amazon.com/images/I/81BW0pBrG3L._AC_UY218_.jpg"
4,12,351,"1087763061",false,0,"USD",0,0,0,7,4.8,"https://www.amazon.com/dp/1087763061","33.60",false,false,false,false,"Good News - Teen Girls' Bible Study Book: How to Know the Gospel and Live It","https://m.media-amazon.com/images/I/615G9kmTTaL._AC_UY218_.jpg"
41,3,352,"B0BRX99J1Z",true,2.99,"USD",12.99,10,76.98,37,4.6,"https://www.amazon.com/dp/B0BRX99J1Z","170.20",false,false,false,false,"Parenting Teens Through Faith: 7 Steps to an Improved Parent-Teen Relationship, Boost Your Teen's Confidence & Mental Stre...","https://m.media-amazon.com/images/I/81VEC9fHEFL._AC_UY218_.jpg"
4,13,353,"1641581557",true,13.99,"USD",19.99,6,30.02,379,4.6,"https://www.amazon.com/dp/1641581557","1743.40",false,false,false,false,"Parenting Teens with Love and Logic: Preparing Adolescents for Responsible Adulthood","https://m.media-amazon.com/images/I/619BVNoaw0L._AC_UY218_.jpg"
4,14,354,"1433687836",false,16.69,"USD",0,0,0,155,4.8,"https://www.amazon.com/dp/1433687836","744.00",false,false,true,false,"Teen to Teen: 365 Daily Devotions by Teen Guys for Teen Guys","https://m.media-amazon.com/images/I/91Tj9Xl4kxL._AC_UY218_.jpg"
41,4,355,"1414396678",false,0,"USD",0,0,0,891,4.8,"https://www.amazon.com/dp/1414396678","4276.80",false,false,true,false,"The Epic Bible: God’s Story from Eden to Eternity","https://m.media-amazon.com/images/I/91Gm5oXWmxL._AC_UY218_.jpg"
4,15,356,"195284293X",false,0,"USD",0,0,0,6,5,"https://www.amazon.com/dp/195284293X","30.00",false,false,false,false,"The Print Handwriting Workbook for Teens: Learn the Art of Penmanship in this Writing Practice book with Inspirational Quo...","https://m.media-amazon.com/images/I/61fck8NjltL._AC_UY218_.jpg"
41,5,357,"1484723643",true,8.99,"USD",11.99,3,25.02,6232,4.7,"https://www.amazon.com/dp/1484723643","29290.40",false,false,true,false,"Every Last Word","https://m.media-amazon.com/images/I/41ZioqFQdeL._AC_UY218_.jpg"
4,16,358,"1626258899",true,9.99,"USD",14.15,4.16,29.4,821,4.6,"https://www.amazon.com/dp/1626258899","3776.60",false,false,false,false,"Conquer Negative Thinking for Teens: A Workbook to Break the Nine Thought Habits That Are Holding You Back","https://m.media-amazon.com/images/I/81IX-BS+ERL._AC_UY218_.jpg"
41,6,359,"B0BT6BJNNV",true,0,"USD",29.95,29.95,100,1570,4.6,"https://www.amazon.com/dp/B0BT6BJNNV","7222.00",false,false,false,false,"Dead Meat: The Complete Zombie Apocalypse Series","https://m.media-amazon.com/images/I/91zzXiIAuCL._AC_UY218_.jpg"
41,7,360,"0843172525",false,0,"USD",0,0,0,2466,4.7,"https://www.amazon.com/dp/0843172525","11590.20",false,false,false,false,"Easter Eggstravaganza Mad Libs: World's Greatest Word Game","https://m.media-amazon.com/images/I/81ZpJLvO62L._AC_UY218_.jpg"
41,8,361,"0800722299",true,0,"USD",15.21,15.21,100,10524,4.7,"https://www.amazon.com/dp/0800722299","49462.80",false,false,false,false,"The Manual to Manhood: How to Cook the Perfect Steak, Change a Tire, Impress a Girl & 97 Other Skills You Need to Survive","https://m.media-amazon.com/images/I/71KCBl9R5eL._AC_UY218_.jpg"
42,1,362,"0062820265",true,11.49,"USD",11.99,0.5,4.17,2046,4.6,"https://www.amazon.com/dp/0062820265","9411.60",false,false,false,false,"Felix Ever After","https://m.media-amazon.com/images/I/912LLWFKmxS._AC_UY218_.jpg"
42,2,363,"B09NRRFW63",false,0,"USD",0,0,0,59,4.2,"https://www.amazon.com/dp/B09NRRFW63","247.80",false,false,true,false,"No More Tics!: Help for Tic Disorders, Tourette Syndrome, TikTok Tics and More","https://m.media-amazon.com/images/I/61bJga2n6WL._AC_UY218_.jpg"
42,3,364,"0062422685",true,0,"USD",39.92,39.92,100,3900,4.6,"https://www.amazon.com/dp/0062422685","17940.00",false,false,false,false,"Monday's Not Coming","https://m.media-amazon.com/images/I/71B2Gzl6r2L._AC_UY218_.jpg"
42,4,365,"B071Z9NWKP",true,0,"USD",21.7,21.7,100,6242,4.7,"https://www.amazon.com/dp/B071Z9NWKP","29337.40",false,false,false,false,"The Inquisition","https://m.media-amazon.com/images/I/91HFa-4KAlL._AC_UY218_.jpg"
42,5,366,"0544824385",true,22.99,"USD",35,12.01,34.31,1789,4.8,"https://www.amazon.com/dp/0544824385","8587.20",false,false,true,false,"The Way Things Work Now","https://m.media-amazon.com/images/I/71c8vVlzfiL._AC_UY218_.jpg"
42,6,367,"1638786011",false,29.38,"USD",0,0,0,39,4.8,"https://www.amazon.com/dp/1638786011","187.20",false,false,false,false,"Ultimate Self-Love Workbook for Teen Girls: Build Confidence, Release Self-Doubt, and Embrace Who You Are","https://m.media-amazon.com/images/I/81xQCd5uR9L._AC_UY218_.jpg"
42,7,368,"1694608336",false,0,"USD",0,0,0,6,4,"https://www.amazon.com/dp/1694608336","24.00",false,false,false,false,"Words of Wisdom for the Graduate: Blank Writing Journal Book, Graduation Guestbook Keepsake Gift, Unlined Notebook, Black,...","https://m.media-amazon.com/images/I/41MaekUVCaL._AC_UY218_.jpg"
42,8,369,"1593277415",false,11.99,"USD",0,0,0,695,4.7,"https://www.amazon.com/dp/1593277415","3266.50",false,false,false,false,"The LEGO Animation Book: Make Your Own LEGO Movies!","https://m.media-amazon.com/images/I/918JusbX4XL._AC_UY218_.jpg"
