"position.page","position.position","position.global_position","asin","price.discounted","price.current_price","price.currency","price.before_price","price.savings_amount","price.savings_percent","reviews.total_reviews","reviews.rating","url","score","sponsored","amazonChoice","bestSeller","amazonPrime","title","thumbnail"
65,1,560,"1999896955",false,0,"USD",0,0,0,552,4.8,"https://www.amazon.com/dp/1999896955","2649.60",false,false,false,false,"Unicorn Coloring Book: Coloring for children,tweens and teenagers,ages 7 and up.Core age 8-12 years old.Use:kids arts & cr...","https://m.media-amazon.com/images/I/61raRmkx1FL._AC_UY218_.jpg"
65,2,561,"B09PMHY2Q3",true,0,"USD",13,13,100,160,4.6,"https://www.amazon.com/dp/B09PMHY2Q3","736.00",false,false,false,false,"Parenting Children with Oppositional Defiant Disorder: A Modern Approach to Understand and Lead Your O.D.D. Child to Succe...","https://m.media-amazon.com/images/I/61p0a+M3mcL._AC_UY218_.jpg"
65,3,562,"1790808073",false,9.2,"USD",0,0,0,20,4.7,"https://www.amazon.com/dp/1790808073","94.00",false,false,false,false,"All About The 12 Disciples","https://m.media-amazon.com/images/I/71Pm3mVEKbL._AC_UY218_.jpg"
65,4,563,"0807025011",true,12.08,"USD",18,5.92,32.89,81,4.6,"https://www.amazon.com/dp/0807025011","372.60",false,false,false,false,"Straight Talk about Death for Teenagers: How to Cope with Losing Someone You Love","https://m.media-amazon.com/images/I/81k15rCVniL._AC_UY218_.jpg"
65,5,564,"1087765145",false,0,"USD",0,0,0,25,4.6,"https://www.amazon.com/dp/1087765145","115.00",false,false,false,false,"In My Feels: How to Feel God When I'm Not Feeling It","https://m.media-amazon.com/images/I/81RFMyoauSL._AC_UY218_.jpg"
65,6,565,"B07L3BXYQJ",true,0,"USD",38.5,38.5,100,5049,4.7,"https://www.amazon.com/dp/B07L3BXYQJ","23730.30",false,false,false,false,"The Sorcerer of the North: Ranger's Apprentice Series","https://m.media-amazon.com/images/I/91onNYBfEPL._AC_UY218_.jpg"
65,7,566,"1250044235",true,0,"USD",16.41,16.41,100,2560,4.6,"https://www.amazon.com/dp/1250044235","11776.00",false,false,true,false,"The Finest Hours (Young Readers Edition): The True Story of a Heroic Sea Rescue (True Rescue Series)","https://m.media-amazon.com/images/I/91Uc+5RrB5L._AC_UY218_.jpg"
65,8,567,"B0716T2B3M",true,0,"USD",21.7,21.7,100,7253,4.5,"https://www.amazon.com/dp/B0716T2B3M","32638.50",false,false,false,false,"The Novice","https://m.media-amazon.com/images/I/91jKiMrQOlL._AC_UY218_.jpg"
66,1,568,"B08BWCFXYB",false,0,"USD",0,0,0,69,4,"https://www.amazon.com/dp/B08BWCFXYB","276.00",false,false,false,false,"The Keys to Being Brilliantly Confident and More Assertive: A Vital Guide to Enhancing Your Communication Skills, Getting ...","https://m.media-amazon.com/images/I/61y6Q7kvWLL._AC_UY218_.jpg"
66,2,569,"0692927999",false,0,"USD",0,0,0,33166,4.8,"https://www.amazon.com/dp/0692927999","159196.80",false,false,true,false,"I Am Confident, Brave & Beautiful: A Coloring Book for Girls","https://m.media-amazon.com/images/I/71AIzioFxTL._AC_UY218_.jpg"
66,3,570,"0759553920",false,399.99,"USD",0,0,0,6885,4.7,"https://www.amazon.com/dp/0759553920","32359.50",false,false,false,false,"The Twilight Saga Complete Collection","https://m.media-amazon.com/images/I/71QqK3ZjFfL._AC_UY218_.jpg"
66,4,571,"B086PLYD2V",false,0,"USD",0,0,0,636,4.8,"https://www.amazon.com/dp/B086PLYD2V","3052.80",false,false,false,false,"Mother and Son Journal: Mom and Son Journals for Teenage Boys, Mommy and Me Journal For Boys, Mother Son Journal Pass Back...","https://m.media-amazon.com/images/I/514M-66GOmL._AC_UY218_.jpg"
66,5,572,"0147510422",true,0,"USD",21.91,21.91,100,4588,4.7,"https://www.amazon.com/dp/0147510422","21563.60",false,false,true,false,"The Boy Who Harnessed the Wind, Young Reader's Edition","https://m.media-amazon.com/images/I/911z7qLb23L._AC_UY218_.jpg"
66,6,573,"0142417092",true,21.21,"USD",35.96,14.75,41.02,487,4.8,"https://www.amazon.com/dp/0142417092","2337.60",false,false,false,false,"The Chronicles of Vladimir Tod Boxed Set (4 Books)","https://m.media-amazon.com/images/I/81hlJoZRhHL._AC_UY218_.jpg"
66,7,574,"157826877X",true,9.17,"USD",12.5,3.33,26.64,15,4.6,"https://www.amazon.com/dp/157826877X","69.00",false,false,false,false,"The Horse Lover's Quotation Book: Celebrating Grace, Beauty, Spirit & Freedom","https://m.media-amazon.com/images/I/8168c0vVNyL._AC_UY218_.jpg"
66,8,575,"0062409808",true,14.58,"USD",20.13,5.55,27.57,321,4.7,"https://www.amazon.com/dp/0062409808","1508.70",false,false,false,false,"War of the Cards (Queen of Hearts, 3)","https://m.media-amazon.com/images/I/81PvkZhJKqL._AC_UY218_.jpg"
67,1,576,"B09SBYC5MJ",false,22.56,"USD",0,0,0,37,5,"https://www.amazon.com/dp/B09SBYC5MJ","185.00",false,false,false,false,"Miserable Mom: The Do's and Don'ts of Sending Your Kid to College","https://m.media-amazon.com/images/I/61+B+duM9tL._AC_UY218_.jpg"
67,2,577,"B09NHTSWC4",true,13.99,"USD",38.5,24.51,63.66,458,4.5,"https://www.amazon.com/dp/B09NHTSWC4","2061.00",false,false,false,false,"The Sinister Booksellers of Bath","https://m.media-amazon.com/images/I/91s5eim+ZrL._AC_UY218_.jpg"
67,3,578,"1647396107",false,0,"USD",0,0,0,314,4.7,"https://www.amazon.com/dp/1647396107","1475.80",false,false,false,false,"The Vegan Cookbook for Kids: Easy Plant-Based Recipes for Young Chefs","https://m.media-amazon.com/images/I/81KewmbRaEL._AC_UY218_.jpg"
67,4,579,"0874254094",false,0,"USD",0,0,0,34,4.5,"https://www.amazon.com/dp/0874254094","153.00",false,false,false,false,"How to Say No and Keep Your Friends: Peer Pressure Reversal for Teens and Preteens","https://m.media-amazon.com/images/I/71BgBOFCohL._AC_UY218_.jpg"
67,5,580,"B0BK473JYP",true,9.02,"USD",19.6,10.58,53.98,1,4,"https://www.amazon.com/dp/B0BK473JYP","4.00",false,false,false,false,"The Five Sorrowful Mysteries of Andy Africa","https://m.media-amazon.com/images/I/91XStwn4GAL._AC_UY218_.jpg"
67,6,581,"163353409X",true,11.99,"USD",17.99,6,33.35,1065,4.8,"https://www.amazon.com/dp/163353409X","5112.00",false,false,false,false,"The ABC's of LGBT+: (Gender Identity Book for Teens, Teen & Young Adult LGBT Issues)","https://m.media-amazon.com/images/I/71PqJmNtvaL._AC_UY218_.jpg"
67,7,582,"153596006X",true,13.99,"USD",14.99,1,6.67,1283,4.8,"https://www.amazon.com/dp/153596006X","6158.40",false,false,false,false,"Defined - Teen Girls' Bible Study Book: Who God Says You Are (Bible Study for Teen Girls and Young Women)","https://m.media-amazon.com/images/I/91hTQjKE3JL._AC_UY218_.jpg"
7,9,584,"014242417X",true,0,"USD",28,28,100,158292,4.6,"https://www.amazon.com/dp/014242417X","728143.20",false,false,false,false,"The Fault in Our Stars","https://m.media-amazon.com/images/I/81a4kCNuH+L._AC_UY218_.jpg"
7,10,585,"078534909X",false,0,"USD",0,0,0,15,4.2,"https://www.amazon.com/dp/078534909X","63.00",false,false,false,false,"A Teenager's Daily Prayer Book","https://m.media-amazon.com/images/I/61wN+OV6jeL._AC_UY218_.jpg"
7,11,586,"1607746026",true,10.99,"USD",15.99,5,31.27,330,4.4,"https://www.amazon.com/dp/1607746026","1452.00",false,false,false,false,"Raising Boys, Third Edition: Why Boys Are Different--and How to Help Them Become Happy and Well-Balanced Men","https://m.media-amazon.com/images/I/81NqP9NrlUL._AC_UY218_.jpg"
7,13,588,"1684039193",true,9.99,"USD",14.15,4.16,29.4,16,5,"https://www.amazon.com/dp/1684039193","80.00",false,false,false,false,"The Anxiety and Depression Workbook for Teens: Simple CBT Skills to Help You Deal with Anxiety, Worry, and Sadness","https://m.media-amazon.com/images/I/611xt1chN+L._AC_UY218_.jpg"
7,14,589,"1626255903",true,9.99,"USD",14.15,4.16,29.4,858,4.7,"https://www.amazon.com/dp/1626255903","4032.60",false,false,false,false,"Just As You Are: A Teen’s Guide to Self-Acceptance and Lasting Self-Esteem (The Instant Help Solutions Series)","https://m.media-amazon.com/images/I/81Vp+AJSQ2L._AC_UY218_.jpg"
7,15,590,"B0BCRXJTDW",false,0,"USD",0,0,0,2,5,"https://www.amazon.com/dp/B0BCRXJTDW","10.00",false,false,false,false,"Sex Education For Teens Workbook: Teenagers Homeschool or Classroom Health Curriculum Life Skills Lesson: With Practice Me...","https://m.media-amazon.com/images/I/61C85-XDTJL._AC_UY218_.jpg"
7,16,591,"B0BZMH57DV",false,0,"USD",0,0,0,36,4.9,"https://www.amazon.com/dp/B0BZMH57DV","176.40",false,false,false,false,"Adulting For Beginners Guide: 3 Manuscripts In 1 Book For The Complete Adulting Beginners Guide To Help Teenagers Learn Vi...","https://m.media-amazon.com/images/I/71JsegRt9GL._AC_UY218_.jpg"
8,9,592,"B09T8D11LQ",false,0,"USD",0,0,0,14,4.1,"https://www.amazon.com/dp/B09T8D11LQ","57.40",false,false,false,false,"The Weird Crazy Monster Magic Colouring Book: Black Background 50+ Page Coloring Pages for Adults, Teenagers, Tweens, Olde...","https://m.media-amazon.com/images/I/712mHX4I68L._AC_UY218_.jpg"
8,10,593,"B08L8CYQ1Z",true,0,"USD",17.35,17.35,100,430,4.8,"https://www.amazon.com/dp/B08L8CYQ1Z","2064.00",false,false,false,false,"Raising a Strong Daughter in a Toxic Culture: 11 Steps to Keep Her Happy, Healthy, and Safe","https://m.media-amazon.com/images/I/81eMUUv5zRL._AC_UY218_.jpg"
8,11,594,"1952842239",false,16.92,"USD",0,0,0,3176,4.7,"https://www.amazon.com/dp/1952842239","14927.20",false,false,false,false,"The Cursive Handwriting Workbook for Teens: Learn the Art of Penmanship in this Cursive Writing Practice book with Motivat...","https://m.media-amazon.com/images/I/61gZ+Wwe2TL._AC_UY218_.jpg"
8,12,595,"0814436226",false,12.49,"USD",0,0,0,128,4.5,"https://www.amazon.com/dp/0814436226","576.00",false,false,false,false,"Eat Like a Champion: Performance Nutrition for Your Young Athlete","https://m.media-amazon.com/images/I/71QX5wYO6OL._AC_UY218_.jpg"
8,13,596,"B0BL5QNTCZ",false,5.99,"USD",0,0,0,40,4.9,"https://www.amazon.com/dp/B0BL5QNTCZ","196.00",false,false,false,false,"The Undefeated Athlete: How to be a Champion in Any Sport","https://m.media-amazon.com/images/I/712pFhcAMmL._AC_UY218_.jpg"
8,14,597,"006056721X",true,10.99,"USD",14.99,4,26.68,146,4.4,"https://www.amazon.com/dp/006056721X","642.40",false,false,false,false,"Rescuing Your Teenager from Depression","https://m.media-amazon.com/images/I/711Jh2gqtlL._AC_UY218_.jpg"
8,15,598,"B094SXTJYZ",false,0,"USD",0,0,0,62,4.5,"https://www.amazon.com/dp/B094SXTJYZ","279.00",false,false,false,false,"The Ultimate Puzzle Book for Teens: Activity Book with Logic Puzzles, Brain Teasers, Word Search and more for Teenagers (A...","https://m.media-amazon.com/images/I/71+SdhKGMsS._AC_UY218_.jpg"
8,16,599,"B0BLB6Y7VW",true,7.24,"USD",11.85,4.61,38.9,152,4.8,"https://www.amazon.com/dp/B0BLB6Y7VW","729.60",false,false,false,false,"Adult Life Skills for Older Teens, Home Edition: Learn to Cook, Maintain a Home, and Everything You Need to Know About Ren...","https://m.media-amazon.com/images/I/71SxQDtUh2L._AC_UY218_.jpg"
9,9,600,"1540902447",true,13.23,"USD",17.99,4.76,26.46,12,4.5,"https://www.amazon.com/dp/1540902447","54.00",false,false,false,false,"3 Big Questions That Shape Your Future","https://m.media-amazon.com/images/I/610aGZGf45L._AC_UY218_.jpg"
9,10,601,"1958134104",false,0,"USD",0,0,0,305,4.9,"https://www.amazon.com/dp/1958134104","1494.50",false,false,false,false,"Life Skills for Teens: The ultimate guide for Young Adults on how to manage money, cook, clean, find a job, make better de...","https://m.media-amazon.com/images/I/617AyUazFvL._AC_UY218_.jpg"
9,11,602,"B0BBY2JQYJ",true,9.99,"USD",14.99,5,33.36,13,5,"https://www.amazon.com/dp/B0BBY2JQYJ","65.00",false,false,false,false,"It Doesn't Start with a Punch: My Journey through an Abusive Teen Dating Relationship","https://m.media-amazon.com/images/I/61gj02QOELL._AC_UY218_.jpg"
9,12,603,"1684037360",true,0,"USD",13.99,13.99,100,1200,4.6,"https://www.amazon.com/dp/1684037360","5520.00",false,false,false,false,"Don't Let Your Emotions Run Your Life for Teens: Dialectical Behavior Therapy Skills for Helping You Manage Mood Swings, C...","https://m.media-amazon.com/images/I/817fd-PYhJL._AC_UY218_.jpg"
9,13,604,"0593196929",false,9.99,"USD",0,0,0,1028,4.8,"https://www.amazon.com/dp/0593196929","4934.40",false,false,true,false,"Preteen Devotional for Girls: 52 Weeks of Encouraging Devotions and Scripture for Tweens","https://m.media-amazon.com/images/I/81dfLoNdDcL._AC_UY218_.jpg"
9,14,605,"1524771031",true,35.99,"USD",54.95,18.96,34.5,13377,4.7,"https://www.amazon.com/dp/1524771031","62871.90",false,false,false,false,"The Maze Runner Series Complete Collection Boxed Set (5-Book)","https://m.media-amazon.com/images/I/91ursHQHlLL._AC_UY218_.jpg"
9,15,606,"1647397766",true,14.33,"USD",16.99,2.66,15.66,1927,4.6,"https://www.amazon.com/dp/1647397766","8864.20",false,false,false,false,"Therapy Games for Teens: 150 Activities to Improve Self-Esteem, Communication, and Coping Skills","https://m.media-amazon.com/images/I/71DUwvxRrGL._AC_UY218_.jpg"
9,16,607,"1686160569",false,0,"USD",0,0,0,616,4.2,"https://www.amazon.com/dp/1686160569","2587.20",false,false,false,false,"Would You Rather for Teens: 200 Funny and Silly ‘Would You Rather Questions’ for Long Car Rides (Travel Games for Teenager...","https://m.media-amazon.com/images/I/51ykPrgoDCL._AC_UY218_.jpg"
10,9,608,"162995893X",false,9.99,"USD",0,0,0,42,4.8,"https://www.amazon.com/dp/162995893X","201.60",false,false,false,false,"Age of Opportunity: A Biblical Guide to Parenting Teens","https://m.media-amazon.com/images/I/61s9J-60rgL._AC_UY218_.jpg"
10,10,609,"B0892HW4KZ",false,9.37,"USD",0,0,0,371,4.5,"https://www.amazon.com/dp/B0892HW4KZ","1669.50",false,false,false,false,"Activity Book for Teens: Puzzle Book and Brain Teasers for Teenagers","https://m.media-amazon.com/images/I/61bTA9xfwrL._AC_UY218_.jpg"
10,11,610,"B07K1LXLMN",true,0,"USD",17.35,17.35,100,132,4.6,"https://www.amazon.com/dp/B07K1LXLMN","607.20",false,false,false,false,"Ending the Parent-Teen Control Battle: Resolve the Power Struggle and Build Trust, Responsibility, and Respect","https://m.media-amazon.com/images/I/81mV693LpOL._AC_UY218_.jpg"
10,12,611,"B0BCSLS8PV",false,0,"USD",0,0,0,11,4.9,"https://www.amazon.com/dp/B0BCSLS8PV","53.90",false,false,false,false,"BRUH YOU GOT THIS: Affirmations For Young Men","https://m.media-amazon.com/images/I/613MooJta0L._AC_UY218_.jpg"
10,13,612,"0310668735",true,12.74,"USD",14.99,2.25,15.01,103,4.5,"https://www.amazon.com/dp/0310668735","463.50",false,false,false,false,"TalkSheets to Confirm the Faith of Your Teenagers: 52 Ready-to-Use Discussions","https://m.media-amazon.com/images/I/91O95acYO0L._AC_UY218_.jpg"
10,14,613,"1642502448",true,0,"USD",26.09,26.09,100,275,4.7,"https://www.amazon.com/dp/1642502448","1292.50",false,false,true,false,"Trust the Grind: How World-Class Athletes Got To The Top (Motivational Book for Teens, Gift for Teen Boys, Teen and Young ...","https://m.media-amazon.com/images/I/71ugg3v+8iL._AC_UY218_.jpg"
10,15,614,"B09MJ4ZVYH",true,10.59,"USD",15.99,5.4,33.77,61,4.8,"https://www.amazon.com/dp/B09MJ4ZVYH","292.80",false,false,false,false,"Write Through It: A Guided Journal for Teen Girls: Inspiring Prompts to Beat Stress, Boost Self-esteem, and Build Healthy ...","https://m.media-amazon.com/images/I/612vQZjV7kL._AC_UY218_.jpg"
10,16,615,"0374303231",true,0,"USD",18.26,18.26,100,3518,4.5,"https://www.amazon.com/dp/0374303231","15831.00",false,false,false,false,"The 57 Bus: A True Story of Two Teenagers and the Crime That Changed Their Lives","https://m.media-amazon.com/images/I/81WxHPCjCZL._AC_UY218_.jpg"
11,9,616,"163570104X",true,0,"USD",6.04,6.04,100,259,4.6,"https://www.amazon.com/dp/163570104X","1191.40",false,false,false,false,"Seen: Despair and Anxiety in Kids and Teenagers and the Power of Connection","https://m.media-amazon.com/images/I/6197FvL9Z3L._AC_UY218_.jpg"
11,10,617,"B0BR4MR5JB",false,0,"USD",0,0,0,1,3,"https://www.amazon.com/dp/B0BR4MR5JB","3.00",false,false,false,false,"Coloring book for Girls teens and Adults: Activity book for Girls ages 10-12, with 50 beautiful drawings, perfect for teen...","https://m.media-amazon.com/images/I/71bMKWtzFlL._AC_UY218_.jpg"
11,11,618,"1610023854",true,12.69,"USD",16.95,4.26,25.13,233,4.7,"https://www.amazon.com/dp/1610023854","1095.10",false,false,false,false,"Building Resilience in Children and Teens: Giving Kids Roots and Wings","https://m.media-amazon.com/images/I/61FlOAtt7cL._AC_UY218_.jpg"
11,12,619,"1626259844",true,9.97,"USD",15.15,5.18,34.19,309,4.6,"https://www.amazon.com/dp/1626259844","1421.40",false,false,false,false,"The Self-Compassion Workbook for Teens: Mindfulness and Compassion Skills to Overcome Self-Criticism and Embrace Who You Are","https://m.media-amazon.com/images/I/816lP-sC-YL._AC_UY218_.jpg"
11,13,620,"1950968766",false,0,"USD",0,0,0,138,4.7,"https://www.amazon.com/dp/1950968766","648.60",false,false,false,false,"Prayer Journal for Teen Girls: 52-Week Scripture, Devotional, & Guided Prayer Journal","https://m.media-amazon.com/images/I/81hOERjnw7L._AC_UY218_.jpg"
11,14,621,"B0BB5QQ7ZG",false,0,"USD",0,0,0,105,4.8,"https://www.amazon.com/dp/B0BB5QQ7ZG","504.00",false,false,true,false,"On Your Mark, Get Set, INVEST: A Kid's Guide to Saving Money, Spending Wisely, and Investing in the Stock Market (Invest N...","https://m.media-amazon.com/images/I/71g-+31HVRL._AC_UY218_.jpg"
11,15,622,"0743229967",true,12.99,"USD",17,4.01,23.59,1019,4.6,"https://www.amazon.com/dp/0743229967","4687.40",false,false,false,false,"The Motley Fool Investment Guide for Teens: 8 Steps to Having More Money Than Your Parents Ever Dreamed Of","https://m.media-amazon.com/images/I/714Shk-KyfL._AC_UY218_.jpg"
11,16,623,"B0B92QYZ44",false,0,"USD",0,0,0,3,4.6,"https://www.amazon.com/dp/B0B92QYZ44","13.80",false,false,false,false,"My First Period Tracker: for Girls & Teens - Colorful Kawaii Cats Design - Period Tracking Journal for First Period Starte...","https://m.media-amazon.com/images/I/71MpRNh6lmL._AC_UY218_.jpg"
12,9,624,"1623611199",true,9.99,"USD",16.95,6.96,41.06,1084,4.8,"https://www.amazon.com/dp/1623611199","5203.20",false,false,false,false,"Chicken Soup for the Teenage Soul on Tough Stuff: Stories of Tough Times and Lessons Learned","https://m.media-amazon.com/images/I/51T3A1wvz5L._AC_UY218_.jpg"
12,10,625,"1641260270",false,6.99,"USD",0,0,0,327,4.7,"https://www.amazon.com/dp/1641260270","1536.90",false,false,false,false,"Coloring Books for Boys: Animal Designs: Detailed Animal Drawings for Older Boys & Teenagers; Zendoodle Wolves, Lions, Mon...","https://m.media-amazon.com/images/I/71mzdDFBvgL._AC_UY218_.jpg"
12,11,626,"0375842209",true,0,"USD",23.9,23.9,100,65855,4.6,"https://www.amazon.com/dp/0375842209","302933.00",false,false,true,false,"The Book Thief","https://m.media-amazon.com/images/I/914h7ms4FXL._AC_UY218_.jpg"
12,12,627,"0802425070",true,0,"USD",13,13,100,81,4.7,"https://www.amazon.com/dp/0802425070","380.70",false,false,false,false,"Things I Wish I'd Known Before My Child Became a Teenager","https://m.media-amazon.com/images/I/81L8tGZUCKS._AC_UY218_.jpg"
12,13,628,"1607749769",true,11,"USD",16.99,5.99,35.26,6301,4.8,"https://www.amazon.com/dp/1607749769","30244.80",false,false,false,false,"Women in Science: 50 Fearless Pioneers Who Changed the World","https://m.media-amazon.com/images/I/918fCYeEP3L._AC_UY218_.jpg"
12,14,629,"1535949880",true,7.55,"USD",8.99,1.44,16.02,380,4.8,"https://www.amazon.com/dp/1535949880","1824.00",false,false,false,false,"Revealed: Discovering Your True Identity in Christ for Teen Boys and Young Men","https://m.media-amazon.com/images/I/81eVB4DV+ML._AC_UY218_.jpg"
12,15,630,"1433570750",true,14.09,"USD",14.99,0.9,6,88,4.5,"https://www.amazon.com/dp/1433570750","396.00",false,false,false,false,"Why Is My Teenager Feeling Like This?: A Guide for Helping Teens through Anxiety and Depression","https://m.media-amazon.com/images/I/713zVVA6bVL._AC_UY218_.jpg"
12,16,631,"0736966013",true,10.49,"USD",13.99,3.5,25.02,1048,4.8,"https://www.amazon.com/dp/0736966013","5030.40",false,false,false,false,"The Power of a Praying Teen","https://m.media-amazon.com/images/I/81KtNe2zm2L._AC_UY218_.jpg"
13,9,632,"014242207X",true,0,"USD",28,28,100,2533,4.7,"https://www.amazon.com/dp/014242207X","11905.10",false,false,false,false,"Legend","https://m.media-amazon.com/images/I/A1MEgpPSzIL._AC_UY218_.jpg"
13,10,633,"B0BZFNYZQV",false,0,"USD",0,0,0,20,4.9,"https://www.amazon.com/dp/B0BZFNYZQV","98.00",false,false,false,false,"Self-Esteem for Teens: Mastering Self-Love and Building Limitless Confidence – A Proven Path to Transform Your Life and Ac...","https://m.media-amazon.com/images/I/61ZVJ83d9JL._AC_UY218_.jpg"
13,11,634,"1735854441",false,0,"USD",0,0,0,175,5,"https://www.amazon.com/dp/1735854441","875.00",false,false,false,false,"52 Modern Manners for Today's Teens (2)","https://m.media-amazon.com/images/I/41Mg4h2zG3L._AC_UY218_.jpg"
13,12,635,"1626258562",true,14.95,"USD",18.95,4,21.11,204,4.6,"https://www.amazon.com/dp/1626258562","938.40",false,false,false,false,"The Grit Guide for Teens: A Workbook to Help You Build Perseverance, Self-Control, and a Growth Mindset","https://m.media-amazon.com/images/I/71RBxFD4QhL._AC_UY218_.jpg"
13,13,636,"B08W7DPR8C",false,4.49,"USD",0,0,0,181,4.6,"https://www.amazon.com/dp/B08W7DPR8C","832.60",false,false,false,false,"Devotional for Teen Girls: 3-minute Devotions and Daily Inspirations from The Bible for Teenage Girls (Bible for Girls)","https://m.media-amazon.com/images/I/61zXz4P3UVL._AC_UY218_.jpg"
13,14,637,"0060957298",true,7.49,"USD",13.99,6.5,46.46,50,4.7,"https://www.amazon.com/dp/0060957298","235.00",false,false,false,false,"But I Love Him: Protecting Your Teen Daughter from Controlling, Abusive Dating Relationships","https://m.media-amazon.com/images/I/41MivuHR5CL._AC_UY218_.jpg"
13,15,638,"1893005658",true,11.96,"USD",17.99,6.03,33.52,16,4.5,"https://www.amazon.com/dp/1893005658","72.00",false,false,false,false,"Tired Teens: Understanding and Conquering Chronic Fatigue and POTS.: Understanding and conquering chronic fatigue and POTS","https://m.media-amazon.com/images/I/81eeXsspYdL._AC_UY218_.jpg"
13,16,639,"B0BJYD467S",true,0,"USD",14.95,14.95,100,91,4.9,"https://www.amazon.com/dp/B0BJYD467S","445.90",false,false,false,false,"Social Anxiety Workbook for Teens: 10-Minute Activities and Tools to Reduce Stress, Conquer Fear, and Boost Social Confidence","https://m.media-amazon.com/images/I/61A1lIEgEAL._AC_UY218_.jpg"
14,9,640,"1626251886",true,0,"USD",17.49,17.49,100,367,4.7,"https://www.amazon.com/dp/1626251886","1724.90",false,false,false,false,"Parenting a Teen Who Has Intense Emotions: DBT Skills to Help Your Teen Navigate Emotional and Behavioral Challenges","https://m.media-amazon.com/images/I/41gn953UV9L._AC_UY218_.jpg"
14,10,641,"1611590817",true,9.99,"USD",14.95,4.96,33.18,64,4.5,"https://www.amazon.com/dp/1611590817","288.00",false,false,false,false,"Chicken Soup for the Teenage Soul 25th Anniversary Edition: An Update of the 1997 Classic","https://m.media-amazon.com/images/I/71lCUYZ3k9S._AC_UY218_.jpg"
14,11,642,"B0B2TRD534",true,8.5,"USD",12.99,4.49,34.57,32,4.4,"https://www.amazon.com/dp/B0B2TRD534","140.80",false,false,true,false,"North Woods Survival: Train to Nowhere: A Wilderness Adventure Thriller (North Woods Survival Series)","https://m.media-amazon.com/images/I/71ENyc0VdzL._AC_UY218_.jpg"
14,13,644,"B09FS126RT",false,0,"USD",0,0,0,26,4.7,"https://www.amazon.com/dp/B09FS126RT","122.20",false,false,false,false,"Graphic Novel Blank Book: Graphic Novel Book for Adults Teenagers & Kids – Make Your Own Comic Book | Blank Comic Book Tem...","https://m.media-amazon.com/images/I/51g1UjZjDIL._AC_UY218_.jpg"
14,14,645,"0884194353",false,0,"USD",0,0,0,83,4.8,"https://www.amazon.com/dp/0884194353","398.40",false,false,false,false,"Every Day I Pray for My Teenager","https://m.media-amazon.com/images/I/61CP8jx11sL._AC_UY218_.jpg"
14,15,646,"1433571668",true,0,"USD",9.12,9.12,100,570,4.7,"https://www.amazon.com/dp/1433571668","2679.00",false,false,false,false,"10 Questions Every Teen Should Ask (and Answer) about Christianity","https://m.media-amazon.com/images/I/51aydsldRFL._AC_UY218_.jpg"
14,16,647,"0062654071",true,11.86,"USD",18.99,7.13,37.55,621,4.7,"https://www.amazon.com/dp/0062654071","2918.70",false,false,false,false,"The Grown-Up's Guide to Teenage Humans: How to Decode Their Behavior, Develop Trust, and Raise a Respectable Adult","https://m.media-amazon.com/images/I/71aM00O33xL._AC_UY218_.jpg"
15,9,648,"B0BJY9NKBS",false,0,"USD",0,0,0,5,4.8,"https://www.amazon.com/dp/B0BJY9NKBS","24.00",false,false,false,false,"Vision Board Clip Art Book For Teen Girls: Vision Board Supplies For Teens With Pictures, Quotes and Words For Teen Girls ...","https://m.media-amazon.com/images/I/71b+FsatlJL._AC_UY218_.jpg"
15,10,649,"1915833027",false,0,"USD",0,0,0,1,5,"https://www.amazon.com/dp/1915833027","5.00",false,false,false,false,"Life Skills for Tweens Workbook: How to Cook, Make Friends, Be Self Confident and Healthy. Everything a Pre Teen Should Kn...","https://m.media-amazon.com/images/I/613lDR954aL._AC_UY218_.jpg"
15,11,650,"1414313748",true,14,"USD",16.99,2.99,17.6,56,4.7,"https://www.amazon.com/dp/1414313748","263.20",false,false,false,false,"The One Year Alive Devotions for Students","https://m.media-amazon.com/images/I/41msxU5GhAL._AC_UY218_.jpg"
15,13,652,"9189700996",true,4.99,"USD",11.95,6.96,58.24,18,4.9,"https://www.amazon.com/dp/9189700996","88.20",false,false,false,false,"Teen Study Bible for Boys: 52-Week Teen Bible Guide for Boys","https://m.media-amazon.com/images/I/614OV7qq-wL._AC_UY218_.jpg"
15,14,653,"0593435672",false,7.99,"USD",0,0,0,130,4.5,"https://www.amazon.com/dp/0593435672","585.00",false,false,false,false,"Would You Rather? Teen Challenge Edition: Funny Questions & Lively Competition for Original Thinkers","https://m.media-amazon.com/images/I/81U6ENl1e2L._AC_UY218_.jpg"
