"position.page","position.position","position.global_position","asin","price.discounted","price.current_price","price.currency","price.before_price","price.savings_amount","price.savings_percent","reviews.total_reviews","reviews.rating","url","score","sponsored","amazonChoice","bestSeller","amazonPrime","title","thumbnail"
28,9,752,"0440509009",true,13.5,"USD",18,4.5,25,679,4.7,"https://www.amazon.com/dp/0440509009","3191.30",false,false,false,false,"Protecting the Gift: Keeping Children and Teenagers Safe (and Parents Sane)","https://m.media-amazon.com/images/I/81ZD1IennbL._AC_UY218_.jpg"
28,10,753,"1787758370",true,0,"USD",20.9,20.9,100,48,4.8,"https://www.amazon.com/dp/1787758370","230.40",false,false,true,false,"The Asperkid's (Secret) Book of Social Rules, 10th Anniversary Edition","https://m.media-amazon.com/images/I/712RuFRsX1L._AC_UY218_.jpg"
28,11,754,"0440419514",true,19.99,"USD",26.97,6.98,25.88,20682,4.7,"https://www.amazon.com/dp/0440419514","97205.40",false,false,false,false,"His Dark Materials 3-Book Paperback Boxed Set: The Golden Compass; The Subtle Knife; The Amber Spyglass","https://m.media-amazon.com/images/I/81NXklproRL._AC_UY218_.jpg"
28,12,755,"B08FP9XCGQ",false,0,"USD",0,0,0,2610,4.7,"https://www.amazon.com/dp/B08FP9XCGQ","12267.00",false,false,false,false,"Amazing Animals: Adult Coloring Book, Stress Relieving Mandala Animal Designs","https://m.media-amazon.com/images/I/81KsDOlhloL._AC_UY218_.jpg"
28,13,756,"B0886JWK5N",true,0,"USD",23.9,23.9,100,871,4.5,"https://www.amazon.com/dp/B0886JWK5N","3919.50",false,false,true,false,"Midnight Sun","https://m.media-amazon.com/images/I/81o43rQ2rZL._AC_UY218_.jpg"
28,14,757,"0593521048",false,0,"USD",0,0,0,8,4.7,"https://www.amazon.com/dp/0593521048","37.60",false,false,false,false,"Nothing But Net Mad Libs: World's Greatest Word Game","https://m.media-amazon.com/images/I/81v4hgOAa1L._AC_UY218_.jpg"
28,15,758,"164473558X",true,9.99,"USD",13.95,3.96,28.39,4,4.4,"https://www.amazon.com/dp/164473558X","17.60",false,false,false,false,"Furia (Spanish Edition)","https://m.media-amazon.com/images/I/81scqAUNo1L._AC_UY218_.jpg"
29,9,760,"0385751532",true,0,"USD",11.99,11.99,100,27003,4.6,"https://www.amazon.com/dp/0385751532","124213.80",false,false,false,false,"The Boy in the Striped Pajamas","https://m.media-amazon.com/images/I/91D5yGPPw9L._AC_UY218_.jpg"
29,10,761,"160433696X",false,7.99,"USD",0,0,0,5703,4.6,"https://www.amazon.com/dp/160433696X","26233.80",false,false,false,false,"True Facts That Sound Like Bull$#*t: 500 Insane-But-True Facts That Will Shock and Impress Your Friends (Funny Book, Refer...","https://m.media-amazon.com/images/I/717LVXvk3zL._AC_UY218_.jpg"
29,11,762,"1638073864",false,0,"USD",0,0,0,874,4.7,"https://www.amazon.com/dp/1638073864","4107.80",false,false,false,false,"Self-Love Journal for Teen Girls: Prompts and Practices to Inspire Confidence and Celebrate You","https://m.media-amazon.com/images/I/61sWSSuAa5L._AC_UY218_.jpg"
29,12,763,"0830844872",true,8.89,"USD",17,8.11,47.71,32,4.5,"https://www.amazon.com/dp/0830844872","144.00",false,false,false,false,"Understanding Your Teen: Shaping Their Character, Facing Their Realities","https://m.media-amazon.com/images/I/71BBVe7w85L._AC_UY218_.jpg"
29,13,764,"1684036399",true,12.58,"USD",16.95,4.37,25.78,26,4.3,"https://www.amazon.com/dp/1684036399","111.80",false,false,false,false,"Mindfulness and Self-Compassion for Teen ADHD: Build Executive Functioning Skills, Increase Motivation, and Improve Self-C...","https://m.media-amazon.com/images/I/712VZiTPE8L._AC_UY218_.jpg"
29,14,765,"B0BPGKGCBF",true,0,"USD",14.95,14.95,100,16,5,"https://www.amazon.com/dp/B0BPGKGCBF","80.00",false,false,false,false,"World War 2 for Teens: Amazing Facts, Key Players, Heroic Acts, Major Battles, and How the War Changed the World (What You...","https://m.media-amazon.com/images/I/61LbOKlqdgL._AC_UY218_.jpg"
29,15,766,"B09W2QQRB3",false,0,"USD",0,0,0,108,4.6,"https://www.amazon.com/dp/B09W2QQRB3","496.80",false,false,false,false,"Fun Animals Coloring Book: 40 Cool, Creative and Original Animal Pictures for Tweens and Teens","https://m.media-amazon.com/images/I/61n+isqIM4L._AC_UY218_.jpg"
29,16,767,"1623611229",true,0,"USD",7.28,7.28,100,268,4.8,"https://www.amazon.com/dp/1623611229","1286.40",false,false,false,false,"Chicken Soup for the Teenage Soul II: More Stories of Life, Love and Learning","https://m.media-amazon.com/images/I/81CfqWtbnJL._AC_UY218_.jpg"
30,9,768,"1915736021",false,0,"USD",0,0,0,70,4.6,"https://www.amazon.com/dp/1915736021","322.00",false,false,false,false,"Stock Market Investing For Teens Made Easy: In 5 Steps You Will Discover The Secret Path to Becoming a Millionaire Investo...","https://m.media-amazon.com/images/I/61in6ZR-uVL._AC_UY218_.jpg"
30,10,769,"0578660636",false,0,"USD",0,0,0,928,4.6,"https://www.amazon.com/dp/0578660636","4268.80",false,false,true,false,"Mental Toughness For Young Athletes: Eight Proven 5-Minute Mindset Exercises For Kids And Teens Who Play Competitive Sports","https://m.media-amazon.com/images/I/612ljYfr74L._AC_UY218_.jpg"
30,11,770,"0064401847",true,0,"USD",8.49,8.49,100,9936,4.7,"https://www.amazon.com/dp/0064401847","46699.20",false,false,false,false,"Bridge to Terabithia","https://m.media-amazon.com/images/I/81pkNSvYgJL._AC_UY218_.jpg"
30,12,771,"1400324394",true,0,"USD",13.68,13.68,100,241,4.8,"https://www.amazon.com/dp/1400324394","1156.80",false,false,false,false,"Jesus Calling: 50 Devotions to Grow in Your Faith","https://m.media-amazon.com/images/I/815Jp5z6zxL._AC_UY218_.jpg"
30,13,772,"0984003126",true,12.79,"USD",14.95,2.16,14.45,6,5,"https://www.amazon.com/dp/0984003126","30.00",false,false,false,false,"The Warrior Teenager: Let Go of Self-Sabotage & Embrace Your True Power","https://m.media-amazon.com/images/I/61u0SsAZndL._AC_UY218_.jpg"
30,14,773,"1879651270",true,8.49,"USD",9.95,1.46,14.67,89,4.5,"https://www.amazon.com/dp/1879651270","400.50",false,false,false,false,"Healing Your Grieving Heart for Kids: 100 Practical Ideas (Healing Your Grieving Heart series)","https://m.media-amazon.com/images/I/41cJD7aTIuL._AC_UY218_.jpg"
30,15,774,"1983678244",false,0,"USD",0,0,0,3,5,"https://www.amazon.com/dp/1983678244","15.00",false,false,false,false,"MMA - Mixed Martial Arts - Coloring Book for Teenagers & Adults: Color MMA Action for UFC Fans","https://m.media-amazon.com/images/I/51XCzEbFcsL._AC_UY218_.jpg"
31,9,776,"1338186531",true,0,"USD",25.19,25.19,100,1386,4.5,"https://www.amazon.com/dp/1338186531","6237.00",false,false,false,false,"That's Not What Happened","https://m.media-amazon.com/images/I/61AJ8Xx8XyL._AC_UY218_.jpg"
31,10,777,"B0BH4XWJ47",true,0,"USD",17.35,17.35,100,64,4.8,"https://www.amazon.com/dp/B0BH4XWJ47","307.20",false,false,false,false,"In Your Powerzone: Elevate Your Social Skills And Self-Esteem, Tackle Social Anxiety, And Build Your Confidence Without Bu...","https://m.media-amazon.com/images/I/71om03kyORL._AC_UY218_.jpg"
31,11,778,"1970147865",false,0,"USD",0,0,0,1,5,"https://www.amazon.com/dp/1970147865","5.00",false,false,false,false,"Love Who You Are: A Gift Book to Celebrate Your Self-Worth","https://m.media-amazon.com/images/I/81MRd-iPwvL._AC_UY218_.jpg"
31,12,779,"1672009057",false,0,"USD",0,0,0,113,4.2,"https://www.amazon.com/dp/1672009057","474.60",false,false,false,false,"The Try Not to Laugh Challenge Joke Book Teen Edition, Teenager Jokes & Tricky Riddles: Hilarious Interactive Game for Tee...","https://m.media-amazon.com/images/I/51kcZSktClL._AC_UY218_.jpg"
31,14,781,"096592288X",false,16,"USD",0,0,0,179,4.6,"https://www.amazon.com/dp/096592288X","823.40",false,false,false,false,"Did Adam & Eve Have Belly Buttons? And 199 Other Questions from Catholic Teenagers","https://m.media-amazon.com/images/I/51utl-ntgeL._AC_UY218_.jpg"
31,15,782,"1591281105",false,0,"USD",0,0,0,376,4.7,"https://www.amazon.com/dp/1591281105","1767.20",false,false,false,false,"Future Men: Raising Boys to Fight Giants (Family)","https://m.media-amazon.com/images/I/61F-tcK0VqL._AC_UY218_.jpg"
31,16,783,"1936976846",true,10.96,"USD",14.99,4.03,26.88,94,4.4,"https://www.amazon.com/dp/1936976846","413.60",false,false,false,false,"Sex: An Uncensored Introduction","https://m.media-amazon.com/images/I/81rURCA85ML._AC_UY218_.jpg"
32,9,784,"1984896393",true,0,"USD",22.92,22.92,100,35947,4.5,"https://www.amazon.com/dp/1984896393","161761.50",false,false,true,false,"A Good Girl's Guide to Murder","https://m.media-amazon.com/images/I/81jasyjB5LL._AC_UY218_.jpg"
32,10,785,"2492412032",false,0,"USD",0,0,0,18,4.7,"https://www.amazon.com/dp/2492412032","84.60",false,false,false,false,"Prayer Journal for Teen Girls: 52 Week Christian Devotional and Guided Prayer Journal","https://m.media-amazon.com/images/I/71IBXu4y17L._AC_UY218_.jpg"
32,11,786,"1957590327",true,7.24,"USD",11.99,4.75,39.62,143,4.5,"https://www.amazon.com/dp/1957590327","643.50",false,false,false,false,"Investing for Young Adults: How to Earn, Save, Invest, Grow Your Money and Retire Early!","https://m.media-amazon.com/images/I/61KdS6dsQ+L._AC_UY218_.jpg"
32,12,787,"B0BW9SM1F2",false,0,"USD",0,0,0,6,4.3,"https://www.amazon.com/dp/B0BW9SM1F2","25.80",false,false,false,false,"Pride High : Book 2 - Orange","https://m.media-amazon.com/images/I/81P2sow8a8L._AC_UY218_.jpg"
32,13,788,"1952842646",false,0,"USD",0,0,0,180,4.8,"https://www.amazon.com/dp/1952842646","864.00",false,false,true,false,"The Prayer Journal for Teen Girls: A Daily Christian Journal for Teenage and Preteen Girls to Practice Gratitude, Reduce A...","https://m.media-amazon.com/images/I/81H-0a2AfSL._AC_UY218_.jpg"
32,14,789,"B08ZW2GGZZ",false,3.99,"USD",0,0,0,6,4.8,"https://www.amazon.com/dp/B08ZW2GGZZ","28.80",false,false,false,false,"Are You Ready to Be Baptized?: A Teen's Guide to Making the Most Important Decision of Your Life (Are You Ready (for Chris...","https://m.media-amazon.com/images/I/61v7ncqSu4L._AC_UY218_.jpg"
32,15,790,"1626258538",true,13.99,"USD",18.2,4.21,23.13,42,4.4,"https://www.amazon.com/dp/1626258538","184.80",false,false,false,false,"Grief Recovery for Teens: Letting Go of Painful Emotions with Body-Based Practices (The Instant Help Solutions Series)","https://m.media-amazon.com/images/I/71eqLSe2tLL._AC_UY218_.jpg"
32,16,791,"1557047650",true,13.99,"USD",24.99,11,44.02,820,4.4,"https://www.amazon.com/dp/1557047650","3608.00",false,false,false,false,"What's Happening to My Body? Book for Boys: Revised Edition","https://m.media-amazon.com/images/I/41Tx5gE5ZVL._AC_UY218_.jpg"
33,9,792,"B0B2V25KW7",true,0,"USD",13,13,100,81,4.6,"https://www.amazon.com/dp/B0B2V25KW7","372.60",false,false,false,false,"POSITIVE PARENTING AND DISCIPLINE TOOLS TO RAISE GOOD KIDS: A MINDFUL, PRACTICAL, AND LOVING APPROACH TO RAISING EMOTIONAL...","https://m.media-amazon.com/images/I/61eJDJ5qdNL._AC_UY218_.jpg"
33,10,793,"1630588571",true,4.74,"USD",4.99,0.25,5.01,1857,4.8,"https://www.amazon.com/dp/1630588571","8913.60",false,false,false,false,"3-Minute Devotions for Guys: 180 Encouraging Readings for Teens","https://m.media-amazon.com/images/I/61WRtvF8HSL._AC_UY218_.jpg"
33,11,794,"1794173277",false,7.24,"USD",0,0,0,3398,4.6,"https://www.amazon.com/dp/1794173277","15630.80",false,false,true,false,"THINGS WE DON’T TALK ABOUT","https://m.media-amazon.com/images/I/412HgC99pzL._AC_UY218_.jpg"
33,12,795,"B09BGF8FZP",false,0,"USD",0,0,0,125,4.5,"https://www.amazon.com/dp/B09BGF8FZP","562.50",false,false,false,false,"10 000 Words Word Search Puzzle Book for Adults and Teens: 500 Puzzles","https://m.media-amazon.com/images/I/71YC20i+EHL._AC_UY218_.jpg"
33,13,796,"0593196791",true,0.99,"USD",19.95,18.96,95.04,3117,4.6,"https://www.amazon.com/dp/0593196791","14338.20",false,false,true,false,"Would You Rather? Made You Think! Edition: Answer Hilarious Questions and Win the Game of Wits","https://m.media-amazon.com/images/I/71X-fCOvK3L._AC_UY218_.jpg"
33,14,797,"1974558207",true,3.99,"USD",6.99,3,42.92,185,3.7,"https://www.amazon.com/dp/1974558207","684.50",false,false,false,false,"101 Mom Jokes: Like Dad Jokes, Only Smarter","https://m.media-amazon.com/images/I/51pTFPFk89L._AC_UY218_.jpg"
33,15,798,"1979408440",false,0,"USD",0,0,0,13,3.3,"https://www.amazon.com/dp/1979408440","42.90",false,false,false,false,"The Adventuresome Teenager's Travel Guide to London","https://m.media-amazon.com/images/I/71RGrBot9aL._AC_UY218_.jpg"
33,16,799,"B0C14JRW31",false,0,"USD",0,0,0,7,5,"https://www.amazon.com/dp/B0C14JRW31","35.00",false,false,false,false,"Joke Book For Teens: Funny Jokes For 13-17 Year Olds","https://m.media-amazon.com/images/I/71GbLrUDL9L._AC_UY218_.jpg"
34,9,800,"0595479731",false,0,"USD",0,0,0,68,4.3,"https://www.amazon.com/dp/0595479731","292.40",false,false,false,false,"Yellowstone National Park for Kids, Preteens, and Teenagers: A Grande Guides Series Book for Children","https://m.media-amazon.com/images/I/71sRdiDWmfL._AC_UY218_.jpg"
34,10,801,"1338356313",true,9.99,"USD",14.69,4.7,31.99,4,4.7,"https://www.amazon.com/dp/1338356313","18.80",false,false,true,false,"Sunshine: A Graphic Novel","https://m.media-amazon.com/images/I/71vwW2rACrL._AC_UY218_.jpg"
34,11,802,"1546595902",false,0,"USD",0,0,0,30817,4.6,"https://www.amazon.com/dp/1546595902","141758.20",false,false,true,false,"Difficult Riddles For Smart Kids: 300 Difficult Riddles And Brain Teasers Families Will Love (Thinking Books for Kids)","https://m.media-amazon.com/images/I/812F2oVcq5L._AC_UY218_.jpg"
34,13,804,"0316447315",true,30.99,"USD",57,26.01,45.63,232,4.8,"https://www.amazon.com/dp/0316447315","1113.60",false,false,false,false,"The Inheritance Games Collection","https://m.media-amazon.com/images/I/81datKAeh+L._AC_UY218_.jpg"
34,14,805,"0593450582",false,12.99,"USD",0,0,0,845,4.6,"https://www.amazon.com/dp/0593450582","3887.00",false,false,false,false,"Princeton Review SAT Premium Prep, 2023: 9 Practice Tests + Review & Techniques + Online Tools (College Test Preparation)","https://m.media-amazon.com/images/I/812lo4CiAnL._AC_UY218_.jpg"
34,15,806,"0062387243",true,8.6,"USD",14.99,6.39,42.63,17547,4.7,"https://www.amazon.com/dp/0062387243","82470.90",false,false,false,false,"Divergent (Divergent Series, 1)","https://m.media-amazon.com/images/I/81H1MhBbPbL._AC_UY218_.jpg"
34,16,807,"1881273393",false,0,"USD",0,0,0,181,4.7,"https://www.amazon.com/dp/1881273393","850.70",false,false,false,false,"The Five Love Languages of Teenagers","https://m.media-amazon.com/images/I/51NtOFWf2cL._AC_UY218_.jpg"
35,9,808,"B08BTX5H2J",false,0,"USD",0,0,0,4033,4.7,"https://www.amazon.com/dp/B08BTX5H2J","18955.10",false,false,true,false,"Easy Piano Sheet Music for Kids: A Beginners First Book of Easy to Play Classics | 40 Songs (Beginner Piano Books for Chil...","https://m.media-amazon.com/images/I/719nwQRNgfL._AC_UY218_.jpg"
35,10,809,"0999462903",false,0,"USD",0,0,0,153,4.7,"https://www.amazon.com/dp/0999462903","719.10",false,false,false,false,"Relax, Girl! You Got This: Your Guide to a Fun and Stress-Free High School Experience","https://m.media-amazon.com/images/I/71B86Ed25hL._AC_UY218_.jpg"
35,11,810,"0312535678",true,6,"USD",10.99,4.99,45.4,134,4.7,"https://www.amazon.com/dp/0312535678","629.80",false,false,false,false,"We Are Witnesses: Five Diaries Of Teenagers Who Died In The Holocaust","https://m.media-amazon.com/images/I/71vilrRY9AL._AC_UY218_.jpg"
35,12,811,"B08K41YJCB",false,0,"USD",0,0,0,38,4.5,"https://www.amazon.com/dp/B08K41YJCB","171.00",false,false,false,false,"I'm Awesome: Teen Self Esteem Journal, Workbook to Boost Self Esteem, Guide to Overcome Insecurities, Boost Your Confidenc...","https://m.media-amazon.com/images/I/51V8YJkrBJL._AC_UY218_.jpg"
35,13,812,"9358908254",false,0,"USD",0,0,0,4,4.4,"https://www.amazon.com/dp/9358908254","17.60",false,false,false,false,"How To Draw Book For Kids 8-12: A Simple and Easy Step-by-Step Guide Book to Draw Cute Creatures like Unicorns, Princesse...","https://m.media-amazon.com/images/I/61xhRk0ZWNL._AC_UY218_.jpg"
35,14,813,"1524876062",false,0,"USD",0,0,0,68,4.7,"https://www.amazon.com/dp/1524876062","319.60",false,false,false,false,"Escape from a Video Game: The Complete Series","https://m.media-amazon.com/images/I/714UBIWhX7L._AC_UY218_.jpg"
35,15,814,"B09M9X6XXJ",false,0,"USD",0,0,0,24,4.2,"https://www.amazon.com/dp/B09M9X6XXJ","100.80",false,false,false,false,"Activity Book for Teens: 180 Brain Games and Puzzles for Teenagers | Boredom Busters for Girls and Boys with Sudoku, Maze...","https://m.media-amazon.com/images/I/61qh9v272JL._AC_UY218_.jpg"
36,9,816,"0801019265",true,14.99,"USD",22.99,8,34.8,185,4.7,"https://www.amazon.com/dp/0801019265","869.50",false,false,false,false,"Growing With: Every Parent's Guide to Helping Teenagers and Young Adults Thrive in Their Faith, Family, and Future","https://m.media-amazon.com/images/I/71Tlhgni8ZL._AC_UY218_.jpg"
36,10,817,"B0BJYJTF36",false,0,"USD",0,0,0,65,4.7,"https://www.amazon.com/dp/B0BJYJTF36","305.50",false,false,false,false,"Simple Patterns Coloring Book: A Coloring Book Features Simple And Beautiful Pattern Designs For Stress Relief & Relaxation","https://m.media-amazon.com/images/I/71r2V7CqspL._AC_UY218_.jpg"
36,11,818,"B088GJFRP4",false,6.99,"USD",0,0,0,750,4.5,"https://www.amazon.com/dp/B088GJFRP4","3375.00",false,false,false,false,"Would You Rather? For Teens!: The Fun And Interactive Game Book For Teens! (Would You Rather Game Book)","https://m.media-amazon.com/images/I/51Iz1iOBp1L._AC_UY218_.jpg"
36,12,819,"1886941769",true,11.94,"USD",17.99,6.05,33.63,62,4.3,"https://www.amazon.com/dp/1886941769","266.60",false,false,false,false,"Train Your Brain for Success: A Teenager's Guide to Executive Functions","https://m.media-amazon.com/images/I/71QNh3XGh1L._AC_UY218_.jpg"
36,13,820,"0801072352",true,17.99,"USD",28,10.01,35.75,74,4.6,"https://www.amazon.com/dp/0801072352","340.40",false,false,false,false,"The Quick-Reference Guide to Counseling Teenagers","https://m.media-amazon.com/images/I/71DVNC-sI+L._AC_UY218_.jpg"
36,14,821,"1984896431",true,8.99,"USD",10.99,2,18.2,16556,4.6,"https://www.amazon.com/dp/1984896431","76157.60",false,false,false,false,"Good Girl, Bad Blood: The Sequel to A Good Girl's Guide to Murder","https://m.media-amazon.com/images/I/81Hm7zT8wsS._AC_UY218_.jpg"
36,15,822,"0316551368",true,37.99,"USD",52,14.01,26.94,3666,4.8,"https://www.amazon.com/dp/0316551368","17596.80",false,false,false,false,"The 100 Complete Boxed Set","https://m.media-amazon.com/images/I/916Erczn2yL._AC_UY218_.jpg"
36,16,823,"0385721609",true,12.88,"USD",17.95,5.07,28.25,67,4.4,"https://www.amazon.com/dp/0385721609","294.80",false,false,false,false,"The Primal Teen: What the New Discoveries about the Teenage Brain Tell Us about Our Kids","https://m.media-amazon.com/images/I/61Wd3Q4YFkL._AC_UY218_.jpg"
37,9,824,"0711245215",true,7.89,"USD",14.99,7.1,47.36,3343,4.7,"https://www.amazon.com/dp/0711245215","15712.10",false,false,false,false,"This Book Is Anti-Racist: 20 Lessons on How to Wake Up, Take Action, and Do The Work (Volume 1) (Empower the Future, 1)","https://m.media-amazon.com/images/I/81DrP7CgerL._AC_UY218_.jpg"
37,10,825,"1619301849",true,10,"USD",16.95,6.95,41,91,4.6,"https://www.amazon.com/dp/1619301849","418.60",false,false,false,false,"Forensics: Uncover the Science and Technology of Crime Scene Investigation (Inquire and Investigate)","https://m.media-amazon.com/images/I/91utNo0gX4L._AC_UY218_.jpg"
37,11,826,"1326264222",true,5.99,"USD",18.98,12.99,68.44,623,4.3,"https://www.amazon.com/dp/1326264222","2678.90",false,false,false,false,"Learn How to Play Piano / Keyboard For Absolute Beginners: A Self Tuition Book For Adults & Teenagers!","https://m.media-amazon.com/images/I/61bhYKRch3L._AC_UY218_.jpg"
37,13,828,"1250861012",true,11.99,"USD",25.51,13.52,53,470,4.3,"https://www.amazon.com/dp/1250861012","2021.00",false,false,false,false,"Immortality: A Love Story (The Anatomy Duology, 2)","https://m.media-amazon.com/images/I/91E5D+NZjkL._AC_UY218_.jpg"
37,14,829,"1735685437",true,9.95,"USD",12.95,3,23.17,45,4.5,"https://www.amazon.com/dp/1735685437","202.50",false,false,false,false,"Show Your Worth, Girl: Be Bold, Speak Up, and Be Heard: Teen Inspirations, Hints, Tips, and Truths (Sister to Sister Series)","https://m.media-amazon.com/images/I/61vG2t8B5aL._AC_UY218_.jpg"
37,15,830,"0787983438",true,2.99,"USD",17.99,15,83.38,1289,4.6,"https://www.amazon.com/dp/0787983438","5929.40",false,false,true,false,"American Medical Association Boy's Guide to Becoming a Teen","https://m.media-amazon.com/images/I/51z334riGxL._AC_UY218_.jpg"
37,16,831,"B0BD3MLQDN",false,0,"USD",0,0,0,4,5,"https://www.amazon.com/dp/B0BD3MLQDN","20.00",false,false,false,false,"SLAM BOOK: Slam Book for Lovely Friends, Build Strong Friendship, Diary Slammed For Girls and Teenagers, With Exciting Que...","https://m.media-amazon.com/images/I/61xdZ1pLZLL._AC_UY218_.jpg"
38,10,833,"1785928015",true,9.99,"USD",18.95,8.96,47.28,123,4.7,"https://www.amazon.com/dp/1785928015","578.10",false,false,false,false,"Helping Your Transgender Teen, 2nd Edition","https://m.media-amazon.com/images/I/419Xto6GmPL._AC_UY218_.jpg"
38,11,834,"B0BCSB1MY8",false,0,"USD",0,0,0,125,4.8,"https://www.amazon.com/dp/B0BCSB1MY8","600.00",false,false,false,false,"Coloring Books For Boys Cool Cars And Vehicles: For Boys Aged 6-12","https://m.media-amazon.com/images/I/71bLsC3AuWL._AC_UY218_.jpg"
38,12,835,"B0957JD4QB",false,0,"USD",0,0,0,7,4.3,"https://www.amazon.com/dp/B0957JD4QB","30.10",false,false,false,false,"Travel Journal For Teens: Vacation or Summer Traveling Log Book for Teenagers, Prompted Pages to Write and Draw Their Trav...","https://m.media-amazon.com/images/I/61vbWhb8G3S._AC_UY218_.jpg"
38,13,836,"108775836X",true,11.57,"USD",14.99,3.42,22.82,31,4.9,"https://www.amazon.com/dp/108775836X","151.90",false,false,false,false,"No More Excuses - Teen Guys' Bible Study Book: Be the Man God Made You to Be","https://m.media-amazon.com/images/I/812jT4v6xIL._AC_UY218_.jpg"
38,14,837,"1095354663",true,9,"USD",9.99,0.99,9.91,3362,4.6,"https://www.amazon.com/dp/1095354663","15465.20",false,false,false,false,"1144 Random, Interesting & Fun Facts You Need To Know - The Knowledge Encyclopedia To Win Trivia (Amazing World Facts Book)","https://m.media-amazon.com/images/I/613UJ15xa-S._AC_UY218_.jpg"
38,15,838,"B091F8RHZJ",false,0,"USD",0,0,0,15,4.7,"https://www.amazon.com/dp/B091F8RHZJ","70.50",false,false,false,false,"Therapeutically Parenting Teenagers with Developmental Trauma","https://m.media-amazon.com/images/I/619dmZiTCZL._AC_UY218_.jpg"
38,16,839,"B0B4P8VVZH",false,0,"USD",0,0,0,9,3.9,"https://www.amazon.com/dp/B0B4P8VVZH","35.10",false,false,false,false,"Downton Abbey word search puzzle book.: Downton Abbey gifts for women and men. RELIVE THE DRAMA with this amazing tv show ...","https://m.media-amazon.com/images/I/61FFS1bAVlL._AC_UY218_.jpg"
39,9,840,"0312289111",true,12.5,"USD",18.99,6.49,34.18,137,4.5,"https://www.amazon.com/dp/0312289111","616.50",false,false,false,false,"The New York Times on the Web Crosswords for Teens (New York Times Crossword Puzzles)","https://m.media-amazon.com/images/I/81JPXt6ZLWL._AC_UY218_.jpg"
39,10,841,"1646111338",false,0,"USD",0,0,0,373,4.6,"https://www.amazon.com/dp/1646111338","1715.80",false,false,false,false,"The Easy Drawing Book for Teens: 20 Step-by-Step Projects to Improve Your Drawing Skills","https://m.media-amazon.com/images/I/71oi2R5bYPL._AC_UY218_.jpg"
39,11,842,"1481435345",true,36.58,"USD",54.99,18.41,33.48,222,4.8,"https://www.amazon.com/dp/1481435345","1065.60",false,false,false,false,"The Judy Blume Teen Collection (Boxed Set): Are You There God? It's Me, Margaret; Deenie; Forever; Then Again, Maybe I Wo...","https://m.media-amazon.com/images/I/71rs+CnPW9L._AC_UY218_.jpg"
39,12,843,"0804138761",true,11.99,"USD",17,5.01,29.47,55,4.7,"https://www.amazon.com/dp/0804138761","258.50",false,false,false,false,"Setting Limits with your Strong-Willed Teen: Eliminating Conflict by Establishing Clear, Firm, and Respectful Boundaries","https://m.media-amazon.com/images/I/81P92DO6MiL._AC_UY218_.jpg"
39,13,844,"B0BW36MH3N",false,0,"USD",0,0,0,10,4.5,"https://www.amazon.com/dp/B0BW36MH3N","45.00",false,false,false,false,"Mandalas Coloring Book: Coloring Book Featuring Beautiful Mandalas & Patterns Designs for Stress Relief and Relaxation","https://m.media-amazon.com/images/I/71IH7u1p9IL._AC_UY218_.jpg"
39,14,845,"B0000YSH4C",true,0,"USD",16.95,16.95,100,9881,4.5,"https://www.amazon.com/dp/B0000YSH4C","44464.50",false,false,false,false,"His Dark Materials: The Subtle Knife (Book 2): His Dark Materials, Book 2","https://m.media-amazon.com/images/I/91-CDVajAPL._AC_UY218_.jpg"
39,15,846,"162625382X",true,15.75,"USD",19.95,4.2,21.05,43,4.5,"https://www.amazon.com/dp/162625382X","193.50",false,false,false,false,"Mindfulness for Teen Depression: A Workbook for Improving Your Mood","https://m.media-amazon.com/images/I/71gNGQV2j0L._AC_UY218_.jpg"
39,16,847,"B09NRBY57W",true,0,"USD",13,13,100,46,4.8,"https://www.amazon.com/dp/B09NRBY57W","220.80",false,false,false,false,"""Mom's Guide"" Parenting Your Teenage Daughter: Build a Better Connection with Your Teen Girl Tackling Anxiety, Intense Emo...","https://m.media-amazon.com/images/I/71YBfGLs1lL._AC_UY218_.jpg"
40,9,848,"0814436552",true,0,"USD",20.9,20.9,100,212,4.5,"https://www.amazon.com/dp/0814436552","954.00",false,false,false,false,"Dial Down the Drama: Reducing Conflict and Reconnecting with Your Teenage Daughter--A Guide for Mothers Everywhere","https://m.media-amazon.com/images/I/7121NBnjjeL._AC_UY218_.jpg"
40,10,849,"1989365973",true,5,"USD",11.99,6.99,58.3,131,4.5,"https://www.amazon.com/dp/1989365973","589.50",false,false,false,false,"Float","https://m.media-amazon.com/images/I/81Yg-wU5ZbL._AC_UY218_.jpg"
40,11,850,"B0BRPRPPQ1",false,0,"USD",0,0,0,23,4.9,"https://www.amazon.com/dp/B0BRPRPPQ1","112.70",false,false,false,false,"Royal Rebel (Fate of Eyrinthia Book 4)","https://m.media-amazon.com/images/I/81A4zrUPkwL._AC_UY218_.jpg"
