"position.page","position.position","position.global_position","asin","price.discounted","price.current_price","price.currency","price.before_price","price.savings_amount","price.savings_percent","reviews.total_reviews","reviews.rating","url","score","sponsored","amazonChoice","bestSeller","amazonPrime","title","thumbnail"
28,11,757,"B07QQ46Q1Z",true,0,"USD",17.99,17.99,100,1645,4.5,"https://www.amazon.com/dp/B07QQ46Q1Z","7402.50",false,false,false,false,"The Bodybuilding Meal Prep Cookbook: Macro-Friendly Meals to Prepare, Grab, and Go","https://m.media-amazon.com/images/I/91IrEgvT73L._AC_UY218_.jpg"
28,13,759,"B079ZYFFBM",true,0,"USD",14.99,14.99,100,3083,4.4,"https://www.amazon.com/dp/B079ZYFFBM","13565.20",false,false,false,false,"The Keto Instant Pot Cookbook: Ketogenic Diet Pressure Cooker Recipes Made Easy and Fast","https://m.media-amazon.com/images/I/914oJIU6UaL._AC_UY218_.jpg"
28,14,760,"B01BAU6EGC",true,12.99,"USD",35,22.01,62.89,2571,4.7,"https://www.amazon.com/dp/B01BAU6EGC","12083.70",false,false,false,false,"Cooking for Jeffrey: A Barefoot Contessa Cookbook","https://m.media-amazon.com/images/I/91vqxAof0UL._AC_UY218_.jpg"
28,15,761,"B09MJMD57T",true,0,"USD",18.99,18.99,100,177,4.6,"https://www.amazon.com/dp/B09MJMD57T","814.20",false,false,false,false,"Complete Cajun Cookbook: 100 Home-Cooked Bayou Classics","https://m.media-amazon.com/images/I/A1-rm3Px6zL._AC_UY218_.jpg"
28,16,762,"B0BN4NCNWY",false,0,"USD",0,0,0,290,4.8,"https://www.amazon.com/dp/B0BN4NCNWY","1392.00",false,false,false,false,"Diabetic Desserts Cookbook: 1000 Days of Easy and Appetizing Low Sugar Cakes, Cookies, Bombs, and Smoothies to Stay Health...","https://m.media-amazon.com/images/I/81jmIGJvFAL._AC_UY218_.jpg"
29,9,763,"B0BRW6792J",false,0,"USD",0,0,0,30,4.8,"https://www.amazon.com/dp/B0BRW6792J","144.00",false,false,false,false,"The Ninja Creami Dairy-Free Cookbook: 39 Recipes for Ice Cream, Sorbet, & Smoothie Bowls","https://m.media-amazon.com/images/I/81Pp1qERerL._AC_UY218_.jpg"
29,10,764,"B0047T745E",true,0,"USD",13.99,13.99,100,1339,4.3,"https://www.amazon.com/dp/B0047T745E","5757.70",false,false,false,false,"The No-Salt Cookbook: Reduce or Eliminate Salt Without Sacrificing Flavor","https://m.media-amazon.com/images/I/81aSO7VE9wL._AC_UY218_.jpg"
29,11,765,"B07R7XSNY2",false,9.99,"USD",0,0,0,1316,4.8,"https://www.amazon.com/dp/B07R7XSNY2","6316.80",false,false,false,false,"The Rootitoot Cookbook: A Grandma's Recipes For Your Instant Pot","https://m.media-amazon.com/images/I/81lo6PB4qfL._AC_UY218_.jpg"
29,13,767,"B07H3FTYBS",true,0,"USD",16.99,16.99,100,10516,4.5,"https://www.amazon.com/dp/B07H3FTYBS","47322.00",false,false,false,false,"The Official Ninja Foodi: The Pressure Cooker that Crisps: Complete Cookbook for Beginners: Your Expert Guide to Pressure ...","https://m.media-amazon.com/images/I/913RJbvf86L._AC_UY218_.jpg"
29,14,768,"B0981HD3G2",true,0,"USD",16.99,16.99,100,578,4.5,"https://www.amazon.com/dp/B0981HD3G2","2601.00",false,false,false,false,"Plant-Based Air Fryer Cookbook: 75 Whole-Food Vegan Recipes","https://m.media-amazon.com/images/I/91Mxc+Wu4mS._AC_UY218_.jpg"
29,15,769,"B004Y6J5S4",false,2.99,"USD",0,0,0,94,4.5,"https://www.amazon.com/dp/B004Y6J5S4","423.00",false,false,false,false,"The Berghoff Family Cookbook: From Our Table to Yours, Celebrating a Century of Entertaining","https://m.media-amazon.com/images/I/81-5m-OXM3L._AC_UY218_.jpg"
29,16,770,"B07492F94C",true,0,"USD",16.75,16.75,100,1696,4.5,"https://www.amazon.com/dp/B07492F94C","7632.00",false,false,false,false,"The Easy Gluten-Free Cookbook: Fast and Fuss-Free Recipes for Busy People on a Gluten-Free Diet","https://m.media-amazon.com/images/I/91XAv3BlEaL._AC_UY218_.jpg"
30,9,771,"B09PBVLTZ7",false,0,"USD",0,0,0,96,4.2,"https://www.amazon.com/dp/B09PBVLTZ7","403.20",false,false,false,false,"Cuisinart Ice Cream Maker Cookbook for Beginners: 365 Decadent and Fun Recipes for your Ice Cream Maker (Homemade Frozen Y...","https://m.media-amazon.com/images/I/919mnoFLnJL._AC_UY218_.jpg"
30,10,772,"B07W43K3HF",false,0,"USD",0,0,0,444,4.5,"https://www.amazon.com/dp/B07W43K3HF","1998.00",false,false,false,false,"Copycat Cookbook: Making Olive Garden’s Most Popular Recipes at Home (Famous Restaurant Copycat Cookbooks)","https://m.media-amazon.com/images/I/71536FPnWnS._AC_UY218_.jpg"
30,11,773,"B0B622JL4P",true,0,"USD",15.99,15.99,100,47,4.5,"https://www.amazon.com/dp/B0B622JL4P","211.50",false,false,false,false,"The Complete Macro Cookbook: 2-Week Meal Plan for Muscle Gain, 2-Week Meal Plan for Fat Loss, Workout Guidance and Routines","https://m.media-amazon.com/images/I/91w19kPc2vL._AC_UY218_.jpg"
30,12,774,"B0BWY8PZ9X",false,0,"USD",0,0,0,273,4.8,"https://www.amazon.com/dp/B0BWY8PZ9X","1310.40",false,false,false,false,"1500 Days Keto Diet Cookbook for Beginners: Super Delicious, Simple, Low-carb Keto Recipes Cookbook to Manage Your Body in...","https://m.media-amazon.com/images/I/91yUDU-+YNL._AC_UY218_.jpg"
30,13,775,"B0B71LTV6Q",true,14.99,"USD",37.5,22.51,60.03,5,5,"https://www.amazon.com/dp/B0B71LTV6Q","25.00",false,false,false,false,"Cristy's Kitchen: More Than 130 Scrumptious and Nourishing Recipes Without Gluten, Dairy, or Processed Sugar0","https://m.media-amazon.com/images/I/81hMuw-X1vL._AC_UY218_.jpg"
30,14,776,"B08F51QZCZ",true,0,"USD",19.99,19.99,100,6039,4.7,"https://www.amazon.com/dp/B08F51QZCZ","28383.30",false,false,true,false,"The Lighter Step-By-Step Instant Pot Cookbook: Easy Recipes for a Slimmer, Healthier You—With Photographs of Every Step (S...","https://m.media-amazon.com/images/I/81IhzORCZmS._AC_UY218_.jpg"
30,15,777,"B09G1SGF9B",false,0,"USD",0,0,0,167,4.6,"https://www.amazon.com/dp/B09G1SGF9B","768.20",false,false,false,false,"Low-FODMAP Cookbook: Delicious Gut-Friendly Recipes to Relieve Your IBS | 28-Day Meal Plan for Beginners","https://m.media-amazon.com/images/I/A1CYjgjYvHL._AC_UY218_.jpg"
30,16,778,"B0BTTM77CN",false,0,"USD",0,0,0,187,4.9,"https://www.amazon.com/dp/B0BTTM77CN","916.30",false,false,false,false,"The Essential Air fryer Cookbook for Beginners: 1000 Days Delicious & Affordable Air Fryer Recipes with General and Simpl...","https://m.media-amazon.com/images/I/918kVfoqZTL._AC_UY218_.jpg"
31,10,780,"B0BRKYFFDD",false,0,"USD",0,0,0,402,4.8,"https://www.amazon.com/dp/B0BRKYFFDD","1929.60",false,false,false,false,"The Big Keto Diet Cookbook for Beginners 2023: 1000 Tasty, Healthy, & Easy-to-Learn Ketogenic Diet Recipes for Your Whole ...","https://m.media-amazon.com/images/I/91fJyRuxWoL._AC_UY218_.jpg"
31,11,781,"B0849X759L",true,0,"USD",15.99,15.99,100,1609,4.7,"https://www.amazon.com/dp/B0849X759L","7562.30",false,false,false,false,"The Best of New Orleans Cookbook: 50 Classic Cajun and Creole Recipes from the Big Easy","https://m.media-amazon.com/images/I/81e5As9ff5L._AC_UY218_.jpg"
31,12,782,"B07ZNMG9C1",true,0.99,"USD",30,29.01,96.7,456,4.5,"https://www.amazon.com/dp/B07ZNMG9C1","2052.00",false,false,false,false,"Khazana: An Indo-Persian cookbook with recipes inspired by the Mughals","https://m.media-amazon.com/images/I/91TfLzC5JEL._AC_UY218_.jpg"
31,13,783,"B0BKH6CVXZ",false,0,"USD",0,0,0,179,4.5,"https://www.amazon.com/dp/B0BKH6CVXZ","805.50",false,false,false,false,"Ninja Foodi Grill Cookbook for Beginners: 1500 Days Easy & Affordable Ninja Foodi Grill Recipes for Your Ninja Foodi Smart...","https://m.media-amazon.com/images/I/918j-5jOhaL._AC_UY218_.jpg"
31,14,784,"B078JZ8WZ8",false,0,"USD",0,0,0,82,4.3,"https://www.amazon.com/dp/B078JZ8WZ8","352.60",false,false,false,false,"American Diner Cookbook: Favorite Classic Recipes to Make at Home","https://m.media-amazon.com/images/I/81599ghphcL._AC_UY218_.jpg"
31,15,785,"B09NRSXGBV",true,0,"USD",14.99,14.99,100,242,4.5,"https://www.amazon.com/dp/B09NRSXGBV","1089.00",false,false,false,false,"Small-Batch Snacking Cake Cookbook: 75 Quick-Prep Recipes to Satisfy Your Sweet Tooth","https://m.media-amazon.com/images/I/91G3el-y5LL._AC_UY218_.jpg"
31,16,786,"B07Y2BPD5B",true,0,"USD",19.99,19.99,100,7763,4.5,"https://www.amazon.com/dp/B07Y2BPD5B","34933.50",false,false,false,false,"The Official Ninja Foodi Grill Cookbook for Beginners: 75 Recipes for Indoor Grilling and Air Frying Perfection","https://m.media-amazon.com/images/I/81dtMpLLrrL._AC_UY218_.jpg"
32,9,787,"B08LDY6174",true,0,"USD",16.99,16.99,100,642,4.5,"https://www.amazon.com/dp/B08LDY6174","2889.00",false,false,false,false,"The ""I Love My Instant Pot®"" Cooking for One Recipe Book: From Chicken and Wild Rice Soup to Sweet Potato Casserole with B...","https://m.media-amazon.com/images/I/81AlVLsiE5S._AC_UY218_.jpg"
32,11,789,"B07DRPR71D",false,0,"USD",0,0,0,167,4.5,"https://www.amazon.com/dp/B07DRPR71D","751.50",false,false,false,false,"Ultimate Quick Bread Cookbook: Savory & Sweet Breads, Muffins, Biscuits & More! (Southern Cooking Recipes)","https://m.media-amazon.com/images/I/81s-XT6VNzL._AC_UY218_.jpg"
32,12,790,"B0BTWCNHFT",false,0,"USD",0,0,0,317,5,"https://www.amazon.com/dp/B0BTWCNHFT","1585.00",false,false,false,false,"Sous Vide Cookbook for Beginners : 800+ Mouthwatering and Budget-Friendly Recipes to make at Home Everyday","https://m.media-amazon.com/images/I/910NPtjqWdL._AC_UY218_.jpg"
32,13,791,"B01A7HDLQU",false,0,"USD",0,0,0,993,4.3,"https://www.amazon.com/dp/B01A7HDLQU","4269.90",false,false,false,false,"The Gastroparesis Cookbook: 102 Delicious, Nutritious Recipes for Gastroparesis Relief","https://m.media-amazon.com/images/I/91C2cKiY4ZL._AC_UY218_.jpg"
32,14,792,"B07X9CK35K",false,0,"USD",0,0,0,799,4.3,"https://www.amazon.com/dp/B07X9CK35K","3435.70",false,false,false,false,"Masterbuilt Electric Smoker Cookbook: 150 Fast, Easy and Delicious Recipes for Your Whole Family and Get-together with 100...","https://m.media-amazon.com/images/I/916rO8N9DsL._AC_UY218_.jpg"
32,15,793,"B00KQT93ZS",true,2.51,"USD",2.99,0.48,16.05,415,4.7,"https://www.amazon.com/dp/B00KQT93ZS","1950.50",false,false,false,false,"My Prairie Cookbook: Memories and Frontier Food from My Little House to Yours","https://m.media-amazon.com/images/I/81mOXM6pyhL._AC_UY218_.jpg"
32,16,794,"B09DK43F6G",true,14.99,"USD",34.99,20,57.16,121,4.8,"https://www.amazon.com/dp/B09DK43F6G","580.80",false,false,false,false,"The Food Matters Cookbook: A Simple Gluten-Free Guide to Transforming Your Health One Meal at a Time","https://m.media-amazon.com/images/I/71flceumHpL._AC_UY218_.jpg"
33,9,795,"B009POEW56",true,17.99,"USD",29.99,12,40.01,463,4.6,"https://www.amazon.com/dp/B009POEW56","2129.80",false,false,false,false,"The Do-It-Yourself Cookbook: Can It, Cure It, Churn It, Brew It","https://m.media-amazon.com/images/I/9192NuwQ-GL._AC_UY218_.jpg"
33,10,796,"B09HMHQSQQ",true,0,"USD",9.99,9.99,100,129,4.6,"https://www.amazon.com/dp/B09HMHQSQQ","593.40",false,false,false,false,"Happily Ever After Cookbook","https://m.media-amazon.com/images/I/81mYp-Pc4yL._AC_UY218_.jpg"
33,11,797,"B07K3542Y6",false,0,"USD",0,0,0,1721,4.4,"https://www.amazon.com/dp/B07K3542Y6","7572.40",false,false,false,false,"500 Keto Instant Pot Recipes Cookbook: The Easy Electric Pressure Cooker Ketogenic Diet Cookbook to Reset Your Body and Li...","https://m.media-amazon.com/images/I/91O70SKG+XL._AC_UY218_.jpg"
33,12,798,"B00VENWS02",false,2.99,"USD",0,0,0,62,4.2,"https://www.amazon.com/dp/B00VENWS02","260.40",false,false,false,false,"Thanksgiving Cookbook (Classic Cookbooklets 6)","https://m.media-amazon.com/images/I/81vavnm8WEL._AC_UY218_.jpg"
33,13,799,"B09M916Y1Z",false,0,"USD",0,0,0,39,4.3,"https://www.amazon.com/dp/B09M916Y1Z","167.70",false,false,false,false,"Cheesecake Recipes Copycat Cookbook (Copycat Cookbooks)","https://m.media-amazon.com/images/I/81wPPhJYrEL._AC_UY218_.jpg"
33,14,800,"B077ZFH9QN",true,6.99,"USD",17.99,11,61.15,1238,4.3,"https://www.amazon.com/dp/B077ZFH9QN","5323.40",false,false,false,false,"The Complete Convection Oven Cookbook: 75 Essential Recipes and Easy Cooking Techniques for Any Convection Oven","https://m.media-amazon.com/images/I/A1-T+0bSbyL._AC_UY218_.jpg"
33,15,801,"B07M9HC3B3",false,0,"USD",0,0,0,280,4.2,"https://www.amazon.com/dp/B07M9HC3B3","1176.00",false,false,false,false,"Indian Cookbook: An Indian Cookbook Filled with Authentic Indian Recipes (2nd Edition)","https://m.media-amazon.com/images/I/A111JPQuHFL._AC_UY218_.jpg"
33,16,802,"B07ZRG9GDS",false,0,"USD",0,0,0,1938,4.2,"https://www.amazon.com/dp/B07ZRG9GDS","8139.60",false,false,false,false,"The Complete Instant Pot For Two Cookbook: 550 Healthy Pressure Cooker Recipes (Instant Pot Duo Cookbook For Two)","https://m.media-amazon.com/images/I/91UPf52pszL._AC_UY218_.jpg"
34,10,803,"B07CJTPSWG",true,2.99,"USD",17.99,15,83.38,115,4.4,"https://www.amazon.com/dp/B07CJTPSWG","506.00",false,false,false,false,"The Instant Pot® Ultimate Sous Vide Cookbook: 100 No-Pressure Recipes for Perfect Meals Every Time","https://m.media-amazon.com/images/I/81fB39eHIfL._AC_UY218_.jpg"
34,11,804,"B0BS44ZP3N",false,0,"USD",0,0,0,46,4.6,"https://www.amazon.com/dp/B0BS44ZP3N","211.60",false,false,false,false,"The Complete Vietnamese Cookbook: 1000 Days Of Simple And Delicious Traditional And Modern Recipes For Vietnamese Cuisine ...","https://m.media-amazon.com/images/I/91v4+wzKZQL._AC_UY218_.jpg"
34,12,805,"B00KK4K7L8",false,0,"USD",0,0,0,135,3.8,"https://www.amazon.com/dp/B00KK4K7L8","513.00",false,false,false,false,"Freezer Cookbook: Complete Freezer Meals Cookbook with Illustrated Make Ahead Lunch & Dinner Recipes","https://m.media-amazon.com/images/I/81EZuzbXzpL._AC_UY218_.jpg"
34,13,806,"B008396YZK",false,0,"USD",0,0,0,129,4,"https://www.amazon.com/dp/B008396YZK","516.00",false,false,false,false,"The Broke-Ass Cookbook: Simple, Quick, AFFORDABLE Meals to Feed a Family without Breaking the Bank (Living well on Next to...","https://m.media-amazon.com/images/I/41ljdw8JrxL._AC_UY218_.jpg"
34,14,807,"B0BZVQT1L5",false,0,"USD",0,0,0,238,5,"https://www.amazon.com/dp/B0BZVQT1L5","1190.00",false,false,false,false,"The Complete Low-FODMAP Diet Cookbook: 1600 Days Delicious and Digestion-Friendly Recipes for Managing Symptoms of Irritab...","https://m.media-amazon.com/images/I/9128DajRlGL._AC_UY218_.jpg"
34,16,809,"B07Z9MPZGF",true,0,"USD",19.99,19.99,100,4230,4.4,"https://www.amazon.com/dp/B07Z9MPZGF","18612.00",false,false,false,false,"The Official Ninja Foodi Digital Air Fry Oven Cookbook: 75 Recipes for Quick and Easy Sheet Pan Meals","https://m.media-amazon.com/images/I/81FNP8FdQkL._AC_UY218_.jpg"
35,9,810,"B08L8896QL",true,2.99,"USD",8.99,6,66.74,476,4.4,"https://www.amazon.com/dp/B08L8896QL","2094.40",false,false,false,false,"Dehydrator Cookbook: An Essential Guide to Dehydrating and Preserving Fruits, Vegetables, Meats, and Seafood. Include Maki...","https://m.media-amazon.com/images/I/81tkntPIxwS._AC_UY218_.jpg"
35,10,811,"B0BXJGVWRS",false,0,"USD",0,0,0,3,5,"https://www.amazon.com/dp/B0BXJGVWRS","15.00",false,false,false,false,"The All-In-One Noom Diet Cookbook: Delicious, Healthy, and Beginner-Friendly Breakfast, Lunch, and Dinner Recipes for a He...","https://m.media-amazon.com/images/I/91oVZZRhy0L._AC_UY218_.jpg"
35,11,812,"B0BRT6CV22",false,0,"USD",0,0,0,469,4.9,"https://www.amazon.com/dp/B0BRT6CV22","2298.10",false,false,false,false,"Whole Food Plant Based Diet Cookbook for Beginners: Transition to A Healthy Lifestyle and Lose Weight with Easy Recipes No...","https://m.media-amazon.com/images/I/81Ef7U1aiHL._AC_UY218_.jpg"
35,12,813,"B06XDQ8LTF",true,0,"USD",17.99,17.99,100,1281,4.2,"https://www.amazon.com/dp/B06XDQ8LTF","5380.20",false,false,false,false,"The Easy Acid Reflux Cookbook: Comforting 30-Minute Recipes to Soothe GERD & LPR","https://m.media-amazon.com/images/I/91G6AO0On0L._AC_UY218_.jpg"
35,13,814,"B07NQWRXCN",false,0,"USD",0,0,0,95,4.6,"https://www.amazon.com/dp/B07NQWRXCN","437.00",false,false,false,false,"The Frugal Instant Pot Cookbook: Simple, Tasty Recipes That Cook In A Flash & Don’t Break The Bank (Hillbilly Housewife Co...","https://m.media-amazon.com/images/I/81UYQ+quMwL._AC_UY218_.jpg"
35,14,815,"B09RP4CSXH",true,15.99,"USD",30,14.01,46.7,17,4.4,"https://www.amazon.com/dp/B09RP4CSXH","74.80",false,false,false,false,"The Lemon Apron Cookbook: Seasonal Recipes for the Curious Home Cook","https://m.media-amazon.com/images/I/91Y3UafAh+L._AC_UY218_.jpg"
35,15,816,"B096PP6PJH",false,0,"USD",0,0,0,31,4.1,"https://www.amazon.com/dp/B096PP6PJH","127.10",false,false,false,false,"Ultimate Casserole Cookbook: All Your Favorites In One Collection! (Southern Cooking Recipes)","https://m.media-amazon.com/images/I/812OqCRhAbS._AC_UY218_.jpg"
35,16,817,"B01AQO0IFQ",true,14.99,"USD",30,15.01,50.03,4147,4.7,"https://www.amazon.com/dp/B01AQO0IFQ","19490.90",false,false,false,false,"Skinnytaste Fast and Slow: Knockout Quick-Fix and Slow Cooker Recipes: A Cookbook","https://m.media-amazon.com/images/I/91sUVK-K8tL._AC_UY218_.jpg"
36,9,818,"B00AQZ41I6",false,2.99,"USD",0,0,0,131,4.3,"https://www.amazon.com/dp/B00AQZ41I6","563.30",false,false,false,false,"The Braiser Cookbook: 22 irresistible recipes created just for your braiser—great for Le Creuset, Lodge, All-Clad, Staub, ...","https://m.media-amazon.com/images/I/91qqKaKFvwL._AC_UY218_.jpg"
36,10,819,"B00SRYUWU4",false,15.99,"USD",0,0,0,2732,4.6,"https://www.amazon.com/dp/B00SRYUWU4","12567.20",false,false,false,false,"Sweetie Pie's Cookbook: Soulful Southern Recipes, from My Family to Yours","https://m.media-amazon.com/images/I/81i5vZWixhL._AC_UY218_.jpg"
36,11,820,"B08Q78SGK2",true,0,"USD",12.99,12.99,100,183,4.7,"https://www.amazon.com/dp/B08Q78SGK2","860.10",false,false,false,false,"The Easy Venison Cookbook: 60 Simple Recipes for Deer, Elk, and Moose","https://m.media-amazon.com/images/I/A1f1QiaGyfL._AC_UY218_.jpg"
36,12,821,"B00CZ1CKBY",true,0,"USD",22.99,22.99,100,1127,4.3,"https://www.amazon.com/dp/B00CZ1CKBY","4846.10",false,false,false,false,"The Paleo Cookbook: 300 Delicious Paleo Diet Recipes","https://m.media-amazon.com/images/I/91mMnQDil1L._AC_UY218_.jpg"
36,13,822,"B07FB2Q1RG",true,0,"USD",15.99,15.99,100,1121,4.5,"https://www.amazon.com/dp/B07FB2Q1RG","5044.50",false,false,false,false,"Super Easy Cookbook for Beginners: 5-Ingredient Recipes and Essential Techniques to Get You Started in the Kitchen","https://m.media-amazon.com/images/I/91XK-GjvAZL._AC_UY218_.jpg"
36,14,823,"B09CHGS71X",false,0,"USD",0,0,0,266,4.4,"https://www.amazon.com/dp/B09CHGS71X","1170.40",false,false,false,false,"the Complete Wok Cookbook: 500 Delicious Stir-fry Recipes for Your Wok or Skillet","https://m.media-amazon.com/images/I/71ItRV9dDkL._AC_UY218_.jpg"
36,15,824,"B0176M3X80",true,9.99,"USD",17.99,8,44.47,2151,4,"https://www.amazon.com/dp/B0176M3X80","8604.00",false,false,false,false,"Hello, Sunshine: A Novel","https://m.media-amazon.com/images/I/8138r8DaapL._AC_UY218_.jpg"
36,16,825,"B08BZWCZ14",true,16.99,"USD",24.99,8,32.01,719,4.6,"https://www.amazon.com/dp/B08BZWCZ14","3307.40",false,false,false,false,"The Plant-Based Cookbook: Vegan, Gluten-Free, Oil-Free Recipes for Lifelong Health","https://m.media-amazon.com/images/I/81SYtFfAXvL._AC_UY218_.jpg"
37,9,826,"B08TN6T5YX",false,0,"USD",0,0,0,89,4.3,"https://www.amazon.com/dp/B08TN6T5YX","382.70",false,false,false,false,"The Ultimate Japanese Cookbook: 111 Dishes From Japan To Cook Right Now (World Cuisines Book 15)","https://m.media-amazon.com/images/I/81HObDM+rBL._AC_UY218_.jpg"
37,10,827,"B099P4X5V6",true,0,"USD",17.99,17.99,100,367,4.4,"https://www.amazon.com/dp/B099P4X5V6","1614.80",false,false,false,false,"Bariatric Meal Prep Cookbook: 6 Weeks of Perfectly Portioned Meals for Lifelong Weight Management","https://m.media-amazon.com/images/I/A1XXmWi0JRS._AC_UY218_.jpg"
37,11,828,"B09NTZSTK2",false,0,"USD",0,0,0,14,4.4,"https://www.amazon.com/dp/B09NTZSTK2","61.60",false,false,false,false,"The Must Have German Cookbook with Pictures: Treat Yourself to Cook Traditional German Dishes at Home","https://m.media-amazon.com/images/I/81ctyTvzXCL._AC_UY218_.jpg"
37,12,829,"B08KFWNFRG",true,0,"USD",17.99,17.99,100,618,4.4,"https://www.amazon.com/dp/B08KFWNFRG","2719.20",false,false,false,false,"5-Ingredient Clean Eating Cookbook: 125 Simple Recipes to Nourish and Inspire","https://m.media-amazon.com/images/I/91Hs-puhYUL._AC_UY218_.jpg"
37,13,830,"B07F66KP7M",true,22.99,"USD",40,17.01,42.53,143,4.6,"https://www.amazon.com/dp/B07F66KP7M","657.80",false,false,false,false,"The New Essentials Cookbook: A Modern Guide to Better Cooking","https://m.media-amazon.com/images/I/91DdlP8CjWL._AC_UY218_.jpg"
37,14,831,"B07541ZZPD",false,0,"USD",0,0,0,13,3.7,"https://www.amazon.com/dp/B07541ZZPD","48.10",false,false,false,false,"European Cookbook: All Types of European Recipes from the East to the West","https://m.media-amazon.com/images/I/A1AfE91ofNL._AC_UY218_.jpg"
37,16,833,"B0857KD9Y3",false,0,"USD",0,0,0,760,4.4,"https://www.amazon.com/dp/B0857KD9Y3","3344.00",false,false,false,false,"The Healing Gout Cookbook: Anti-Inflammatory Recipes to Lower Uric Acid Levels and Reduce Flares","https://m.media-amazon.com/images/I/91AEKjLVDTL._AC_UY218_.jpg"
38,9,834,"B0BW9WWT2H",true,9.99,"USD",27.99,18,64.31,15,4.7,"https://www.amazon.com/dp/B0BW9WWT2H","70.50",false,false,false,false,"Minecraft: Gather, Cook, Eat! Official Cookbook","https://m.media-amazon.com/images/I/61HT3n859NL._AC_UY218_.jpg"
38,10,835,"B01ILZPRK8",true,4.99,"USD",30,25.01,83.37,1146,4.7,"https://www.amazon.com/dp/B01ILZPRK8","5386.20",false,false,false,false,"Nopalito: A Mexican Kitchen [A Cookbook]","https://m.media-amazon.com/images/I/A17DqrQVlZL._AC_UY218_.jpg"
38,11,836,"B009MYAORO",true,11.99,"USD",35,23.01,65.74,2729,4.7,"https://www.amazon.com/dp/B009MYAORO","12826.30",false,false,false,false,"Barefoot Contessa at Home: Everyday Recipes You'll Make Over and Over Again: A Cookbook","https://m.media-amazon.com/images/I/51IBL9K46bL._AC_UY218_.jpg"
38,12,837,"B0B8XXXQCM",false,0,"USD",0,0,0,172,4.3,"https://www.amazon.com/dp/B0B8XXXQCM","739.60",false,false,false,false,"Mediterranean Air Fryer Cookbook: Enjoy Your Mediterranean Diet Meals Without Stress. 365 Days of Healthy and Crispy Recip...","https://m.media-amazon.com/images/I/91D6Z2huXZL._AC_UY218_.jpg"
38,13,838,"B07CKQ4Z4S",true,12.99,"USD",20,7.01,35.05,2732,4.4,"https://www.amazon.com/dp/B07CKQ4Z4S","12020.80",false,false,false,false,"Undo It!: How Simple Lifestyle Changes Can Reverse Most Chronic Diseases","https://m.media-amazon.com/images/I/81oiRUu1w1L._AC_UY218_.jpg"
38,14,839,"B09NP4Z6Y9",false,0,"USD",0,0,0,601,4.3,"https://www.amazon.com/dp/B09NP4Z6Y9","2584.30",false,false,false,false,"the Ultimate Ninja Foodi Cookbook: 1000 Easy & Delicious Air Fry, Broil, Pressure Cook, Slow Cook, Dehydrate, and More Rec...","https://m.media-amazon.com/images/I/61jVmlE0XkL._AC_UY218_.jpg"
38,15,840,"B07XB7SX4M",true,0,"USD",18.99,18.99,100,677,4.4,"https://www.amazon.com/dp/B07XB7SX4M","2978.80",false,false,false,false,"The Southern Comfort Food Diabetes Cookbook: Over 100 Recipes for a Healthy Life","https://m.media-amazon.com/images/I/A1Dx6L-wr1L._AC_UY218_.jpg"
38,16,841,"B0B38LKZLB",false,0,"USD",0,0,0,26,3.7,"https://www.amazon.com/dp/B0B38LKZLB","96.20",false,false,false,false,"A Friendly Low-Budget Vegan Cookbook: Quick and Easy Meals for Singles (Quick and Easy Vegan Recipe Books)","https://m.media-amazon.com/images/I/81uoSle1a2L._AC_UY218_.jpg"
39,9,842,"B088WBGHGM",true,0,"USD",35,35,100,3204,4.8,"https://www.amazon.com/dp/B088WBGHGM","15379.20",false,false,false,false,"The Official Downton Abbey Cookbook (Downton Abbey Cookery)","https://m.media-amazon.com/images/I/81-cjIgvoLL._AC_UY218_.jpg"
39,10,843,"B08DXWT2J5",false,1.99,"USD",0,0,0,118,4,"https://www.amazon.com/dp/B08DXWT2J5","472.00",false,false,false,false,"The Dutch Oven Cookbook","https://m.media-amazon.com/images/I/91dxPN0IL6L._AC_UY218_.jpg"
39,11,844,"B07B68CNC5",true,0,"USD",15.99,15.99,100,1193,4.7,"https://www.amazon.com/dp/B07B68CNC5","5607.10",false,false,false,false,"Super Easy Baby Food Cookbook: Healthy Homemade Recipes for Every Age and Stage","https://m.media-amazon.com/images/I/91pdZ4+tOWL._AC_UY218_.jpg"
39,12,845,"B0B3XPX3G7",true,16.99,"USD",35,18.01,51.46,29,4.9,"https://www.amazon.com/dp/B0B3XPX3G7","142.10",false,false,false,false,"Your Super Life: 100+ Delicious, Plant-Based Recipes Made with Nature's Most Powerful Superfoods","https://m.media-amazon.com/images/I/81aAIPLRJ1L._AC_UY218_.jpg"
39,13,846,"B09CBBKYTX",false,0,"USD",0,0,0,435,4.6,"https://www.amazon.com/dp/B09CBBKYTX","2001.00",false,false,false,false,"Cast Iron Cookbook: Quick & Easy One-Pan Recipes for Your Cast Iron Skillet & Dutch Oven | The Beginners Edition","https://m.media-amazon.com/images/I/91ZqVnASSCL._AC_UY218_.jpg"
39,14,847,"B09KQYYHB7",true,4.99,"USD",34.95,29.96,85.72,1963,4.4,"https://www.amazon.com/dp/B09KQYYHB7","8637.20",false,false,false,false,"The Complete Air Fryer Cookbook: 1000 Recipes For Quick & Easy Air Fried Homemade Meals","https://m.media-amazon.com/images/I/91tJJfxJPzL._AC_UY218_.jpg"
39,15,848,"B07C7NFMV9",true,0,"USD",15.99,15.99,100,950,4.3,"https://www.amazon.com/dp/B07C7NFMV9","4085.00",false,false,false,false,"Low Sodium Slow Cooker Cookbook: Over 100 Heart Healthy Recipes that Prep Fast and Cook Slow","https://m.media-amazon.com/images/I/91siIgaK4XL._AC_UY218_.jpg"
39,16,849,"B07FK3L8QR",true,0,"USD",16.99,16.99,100,1642,4.5,"https://www.amazon.com/dp/B07FK3L8QR","7389.00",false,false,false,false,"The Super Easy Air Fryer Cookbook: Crave-Worthy Recipes for Healthier Fried Favorites","https://m.media-amazon.com/images/I/A1K9Ay09PLL._AC_UY218_.jpg"
40,9,850,"B0BJF1YLSP",true,14.99,"USD",32.5,17.51,53.88,222,4.5,"https://www.amazon.com/dp/B0BJF1YLSP","999.00",false,false,false,false,"The Betty Crocker Cookbook, 13th Edition: Everything You Need to Know to Cook Today (Betty Crocker Cooking)","https://m.media-amazon.com/images/I/71wj2MTmkML._AC_UY218_.jpg"
