"position.page","position.position","position.global_position","asin","price.discounted","price.current_price","price.currency","price.before_price","price.savings_amount","price.savings_percent","reviews.total_reviews","reviews.rating","url","score","sponsored","amazonChoice","bestSeller","amazonPrime","title","thumbnail"
33,14,799,"B00GOYV35C",true,17.25,"USD",31.95,14.7,46.01,9,4.3,"https://www.amazon.com/dp/B00GOYV35C","38.70",false,false,false,false,"Language Building Blocks: Essential Linguistics for Early Childhood Educators (Early Childhood Education Series)","https://m.media-amazon.com/images/I/51anA4VgEBL._AC_UY218_.jpg"
33,15,800,"B007Z4S3EY",true,13.99,"USD",18,4.01,22.28,171,4.7,"https://www.amazon.com/dp/B007Z4S3EY","803.70",false,false,false,false,"Right-Brained Children in a Left-Brained World: Unlocking the Potential of Your ADD Child","https://m.media-amazon.com/images/I/71Rv1LiR3pL._AC_UY218_.jpg"
33,16,801,"B077ZJLHJX",false,0,"USD",0,0,0,2,3,"https://www.amazon.com/dp/B077ZJLHJX","6.00",false,false,false,false,"An Introduction to the Wonderful World of Robotics - Science Book for Kids | Children's Science Education Books","https://m.media-amazon.com/images/I/91HVaMhw3JL._AC_UY218_.jpg"
34,10,803,"B01ACKKR7S",true,17.02,"USD",30.95,13.93,45.01,100,4.7,"https://www.amazon.com/dp/B01ACKKR7S","470.00",false,false,false,false,"Observing and Recording the Behavior of Young Children, Sixth Edition","https://m.media-amazon.com/images/I/51WmZP94i2L._AC_UY218_.jpg"
34,11,804,"B07KNS5FYT",true,12.99,"USD",18,5.01,27.83,1227,4.7,"https://www.amazon.com/dp/B07KNS5FYT","5766.90",false,false,false,false,"The Knowledge Gap: The Hidden Cause of America's Broken Education System--and How to Fix it","https://m.media-amazon.com/images/I/81AfwF3DGIL._AC_UY218_.jpg"
34,12,805,"B0053GA97K",true,12.99,"USD",13.89,0.9,6.48,439,4.8,"https://www.amazon.com/dp/B0053GA97K","2107.20",false,false,false,false,"The Story for Children, a Storybook Bible","https://m.media-amazon.com/images/I/91FuUQwd8GL._AC_UY218_.jpg"
34,13,806,"B078H7S43H",false,24.99,"USD",0,0,0,1192,4.9,"https://www.amazon.com/dp/B078H7S43H","5840.80",false,false,false,false,"The Ology: Ancient Truths, Ever New","https://m.media-amazon.com/images/I/91wb3xQMPbL._AC_UY218_.jpg"
34,14,807,"B01F4MIR5S",true,48.99,"USD",64.95,15.96,24.57,15,4.6,"https://www.amazon.com/dp/B01F4MIR5S","69.00",false,false,false,false,"Promoting Speech, Language, and Literacy in Children Who Are Deaf or Hard of Hearing (CLI Book 20)","https://m.media-amazon.com/images/I/515x-PrSovL._AC_UY218_.jpg"
34,15,808,"B0167ILH3C",true,18.12,"USD",32.95,14.83,45.01,168,4.5,"https://www.amazon.com/dp/B0167ILH3C","756.00",false,false,false,false,"The Big Book of EVEN MORE Therapeutic Activity Ideas for Children and Teens: Inspiring Arts-Based Activities and Character...","https://m.media-amazon.com/images/I/61BvfjWmUBL._AC_UY218_.jpg"
34,16,809,"B07LGHTHYP",true,0,"USD",17.99,17.99,100,8188,4.9,"https://www.amazon.com/dp/B07LGHTHYP","40121.20",false,false,false,false,"Indescribable: 100 Devotions About God and Science (Indescribable Kids)","https://m.media-amazon.com/images/I/81tbyyuQNZL._AC_UY218_.jpg"
35,9,810,"B081QYVC55",true,0,"USD",21.99,21.99,100,254,4.7,"https://www.amazon.com/dp/B081QYVC55","1193.80",false,false,false,false,"Integrating Primitive Reflexes Through Play and Exercise: An Interactive Guide to the Moro Reflex for Parents, Teachers, a...","https://m.media-amazon.com/images/I/71QdEi-WWXL._AC_UY218_.jpg"
35,10,811,"B07M5CT3MH",true,41.99,"USD",231.95,189.96,81.9,500,4.7,"https://www.amazon.com/dp/B07M5CT3MH","2350.00",false,false,false,false,"Health, Safety, and Nutrition for the Young Child","https://m.media-amazon.com/images/I/51j0FfR2muL._AC_UY218_.jpg"
35,11,812,"B09RKKCVLQ",true,38.84,"USD",42,3.16,7.52,1,5,"https://www.amazon.com/dp/B09RKKCVLQ","5.00",false,false,false,false,"Understanding Music Education: Exploring Children′s Musical Worlds","https://m.media-amazon.com/images/I/71gbv399o+L._AC_UY218_.jpg"
35,14,815,"B0B7FG6PPZ",false,6.95,"USD",0,0,0,3,5,"https://www.amazon.com/dp/B0B7FG6PPZ","15.00",false,false,false,false,"Keys to Successfully Parenting the Gifted Child","https://m.media-amazon.com/images/I/81yRPUR-AKL._AC_UY218_.jpg"
35,15,816,"B005HFBSHW",true,15,"USD",24.95,9.95,39.88,138,4.6,"https://www.amazon.com/dp/B005HFBSHW","634.80",false,false,false,false,"Bright Not Broken: Gifted Kids, ADHD, and Autism","https://m.media-amazon.com/images/I/61oxP3U9w2L._AC_UY218_.jpg"
35,16,817,"B01056HO2A",true,9.99,"USD",18.95,8.96,47.28,637,4.6,"https://www.amazon.com/dp/B01056HO2A","2930.20",false,false,false,false,"Reset Your Child's Brain: A Four-Week Plan to End Meltdowns, Raise Grades, and Boost Social Skills by Reversing the Effect...","https://m.media-amazon.com/images/I/81MC2RY4TaL._AC_UY218_.jpg"
36,9,818,"B09HQMQ7QQ",true,15.99,"USD",29,13.01,44.86,94,4.6,"https://www.amazon.com/dp/B09HQMQ7QQ","432.40",false,false,false,false,"Hostages No More: The Fight for Education Freedom and the Future of the American Child","https://m.media-amazon.com/images/I/81AfuN+QT+L._AC_UY218_.jpg"
36,10,819,"B08BYCBPS3",false,0,"USD",0,0,0,12,4.8,"https://www.amazon.com/dp/B08BYCBPS3","57.60",false,false,false,false,"Medicine for kids : Medical education and funfacts for children of all ages","https://m.media-amazon.com/images/I/819lflyrzIL._AC_UY218_.jpg"
36,11,820,"B08MFRJR4C",true,11.49,"USD",14.95,3.46,23.14,214,4.8,"https://www.amazon.com/dp/B08MFRJR4C","1027.20",false,false,false,false,"Developing Positive Self-Images & Discipline in Black Children","https://m.media-amazon.com/images/I/81wc+BFC+FL._AC_UY218_.jpg"
36,12,821,"B0BL42ZHH5",true,33,"USD",113,80,70.8,2,5,"https://www.amazon.com/dp/B0BL42ZHH5","10.00",false,false,false,false,"Early Childhood Education: Current realities and future priorities","https://m.media-amazon.com/images/I/81z0Rq6BYOL._AC_UY218_.jpg"
36,13,822,"B01AKWPJ30",false,0,"USD",0,0,0,14,4.8,"https://www.amazon.com/dp/B01AKWPJ30","67.20",false,false,false,false,"Your Children's Ministry, Beyond Basics","https://m.media-amazon.com/images/I/81eAMZuMoaL._AC_UY218_.jpg"
36,14,823,"B006862NBO",true,16.1,"USD",30,13.9,46.33,12,3.8,"https://www.amazon.com/dp/B006862NBO","45.60",false,false,false,false,"Teaching Children Gymnastics","https://m.media-amazon.com/images/I/71trArEwyKL._AC_UY218_.jpg"
36,15,824,"B00B853Z0S",true,14.99,"USD",24,9.01,37.54,21,4.4,"https://www.amazon.com/dp/B00B853Z0S","92.40",false,false,false,false,"Listening to Children on the Spiritual Journey: Guidance for Those Who Teach and Nurture","https://m.media-amazon.com/images/I/81I1aJ1nNxL._AC_UY218_.jpg"
37,9,826,"B00K7B01K6",true,15.59,"USD",96.95,81.36,83.92,14,4.8,"https://www.amazon.com/dp/B00K7B01K6","67.20",false,false,false,false,"Differentiating for the Young Child: Teaching Strategies Across the Content Areas, PreK–3","https://m.media-amazon.com/images/I/81yuvZAurSL._AC_UY218_.jpg"
37,11,828,"B01N8Y5DTO",true,53.99,"USD",74.95,20.96,27.97,83,4.8,"https://www.amazon.com/dp/B01N8Y5DTO","398.40",false,false,false,false,"Treatment of Language Disorders in Children (CLI)","https://m.media-amazon.com/images/I/51oZJW9X4yL._AC_UY218_.jpg"
37,12,829,"B00G1SDPAM",true,14.57,"USD",26.99,12.42,46.02,18,4.6,"https://www.amazon.com/dp/B00G1SDPAM","82.80",false,false,false,false,"Toddlers Moving and Learning: A Physical Education Curriculum (Moving & Learning)","https://m.media-amazon.com/images/I/81I7mmL77nL._AC_UY218_.jpg"
37,14,831,"B07T5ZGM5F",false,0,"USD",0,0,0,14,3.7,"https://www.amazon.com/dp/B07T5ZGM5F","51.80",false,false,false,false,"The Holy Quran for Educating the Child: With illustrative stories and psychological explanations - Part 1 (The Cultural Co...","https://m.media-amazon.com/images/I/71gagNGjOSL._AC_UY218_.jpg"
37,15,832,"B00DCCAXSW",true,19.77,"USD",35.95,16.18,45.01,11,4.4,"https://www.amazon.com/dp/B00DCCAXSW","48.40",false,false,false,false,"Everyday Artists: Inquiry and Creativity in the Early Childhood Classroom (Early Childhood Education Series)","https://m.media-amazon.com/images/I/91ql56afd6L._AC_UY218_.jpg"
37,16,833,"B005MYJ8H0",true,48.39,"USD",62.99,14.6,23.18,120,4.2,"https://www.amazon.com/dp/B005MYJ8H0","504.00",false,false,false,false,"Praxis II Education of Young Children (0021 and 5021) Exam Secrets Study Guide: Praxis II Test Review for the Praxis II: S...","https://m.media-amazon.com/images/I/81ZI3qZLZ-L._AC_UY218_.jpg"
38,9,834,"B00TTCNL1A",true,23.99,"USD",32.95,8.96,27.19,104,4.7,"https://www.amazon.com/dp/B00TTCNL1A","488.80",false,false,false,false,"Early Intervention Every Day!: Embedding Activities in Daily Routines for Young Children and Their Families","https://m.media-amazon.com/images/I/51LxNZkLH+L._AC_UY218_.jpg"
38,10,835,"B004TPV236",false,0,"USD",0,0,0,59,4.3,"https://www.amazon.com/dp/B004TPV236","253.70",false,false,false,false,"The Child and the Curriculum","https://m.media-amazon.com/images/I/91Erol22--L._AC_UY218_.jpg"
38,11,836,"B00OQCUVM0",true,9.99,"USD",18.95,8.96,47.28,798,4.7,"https://www.amazon.com/dp/B00OQCUVM0","3750.60",false,false,false,false,"A Parent's Guide to High-Functioning Autism Spectrum Disorder: How to Meet the Challenges and Help Your Child Thrive","https://m.media-amazon.com/images/I/81VVMBN3eHL._AC_UY218_.jpg"
38,12,837,"B00CJI3QEI",true,21.99,"USD",28.95,6.96,24.04,63,4.6,"https://www.amazon.com/dp/B00CJI3QEI","289.80",false,false,false,false,"Children, Language, and Literacy: Diverse Learners in Diverse Times (Language & Literacy)","https://m.media-amazon.com/images/I/91gGjzz1MzL._AC_UY218_.jpg"
38,13,838,"B01N4DR164",true,41.99,"USD",231.95,189.96,81.9,12,5,"https://www.amazon.com/dp/B01N4DR164","60.00",false,false,false,false,"Parenting Today's Children: A Developmental Perspective","https://m.media-amazon.com/images/I/51vzjDF7x+L._AC_UY218_.jpg"
38,14,839,"B07C3HYF4D",true,8.95,"USD",18.99,10.04,52.87,2,4,"https://www.amazon.com/dp/B07C3HYF4D","8.00",false,false,false,false,"Montaigne: The Education of Children","https://m.media-amazon.com/images/I/9171TRzK8uL._AC_UY218_.jpg"
38,15,840,"B0759ZT76N",true,6.99,"USD",12.6,5.61,44.52,569,4.5,"https://www.amazon.com/dp/B0759ZT76N","2560.50",false,false,false,false,"McGraw-Hill Education Math Grade 8, Second Edition","https://m.media-amazon.com/images/I/81Zl8b5qmbL._AC_UY218_.jpg"
38,16,841,"B0BYRTBPV1",false,9.99,"USD",0,0,0,7,5,"https://www.amazon.com/dp/B0BYRTBPV1","35.00",false,false,false,false,"The ABC's Of Wealth Building: Children's Edition","https://m.media-amazon.com/images/I/81FgHvXH0HL._AC_UY218_.jpg"
39,9,842,"B08DL52RYD",false,8,"USD",0,0,0,31,4.8,"https://www.amazon.com/dp/B08DL52RYD","148.80",false,false,false,false,"The Child in the Family (Montessori series Book 8)","https://m.media-amazon.com/images/I/615H8r0bEWL._AC_UY218_.jpg"
39,10,843,"B07ZQRHCRH",true,25.99,"USD",36,10.01,27.81,75,4.4,"https://www.amazon.com/dp/B07ZQRHCRH","330.00",false,false,false,false,"Coaching with Powerful Interactions: A Guide for Partnering with Early Childhood Teachers","https://m.media-amazon.com/images/I/615SuKehzCL._AC_UY218_.jpg"
39,11,844,"B008EKOP90",false,10.99,"USD",0,0,0,195,4.6,"https://www.amazon.com/dp/B008EKOP90","897.00",false,false,false,false,"Nasreen's Secret School: A True Story from Afghanistan","https://m.media-amazon.com/images/I/71iJltT2BpL._AC_UY218_.jpg"
39,12,845,"B00T9X7TF8",true,41.99,"USD",231.95,189.96,81.9,361,4.6,"https://www.amazon.com/dp/B00T9X7TF8","1660.60",false,false,false,false,"Math and Science for Young Children","https://m.media-amazon.com/images/I/916wJUacGRL._AC_UY218_.jpg"
39,13,846,"B00NPRQ8RE",true,39.5,"USD",45,5.5,12.22,12,4.2,"https://www.amazon.com/dp/B00NPRQ8RE","50.40",false,false,false,false,"Teaching Kids to Think Critically: Effective Problem-Solving and Better Decisions","https://m.media-amazon.com/images/I/71wxxxacw5L._AC_UY218_.jpg"
39,14,847,"B075ST818D",true,9.99,"USD",14.15,4.16,29.4,101,4.7,"https://www.amazon.com/dp/B075ST818D","474.70",false,false,false,false,"Helping Your Child with Language-Based Learning Disabilities: Strategies to Succeed in School and Life with Dyslexia, Dysg...","https://m.media-amazon.com/images/I/81Kr7ZAKEzL._AC_UY218_.jpg"
39,15,848,"B005KL9GQ8",true,17.6,"USD",32,14.4,45,12,4.1,"https://www.amazon.com/dp/B005KL9GQ8","49.20",false,false,false,false,"Social Skills Training for Children with Asperger Syndrome and High-Functioning Autism","https://m.media-amazon.com/images/I/81Yz0i+WmFL._AC_UY218_.jpg"
39,16,849,"B01M4GRUMB",true,9.74,"USD",70,60.26,86.09,1,5,"https://www.amazon.com/dp/B01M4GRUMB","5.00",false,false,false,false,"Children's Home Musical Experiences Across the World (Counterpoints: Music and Education)","https://m.media-amazon.com/images/I/91bfbBectML._AC_UY218_.jpg"
40,9,850,"B0048WPO2U",true,12.99,"USD",17,4.01,23.59,28,3.5,"https://www.amazon.com/dp/B0048WPO2U","98.00",false,false,false,false,"The Unmotivated Child: Helping Your Underachiever Become a Successful Student","https://m.media-amazon.com/images/I/71eeBmRcdIL._AC_UY218_.jpg"
40,10,851,"B08PYBRM7F",true,64.99,"USD",89.95,24.96,27.75,28,4.8,"https://www.amazon.com/dp/B08PYBRM7F","134.40",false,false,false,false,"Interventions for Speech Sound Disorders in Children (CLI)","https://m.media-amazon.com/images/I/71xdKDvl4DL._AC_UY218_.jpg"
40,11,852,"B07ZTVZNDJ",true,18.99,"USD",25,6.01,24.04,44,4.7,"https://www.amazon.com/dp/B07ZTVZNDJ","206.80",false,false,false,false,"Where’s the Math?: Books, Games, and Routines to Spark Children's Thinking","https://m.media-amazon.com/images/I/81868jq0q+L._AC_UY218_.jpg"
40,13,854,"B08Z2YY5KD",false,9.99,"USD",0,0,0,11,4.1,"https://www.amazon.com/dp/B08Z2YY5KD","45.10",false,false,false,false,"Understanding and Loving Your Child with ADHD (Understanding and Loving Series)","https://m.media-amazon.com/images/I/81TAUh-x0gL._AC_UY218_.jpg"
40,14,855,"B00HFIBE50",false,0,"USD",0,0,0,24,3.3,"https://www.amazon.com/dp/B00HFIBE50","79.20",false,false,false,false,"ADHD: ADHD Parenting Made Easy - The Essential Guide to Parenting Children with ADHD (ADHD, Parenting, ADHD Children, Spec...","https://m.media-amazon.com/images/I/71LxaPPr-kL._AC_UY218_.jpg"
40,15,856,"B00OJMV0YK",true,41.66,"USD",89.95,48.29,53.69,80,4.6,"https://www.amazon.com/dp/B00OJMV0YK","368.00",false,false,false,false,"Health Education: Creating Strategies for School & Community Health","https://m.media-amazon.com/images/I/81xMtzqVxQL._AC_UY218_.jpg"
40,16,857,"B009XECKHA",false,0,"USD",0,0,0,1,5,"https://www.amazon.com/dp/B009XECKHA","5.00",false,false,false,false,"Early Childhood Education (Career Assistance Series)","https://m.media-amazon.com/images/I/51+wNtgzTdL._AC_UY218_.jpg"
41,9,858,"B004NSW9CC",true,12,"USD",19.99,7.99,39.97,349,4.5,"https://www.amazon.com/dp/B004NSW9CC","1570.50",false,false,false,false,"Child Psychology and Development For Dummies","https://m.media-amazon.com/images/I/51swt1NfBWL._AC_UY218_.jpg"
41,10,859,"B006HKZNBS",false,0.99,"USD",0,0,0,164,4.7,"https://www.amazon.com/dp/B006HKZNBS","770.80",false,false,false,false,"Hints on Child-Training","https://m.media-amazon.com/images/I/71wLV9x9BaL._AC_UY218_.jpg"
41,11,860,"B07CZTMJRT",true,18.99,"USD",24.95,5.96,23.89,54,4.5,"https://www.amazon.com/dp/B07CZTMJRT","243.00",false,false,false,false,"Teaching Young Children with Autism Spectrum Disorder","https://m.media-amazon.com/images/I/81m30avqXtL._AC_UY218_.jpg"
41,12,861,"B00YAJ5LM4",true,20.9,"USD",20.99,0.09,0.43,28,4.7,"https://www.amazon.com/dp/B00YAJ5LM4","131.60",false,false,false,false,"Helping Children with Autism Learn: Treatment Approaches for Parents and Professionals","https://m.media-amazon.com/images/I/71gh3+-B03L._AC_UY218_.jpg"
41,13,862,"B099WKTQL9",true,41.99,"USD",231.95,189.96,81.9,3,5,"https://www.amazon.com/dp/B099WKTQL9","15.00",false,false,false,false,"Early Education Curriculum: A Child’s Connection to the World","https://m.media-amazon.com/images/I/81pDwGTxyCL._AC_UY218_.jpg"
41,14,863,"B00DB369VM",true,13.49,"USD",16.99,3.5,20.6,76,4.6,"https://www.amazon.com/dp/B00DB369VM","349.60",false,false,false,false,"Thinking Differently: An Inspiring Guide for Parents of Children with Learning Disabilities","https://m.media-amazon.com/images/I/81SfdDrphjL._AC_UY218_.jpg"
41,15,864,"B00SDOESIA",true,4.2,"USD",4.99,0.79,15.83,21,4.5,"https://www.amazon.com/dp/B00SDOESIA","94.50",false,false,false,false,"Divine and Moral Songs for Children","https://m.media-amazon.com/images/I/51aZNLqvMnL._AC_UY218_.jpg"
41,16,865,"B081BCKFJ7",true,11.99,"USD",15.99,4,25.02,41,4.8,"https://www.amazon.com/dp/B081BCKFJ7","196.80",false,false,false,false,"Raising Up Dreamers: Find and Grow Your Child’s God-Given Talents","https://m.media-amazon.com/images/I/81Tf5UxacuL._AC_UY218_.jpg"
42,9,866,"B00CQ8OFHI",true,13.17,"USD",21.95,8.78,40,3,5,"https://www.amazon.com/dp/B00CQ8OFHI","15.00",false,false,false,false,"Video Modeling for Young Children with Autism Spectrum Disorders: A Practical Guide for Parents and Professionals","https://m.media-amazon.com/images/I/51SP8mmxRDL._AC_UY218_.jpg"
42,10,867,"B077RWBVWR",true,8.99,"USD",12.99,4,30.79,735,4.7,"https://www.amazon.com/dp/B077RWBVWR","3454.50",false,false,false,false,"Somebody Else's Kids: The True Story of Four Problem Children and One Extraordinary Teacher","https://m.media-amazon.com/images/I/71U4n3IwN3L._AC_UY218_.jpg"
42,11,868,"B07D31MG7Z",true,16.1,"USD",16.95,0.85,5.01,4,4.6,"https://www.amazon.com/dp/B07D31MG7Z","18.40",false,false,false,false,"The Neglected Child: How to Recognize, Respond, and Prevent","https://m.media-amazon.com/images/I/81kRgclsq9L._AC_UY218_.jpg"
42,12,869,"B07R6Y3HJY",true,33.2,"USD",34.95,1.75,5.01,11,4.3,"https://www.amazon.com/dp/B07R6Y3HJY","47.30",false,false,false,false,"Successfully Teaching and Managing Children with ADHD: A Resource for SENCOs and Teachers (nasen spotlight)","https://m.media-amazon.com/images/I/51jrL9EASxL._AC_UY218_.jpg"
42,13,870,"B00332G4SY",true,16.17,"USD",29.95,13.78,46.01,9,4.3,"https://www.amazon.com/dp/B00332G4SY","38.70",false,false,false,false,"Gifted Children: A Guide for Parents and Professionals","https://m.media-amazon.com/images/I/51XcwkO+5vL._AC_UY218_.jpg"
42,14,871,"B09322LWHH",true,6.99,"USD",15.99,9,56.29,41,5,"https://www.amazon.com/dp/B09322LWHH","205.00",false,false,false,false,"Special Education Savvy","https://m.media-amazon.com/images/I/71gk5peEdMS._AC_UY218_.jpg"
42,15,872,"B08ZZ1SMGP",true,9.99,"USD",12.95,2.96,22.86,17,5,"https://www.amazon.com/dp/B08ZZ1SMGP","85.00",false,false,false,false,"We Be Lovin’ Black Children: Learning to Be Literate About the African Diaspora","https://m.media-amazon.com/images/I/81GxwNQ-VDL._AC_UY218_.jpg"
42,16,873,"B0716KRHP5",true,9.99,"USD",12.99,3,23.09,123,4.6,"https://www.amazon.com/dp/B0716KRHP5","565.80",false,false,false,false,"Abandoned Parents: Healing Beyond Understanding: Easing the Pain of Parents Abandoned by Their Adult Children","https://m.media-amazon.com/images/I/71XXuOhhqKL._AC_UY218_.jpg"
43,9,874,"B003IPCP02",false,2.99,"USD",0,0,0,17,3.9,"https://www.amazon.com/dp/B003IPCP02","66.30",false,false,false,false,"Children's Bible Comic Book New Testament","https://m.media-amazon.com/images/I/612cWul7J-L._AC_UY218_.jpg"
43,11,876,"B003P9XCSK",true,10.99,"USD",16.99,6,35.31,59,4.2,"https://www.amazon.com/dp/B003P9XCSK","247.80",false,false,false,false,"One Day, All Children...: The Unlikely Triumph Of Teach For America And What I Learned Along The Way","https://m.media-amazon.com/images/I/81vPf4iwexL._AC_UY218_.jpg"
43,12,877,"B00AXXUB0S",true,7.99,"USD",12.99,5,38.49,886,4.7,"https://www.amazon.com/dp/B00AXXUB0S","4164.20",false,false,false,false,"Twilight Children: Three Voices No One Heard Until a Therapist Listened","https://m.media-amazon.com/images/I/81+HYcRNt0L._AC_UY218_.jpg"
43,13,878,"B07MVNF2MW",true,29.99,"USD",39.95,9.96,24.93,23,4.7,"https://www.amazon.com/dp/B07MVNF2MW","108.10",false,false,false,false,"Coping with Dyslexia, Dysgraphia and ADHD: A Global Perspective","https://m.media-amazon.com/images/I/51RIQnsHI+L._AC_UY218_.jpg"
43,14,879,"B09CGFGXV3",false,0,"USD",0,0,0,57,4.2,"https://www.amazon.com/dp/B09CGFGXV3","239.40",false,false,false,false,"Gifted and Talented Workbook for Kids: 101 Engaging Activities to Nurture Budding Skills and Interests","https://m.media-amazon.com/images/I/71CNv8mFO8L._AC_UY218_.jpg"
43,15,880,"B000SERMI6",true,7.49,"USD",14.99,7.5,50.03,97,4.6,"https://www.amazon.com/dp/B000SERMI6","446.20",false,false,false,false,"Making Your Children's Ministry the Best Hour of Every Kid's Week","https://m.media-amazon.com/images/I/51JxMxTTE0L._AC_UY218_.jpg"
43,16,881,"B07B9TNBNC",false,0,"USD",0,0,0,183,4.3,"https://www.amazon.com/dp/B07B9TNBNC","786.90",false,false,false,false,"First Words in Chinese: Chinese books for children: First Words (Bilingual English and Mandarin Chinese vocabulary book wi...","https://m.media-amazon.com/images/I/71aSSfnaorL._AC_UY218_.jpg"
44,9,882,"B0847QQ27F",true,31,"USD",33,2,6.06,6,5,"https://www.amazon.com/dp/B0847QQ27F","30.00",false,false,false,false,"Excellence Gaps in Education: Expanding Opportunities for Talented Students","https://m.media-amazon.com/images/I/81vqxKyr+ZL._AC_UY218_.jpg"
44,10,883,"B002J05IQ0",true,10.99,"USD",28,17.01,60.75,19,4.5,"https://www.amazon.com/dp/B002J05IQ0","85.50",false,false,false,false,"Light Up Your Child's Mind: Finding a Unique Pathway to Happiness and Success","https://m.media-amazon.com/images/I/71jONfsQIiL._AC_UY218_.jpg"
44,11,884,"B00QP3CZNQ",false,11.99,"USD",0,0,0,121,4.6,"https://www.amazon.com/dp/B00QP3CZNQ","556.60",false,false,false,false,"Reading Picture Books with Children: How to Shake Up Storytime and Get Kids Talking about What They See","https://m.media-amazon.com/images/I/A1FfYut9YEL._AC_UY218_.jpg"
44,12,885,"B007WRPRMA",false,6.49,"USD",0,0,0,6,4.6,"https://www.amazon.com/dp/B007WRPRMA","27.60",false,false,false,false,"NIV, Children's Bible","https://m.media-amazon.com/images/I/81wMVz5ciJL._AC_UY218_.jpg"
44,13,886,"B00MCURWUM",true,8.49,"USD",9.99,1.5,15.02,104,4.2,"https://www.amazon.com/dp/B00MCURWUM","436.80",false,false,false,false,"Their Name Is Today: Reclaiming Childhood in a Hostile World","https://m.media-amazon.com/images/I/91nNjK0PztL._AC_UY218_.jpg"
44,14,887,"B08HGDPR2M",true,40.43,"USD",45.5,5.07,11.14,13,4.5,"https://www.amazon.com/dp/B08HGDPR2M","58.50",false,false,false,false,"Assessing Intelligence in Children and Adolescents: A Practical Guide for Evidence-based Assessment","https://m.media-amazon.com/images/I/71AGqd9pk+L._AC_UY218_.jpg"
44,15,888,"B01GIHNOPQ",false,4.99,"USD",0,0,0,15,4.2,"https://www.amazon.com/dp/B01GIHNOPQ","63.00",false,false,false,false,"Home Education: Training and Educating Children Under Nine","https://m.media-amazon.com/images/I/91cYWXJRdiL._AC_UY218_.jpg"
44,16,889,"B0B5FRRLDB",true,42.71,"USD",56.95,14.24,25,11,4.6,"https://www.amazon.com/dp/B0B5FRRLDB","50.60",false,false,false,false,"Applied Behavior Analysis in Early Childhood Education: An Introduction to Evidence-based Interventions and Teaching Strat...","https://m.media-amazon.com/images/I/51ymnDzurEL._AC_UY218_.jpg"
45,9,890,"B0BBGT653H",false,0,"USD",0,0,0,3,4.6,"https://www.amazon.com/dp/B0BBGT653H","13.80",false,false,false,false,"Reforming Classical Education: Toward A New Paradigm","https://m.media-amazon.com/images/I/817bGUiSWCL._AC_UY218_.jpg"
45,10,891,"B07LGKVZ31",true,6.99,"USD",12.6,5.61,44.52,792,4.4,"https://www.amazon.com/dp/B07LGKVZ31","3484.80",false,false,false,false,"McGraw-Hill Education Geometry Review and Workbook","https://m.media-amazon.com/images/I/81hQ6xwBISL._AC_UY218_.jpg"
45,12,893,"B0BHRX5X1J",true,0,"USD",13,13,100,41,4.9,"https://www.amazon.com/dp/B0BHRX5X1J","200.90",false,false,false,false,"Self-Regulation and Emotional Well-being for Kids: Understand, Empower and Equip your child to deal with their big Emotion...","https://m.media-amazon.com/images/I/71fiOdYISlL._AC_UY218_.jpg"
45,13,894,"B0BV8JBDVJ",true,9.99,"USD",16.99,7,41.2,16,5,"https://www.amazon.com/dp/B0BV8JBDVJ","80.00",false,false,false,false,"School Sucks, Your Child Doesn't: The Secret to Unlocking Your Child's Untapped Potential","https://m.media-amazon.com/images/I/71ogO4Fs7VL._AC_UY218_.jpg"
45,14,895,"B00JLIK6A6",true,74.99,"USD",173.32,98.33,56.73,101,4.6,"https://www.amazon.com/dp/B00JLIK6A6","464.60",false,false,false,false,"Management of Child Development Centers","https://m.media-amazon.com/images/I/71dCJjGg2yL._AC_UY218_.jpg"
45,15,896,"B0029Z9Z28",true,7.55,"USD",7.95,0.4,5.03,17,4.1,"https://www.amazon.com/dp/B0029Z9Z28","69.70",false,false,false,false,"Praying with Scripture (Guided Reflections for Children)","https://m.media-amazon.com/images/I/51uLWEXqNcL._AC_UY218_.jpg"
45,16,897,"B00Y79YJ0C",true,31.72,"USD",44.99,13.27,29.5,26,4.5,"https://www.amazon.com/dp/B00Y79YJ0C","117.00",false,false,false,false,"The Redleaf Family Child Care Curriculum: Teaching Through Quality Care","https://m.media-amazon.com/images/I/81wlM5AtRML._AC_UY218_.jpg"
46,9,898,"B07SPJBB5R",true,6.99,"USD",12.6,5.61,44.52,269,4.6,"https://www.amazon.com/dp/B07SPJBB5R","1237.40",false,false,false,false,"McGraw-Hill Education Trigonometry Review and Workbook","https://m.media-amazon.com/images/I/81MioW5ZeyL._AC_UY218_.jpg"
46,10,899,"B00ESIP9RO",false,74.99,"USD",0,0,0,42,4.3,"https://www.amazon.com/dp/B00ESIP9RO","180.60",false,false,false,false,"Young Children with Special Needs","https://m.media-amazon.com/images/I/71nwQMtsMQL._AC_UY218_.jpg"
46,11,900,"B01LGEZ1BQ",true,9.99,"USD",10.99,1,9.1,4,4.3,"https://www.amazon.com/dp/B01LGEZ1BQ","17.20",false,false,false,false,"Energizing Your Children's Ministry","https://m.media-amazon.com/images/I/712MfXz-XUL._AC_UY218_.jpg"
46,12,901,"B08QR9TVDX",true,14.84,"USD",21.95,7.11,32.39,6,4.5,"https://www.amazon.com/dp/B08QR9TVDX","27.00",false,false,false,false,"The Basics of Leading a Child-Care Business (The Business of Child Care)","https://m.media-amazon.com/images/I/71ZKGo9AkBL._AC_UY218_.jpg"
