"position.page","position.position","position.global_position","asin","price.discounted","price.current_price","price.currency","price.before_price","price.savings_amount","price.savings_percent","reviews.total_reviews","reviews.rating","url","score","sponsored","amazonChoice","bestSeller","amazonPrime","title","thumbnail"
24,4,204,"B0058PGQ0K",true,36,"USD",45,9,20,27,4.9,"https://www.amazon.com/dp/B0058PGQ0K","132.30",false,false,false,false,"Working with Families of Young Children with Special Needs (What Works for Special-Needs Learners)","https://m.media-amazon.com/images/I/51RBZvW6B4L._AC_UY218_.jpg"
24,5,205,"B09ZPTRF6H",true,9.99,"USD",28,18.01,64.32,22,5,"https://www.amazon.com/dp/B09ZPTRF6H","110.00",false,false,false,false,"Trauma-Informed Children’s Ministry: A Practical Guide to Reaching Hurting Kids","https://m.media-amazon.com/images/I/71sf+um3GkL._AC_UY218_.jpg"
24,6,206,"B014LEWI46",false,0,"USD",0,0,0,17,3.9,"https://www.amazon.com/dp/B014LEWI46","66.30",false,false,false,false,"children books: CHARLIE: (Picture book) (Being different) (values book) (Preschool) (Adventure & Education for children) (...","https://m.media-amazon.com/images/I/71IjH51Xv2L._AC_UY218_.jpg"
24,8,208,"B00KTMHJGM",true,21.99,"USD",28.99,7,24.15,39,4.4,"https://www.amazon.com/dp/B00KTMHJGM","171.60",false,false,false,false,"Educating Everybody's Children: Diverse Teaching Strategies for Diverse Learners, Revised and Expanded 2nd Edition","https://m.media-amazon.com/images/I/51ixQkV1mlL._AC_UY218_.jpg"
25,1,209,"B06XNPQTPW",false,74.99,"USD",0,0,0,142,4.5,"https://www.amazon.com/dp/B06XNPQTPW","639.00",false,false,false,false,"Creative Thinking and Arts-Based Learning: Preschool Through Fourth Grade (What's New in Early Childhood Education)","https://m.media-amazon.com/images/I/81X8XINARGL._AC_UY218_.jpg"
25,3,211,"B0B7QKXM5Q",false,0,"USD",0,0,0,17,4.3,"https://www.amazon.com/dp/B0B7QKXM5Q","73.10",false,false,false,false,"Listening with the Heart: A Guide for Understanding Non-verbal Communication in the Autistic Child, for Parents, Teachers,...","https://m.media-amazon.com/images/I/81x2zoQc2dL._AC_UY218_.jpg"
25,4,212,"B09WRT8N3M",true,10.49,"USD",11.99,1.5,12.51,47,4.9,"https://www.amazon.com/dp/B09WRT8N3M","230.30",false,false,false,false,"Yes! Your Child Can: Creating Success for Children with Learning Differences","https://m.media-amazon.com/images/I/71qYxft7mtL._AC_UY218_.jpg"
25,5,213,"B09JPCDXFM",true,3.99,"USD",13,9.01,69.31,58,4.9,"https://www.amazon.com/dp/B09JPCDXFM","284.20",false,false,false,false,"Special Needs Education : The Pocket Learner - The Ultimate Toolkit for Every Parent and Caregiver of a Child or Adult wit...","https://m.media-amazon.com/images/I/71lbagOJJoL._AC_UY218_.jpg"
25,6,214,"B015G26M0S",false,3.99,"USD",0,0,0,26,4.2,"https://www.amazon.com/dp/B015G26M0S","109.20",false,false,false,false,"Sleep Tight, Little Wolf – Sov gott, lilla vargen (English – Swedish): Bilingual children's book, age 2 and up, with onlin...","https://m.media-amazon.com/images/I/81tXy8dxkOL._AC_UY218_.jpg"
25,7,215,"B00QMQWBU8",true,18.33,"USD",33.95,15.62,46.01,31,4.4,"https://www.amazon.com/dp/B00QMQWBU8","136.40",false,false,false,false,"Exploring Mathematics Through Play in the Early Childhood Classroom (Early Childhood Education Series)","https://m.media-amazon.com/images/I/51rP1y+jO8L._AC_UY218_.jpg"
25,8,216,"B00DBF99NA",false,39.9,"USD",0,0,0,1,5,"https://www.amazon.com/dp/B00DBF99NA","5.00",false,false,false,false,"Women and Children First: The Contribution of the Children's Bureau to Social Work Education","https://m.media-amazon.com/images/I/51J12+UZO2L._AC_UY218_.jpg"
25,9,217,"B00PEPO9MQ",true,7.99,"USD",12.15,4.16,34.24,423,4.6,"https://www.amazon.com/dp/B00PEPO9MQ","1945.80",false,false,false,false,"Children of the Dust Bowl: The True Story of the School at Weedpatch Camp","https://m.media-amazon.com/images/I/A1nj8A2xjWL._AC_UY218_.jpg"
26,1,218,"B07H8RD1X3",true,30.36,"USD",37.95,7.59,20,1,5,"https://www.amazon.com/dp/B07H8RD1X3","5.00",false,false,false,false,"The Early Advantage 1—Early Childhood Systems That Lead by Example: A Comparative Focus on International Early Childhood E...","https://m.media-amazon.com/images/I/91Po-YVxUSL._AC_UY218_.jpg"
26,2,219,"B00QMQWBYO",true,17.25,"USD",31.95,14.7,46.01,65,4.3,"https://www.amazon.com/dp/B00QMQWBYO","279.50",false,false,false,false,"Emergent Curriculum in the Primary Classroom: Interpreting the Reggio Emilia Approach in Schools (Early Childhood Educatio...","https://m.media-amazon.com/images/I/514YH06nCoL._AC_UY218_.jpg"
26,3,220,"B09Q7VWKPP",true,19.96,"USD",29.95,9.99,33.36,17,4.9,"https://www.amazon.com/dp/B09Q7VWKPP","83.30",false,false,false,false,"The Autism Industrial Complex: How Branding, Marketing, and Capital Investment Turned Autism into Big Business","https://m.media-amazon.com/images/I/71LMaaeUwzL._AC_UY218_.jpg"
26,4,221,"B00BO4GQYA",true,14.99,"USD",18,3.01,16.72,423,4.7,"https://www.amazon.com/dp/B00BO4GQYA","1988.10",false,false,false,false,"The Dyslexia Empowerment Plan: A Blueprint for Renewing Your Child's Confidence and Love of Learning","https://m.media-amazon.com/images/I/81HNpqjPx1L._AC_UY218_.jpg"
26,5,222,"B00DMCW1V4",true,13.99,"USD",20,6.01,30.05,323,4.7,"https://www.amazon.com/dp/B00DMCW1V4","1518.10",false,false,false,false,"Sensational Kids Revised Edition: Hope and Help for Children with Sensory Processing Disorder (SPD)","https://m.media-amazon.com/images/I/91utD7bAF2L._AC_UY218_.jpg"
26,6,223,"B08F2WHXWG",true,31.3,"USD",36.95,5.65,15.29,10,4.8,"https://www.amazon.com/dp/B08F2WHXWG","48.00",false,false,false,false,"Gifted Young Children: A guide for teachers and parents","https://m.media-amazon.com/images/I/81CrCJ1Wn4L._AC_UY218_.jpg"
26,7,224,"B0757WS8W6",true,7.99,"USD",14,6.01,42.93,368,4.6,"https://www.amazon.com/dp/B0757WS8W6","1692.80",false,false,false,false,"McGraw-Hill Education Math Grade 4, Second Edition","https://m.media-amazon.com/images/I/81oWqh1nLCL._AC_UY218_.jpg"
26,8,225,"B07LFQ294F",true,6.99,"USD",12.6,5.61,44.52,995,4.4,"https://www.amazon.com/dp/B07LFQ294F","4378.00",false,false,false,false,"McGraw-Hill Education Algebra I Review and Workbook","https://m.media-amazon.com/images/I/817Cu9uyRrL._AC_UY218_.jpg"
27,1,226,"B07R48NV8B",false,9.99,"USD",0,0,0,48,4.6,"https://www.amazon.com/dp/B07R48NV8B","220.80",false,false,false,false,"Montessori Strategies for Children with Learning Differences: The MACAR Model","https://m.media-amazon.com/images/I/81+G-B8AmBL._AC_UY218_.jpg"
27,2,227,"B09F5G15TM",false,0,"USD",0,0,0,59,4.9,"https://www.amazon.com/dp/B09F5G15TM","289.10",false,false,false,false,"Integrating Primitive Reflexes Through Play and Exercise: An Interactive Guide to the Symmetrical Tonic Neck Reflex (STNR)...","https://m.media-amazon.com/images/I/81rt3LBOzJL._AC_UY218_.jpg"
27,4,229,"B002U8KW30",true,2.49,"USD",4.99,2.5,50.1,4,5,"https://www.amazon.com/dp/B002U8KW30","20.00",false,false,false,false,"If You're Happy and You Know It: Level 1 (I Can Read! / Song Series)","https://m.media-amazon.com/images/I/91JWmd1wu2L._AC_UY218_.jpg"
27,5,230,"B00NPIV300",true,39.99,"USD",54.95,14.96,27.22,108,4.6,"https://www.amazon.com/dp/B00NPIV300","496.80",false,false,false,false,"Developing Cross-Cultural Competence: A Guide for Working with Children and Their Families","https://m.media-amazon.com/images/I/51QWZt4phgL._AC_UY218_.jpg"
27,6,231,"B073ZH3YVP",true,16.61,"USD",25.99,9.38,36.09,136,4.7,"https://www.amazon.com/dp/B073ZH3YVP","639.20",false,false,false,false,"Imaginative Prayer: A Yearlong Guide for Your Child's Spiritual Formation","https://m.media-amazon.com/images/I/71ItlqtpKAL._AC_UY218_.jpg"
27,7,232,"B07KMK8HN1",true,11.36,"USD",19.99,8.63,43.17,169,4.7,"https://www.amazon.com/dp/B07KMK8HN1","794.30",false,false,false,false,"How and When to Tell Your Kids about Sex: A Lifelong Approach to Shaping Your Child’s Sexual Character (God's Design for Sex)","https://m.media-amazon.com/images/I/71pZlXy6iaL._AC_UY218_.jpg"
27,8,233,"B003P9X9AG",false,1.99,"USD",0,0,0,27,4.1,"https://www.amazon.com/dp/B003P9X9AG","110.70",false,false,false,false,"Children's Bible Comic Book The Exodus","https://m.media-amazon.com/images/I/51H8Ffbi9eL._AC_UY218_.jpg"
28,1,234,"B00JCDK5A6",true,13.99,"USD",18.99,5,26.33,663,4.6,"https://www.amazon.com/dp/B00JCDK5A6","3049.80",false,false,false,false,"Leader in Me: How Schools Around the World Are Inspiring Greatness, One Child at a Time","https://m.media-amazon.com/images/I/81JWFGk330L._AC_UY218_.jpg"
28,2,235,"B08LGN11JZ",false,0,"USD",0,0,0,21,4.6,"https://www.amazon.com/dp/B08LGN11JZ","96.60",false,false,false,false,"Children and Emotions: Manage to Know and Control your Emotions with short Exercises to Feel Calm","https://m.media-amazon.com/images/I/81wxnnAZz3L._AC_UY218_.jpg"
28,3,236,"B06XWJBQXY",false,0,"USD",0,0,0,66,4.3,"https://www.amazon.com/dp/B06XWJBQXY","283.80",false,false,false,false,"World Schooling: How to Revolutionize Your Child's Education Through Travel","https://m.media-amazon.com/images/I/71KcWDqCgTL._AC_UY218_.jpg"
28,4,237,"B00A0XAF52",true,13.99,"USD",18.99,5,26.33,134,4.6,"https://www.amazon.com/dp/B00A0XAF52","616.40",false,false,false,false,"When Children Love to Learn: A Practical Application of Charlotte Mason's Philosophy for Today","https://m.media-amazon.com/images/I/810MMoKMA2L._AC_UY218_.jpg"
28,5,238,"B08DVDD2J1",false,8,"USD",0,0,0,6,4.6,"https://www.amazon.com/dp/B08DVDD2J1","27.60",false,false,false,false,"The Child, Society and the World: A selection of Speeches and writings (Montessori series Book 7)","https://m.media-amazon.com/images/I/61tC1wWEEGL._AC_UY218_.jpg"
28,6,239,"B075FK53PS",true,6.99,"USD",12.6,5.61,44.52,639,4.4,"https://www.amazon.com/dp/B075FK53PS","2811.60",false,false,false,false,"McGraw-Hill Education Math Grade 7, Second Edition","https://m.media-amazon.com/images/I/818Ec4pZwXL._AC_UY218_.jpg"
28,7,240,"B01N9F7X1I",true,24.99,"USD",34.99,10,28.58,71,4.7,"https://www.amazon.com/dp/B01N9F7X1I","333.70",false,false,false,false,"Teaching the Next Generations: A Comprehensive Guide for Teaching Christian Formation","https://m.media-amazon.com/images/I/91x5OmacllL._AC_UY218_.jpg"
28,8,241,"B08S6M3ZXS",false,74.99,"USD",0,0,0,1,5,"https://www.amazon.com/dp/B08S6M3ZXS","5.00",false,false,false,false,"Early Childhood Education Today","https://m.media-amazon.com/images/I/512JuWMihlL._AC_UY218_.jpg"
29,1,242,"B0048EJXZW",false,8.99,"USD",0,0,0,14,4.5,"https://www.amazon.com/dp/B0048EJXZW","63.00",false,false,false,false,"Thomas Jefferson Education for Teens (The Leadership Education Library Book 4)","https://m.media-amazon.com/images/I/71WUTqOIpaL._AC_UY218_.jpg"
29,2,243,"B0753GTM2X",true,0,"USD",1.99,1.99,100,11,4.1,"https://www.amazon.com/dp/B0753GTM2X","45.10",false,false,false,false,"Math Preschool Kindergarten Subtraction","https://m.media-amazon.com/images/I/817+A4WmnML._AC_UY218_.jpg"
29,3,244,"B07C6JJJ51",true,34,"USD",60,26,43.33,12,4.5,"https://www.amazon.com/dp/B07C6JJJ51","54.00",false,false,false,false,"Understanding Children with Autism Spectrum Disorders: Educators Partnering with Families","https://m.media-amazon.com/images/I/41JzbtxqpdL._AC_UY218_.jpg"
29,4,245,"B06XBFPLTJ",true,16.52,"USD",25.99,9.47,36.44,576,4.7,"https://www.amazon.com/dp/B06XBFPLTJ","2707.20",false,false,false,false,"Troublemakers: Lessons in Freedom from Young Children at School","https://m.media-amazon.com/images/I/91zzBYOyvkL._AC_UY218_.jpg"
29,5,246,"B07T6XFR55",true,9.99,"USD",17.99,8,44.47,66,4.6,"https://www.amazon.com/dp/B07T6XFR55","303.60",false,false,false,false,"Let the Children Play: How More Play Will Save Our Schools and Help Children Thrive","https://m.media-amazon.com/images/I/817Gi+JB60L._AC_UY218_.jpg"
29,6,247,"B00U75KJ86",true,12.99,"USD",16.95,3.96,23.36,2235,4.7,"https://www.amazon.com/dp/B00U75KJ86","10504.50",false,false,false,false,"Story of the World, Vol. 1: History for the Classical Child: Ancient Times (Revised Second Edition) (Vol. 1) (Story of the...","https://m.media-amazon.com/images/I/81D1Hro+joL._AC_UY218_.jpg"
29,7,248,"B00HZ3FV8G",true,41.99,"USD",199.95,157.96,79,975,4.6,"https://www.amazon.com/dp/B00HZ3FV8G","4485.00",false,false,false,false,"Health, Safety, and Nutrition for the Young Child","https://m.media-amazon.com/images/I/81bQEIhgB+L._AC_UY218_.jpg"
29,8,249,"B006Y0XRIW",false,74.99,"USD",0,0,0,81,4.3,"https://www.amazon.com/dp/B006Y0XRIW","348.30",false,false,false,false,"Exploring Your Role in Early Childhood Education (Myeducationlab)","https://m.media-amazon.com/images/I/51Bnc75TUqL._AC_UY218_.jpg"
30,1,250,"B07H7S34KD",true,49.99,"USD",51,1.01,1.98,29,4.6,"https://www.amazon.com/dp/B07H7S34KD","133.40",false,false,false,false,"Brain-Compatible Dance Education","https://m.media-amazon.com/images/I/81kjO+tMYRL._AC_UY218_.jpg"
30,2,251,"B077ZP2ZM4",true,0,"USD",3.43,3.43,100,35,4.3,"https://www.amazon.com/dp/B077ZP2ZM4","150.50",false,false,false,false,"Take Me Back to Italy - Geography Education for Kids | Children's Explore the World Books","https://m.media-amazon.com/images/I/81uE7LFEi+L._AC_UY218_.jpg"
30,3,252,"B00XIH247O",true,74.99,"USD",133.32,58.33,43.75,153,4.5,"https://www.amazon.com/dp/B00XIH247O","688.50",false,false,false,false,"Assessing and Guiding Young Children's Development and Learning","https://m.media-amazon.com/images/I/81pYWi3YKZL._AC_UY218_.jpg"
30,4,253,"B08WPWFZFF",true,16.89,"USD",23.99,7.1,29.6,7,4.4,"https://www.amazon.com/dp/B08WPWFZFF","30.80",false,false,false,false,"Forming Resilient Children: The Role of Spiritual Formation for Healthy Development","https://m.media-amazon.com/images/I/81vkSaao27L._AC_UY218_.jpg"
30,5,254,"B0048EJXW0",false,9.99,"USD",0,0,0,47,4.5,"https://www.amazon.com/dp/B0048EJXW0","211.50",false,false,false,false,"Leadership Education: The Phases of Learning (The Leadership Education Library Book 2)","https://m.media-amazon.com/images/I/81EMaJ1LQCL._AC_UY218_.jpg"
30,6,255,"B01G7BALP4",true,44.6,"USD",49.95,5.35,10.71,1,4,"https://www.amazon.com/dp/B01G7BALP4","4.00",false,false,false,false,"Adventure Education: Fun games and activities for children and young people","https://m.media-amazon.com/images/I/513dzVvLFhL._AC_UY218_.jpg"
30,7,256,"B09Y9L13F3",false,0,"USD",0,0,0,37,5,"https://www.amazon.com/dp/B09Y9L13F3","185.00",false,false,false,false,"Birds: An introduction to what makes a bird, a bird. (Wild Wonders Animal Education)","https://m.media-amazon.com/images/I/61wZ0TBoT6L._AC_UY218_.jpg"
30,8,257,"B09C5LRSSN",true,6.99,"USD",21.99,15,68.21,176,4.6,"https://www.amazon.com/dp/B09C5LRSSN","809.60",false,false,false,false,"Changing Our Minds: How children can take control of their own learning","https://m.media-amazon.com/images/I/717WDuQ9zjL._AC_UY218_.jpg"
3,9,258,"B08DT1GB3Q",true,58.89,"USD",70,11.11,15.87,160,4.7,"https://www.amazon.com/dp/B08DT1GB3Q","752.00",false,false,false,false,"Developmentally Appropriate Practice in Early Childhood Programs Serving Children from Birth Through Age 8, Fourth Edition...","https://m.media-amazon.com/images/I/7182PA+cKdL._AC_UY218_.jpg"
3,10,259,"B07N2XVLRD",true,45.22,"USD",125,79.78,63.82,105,4.7,"https://www.amazon.com/dp/B07N2XVLRD","493.50",false,false,false,false,"Introduction to Early Childhood Education","https://m.media-amazon.com/images/I/91muJAuqAoL._AC_UY218_.jpg"
31,1,260,"B07W4DDBZ7",false,13.99,"USD",0,0,0,15,4.2,"https://www.amazon.com/dp/B07W4DDBZ7","63.00",false,false,false,false,"Education for Life: Preparing Children to Meet Today's Challenges","https://m.media-amazon.com/images/I/81gW4ootWML._AC_UY218_.jpg"
3,11,261,"B07DX9ZCHB",false,9.99,"USD",0,0,0,59,4.8,"https://www.amazon.com/dp/B07DX9ZCHB","283.20",false,false,false,false,"Children of the Universe: Cosmic Education in the Montessori Elementary Classroom","https://m.media-amazon.com/images/I/81j0iahd+dL._AC_UY218_.jpg"
31,2,262,"B0B4P8CC8X",false,0,"USD",0,0,0,16,4.9,"https://www.amazon.com/dp/B0B4P8CC8X","78.40",false,false,false,false,"Challenges of Gifted Children: An Alternative “How to” Guide for Parents on Managing Their Spiritually Gifted Child in a N...","https://m.media-amazon.com/images/I/71qInpKh6JL._AC_UY218_.jpg"
3,12,263,"B00G1SDKOS",true,21.99,"USD",29.95,7.96,26.58,52,4.6,"https://www.amazon.com/dp/B00G1SDKOS","239.20",false,false,false,false,"Social & Emotional Development: Connecting Science and Practice in Early Childhood Settings","https://m.media-amazon.com/images/I/812dFLnaDzL._AC_UY218_.jpg"
31,3,264,"B0024CF09I",true,9.99,"USD",16.99,7,41.2,34,4.5,"https://www.amazon.com/dp/B0024CF09I","153.00",false,false,false,false,"How Your Child Learns Best: Brain-Friendly Strategies You Can Use to Ignite Your Child's Learning and Increase School Success","https://m.media-amazon.com/images/I/51V+leOUt2L._AC_UY218_.jpg"
3,13,265,"B00BU1CTNE",true,8.49,"USD",9.99,1.5,15.02,57,4.1,"https://www.amazon.com/dp/B00BU1CTNE","233.70",false,false,false,false,"The Montessori Method: Scientific Pedagogy as Applied to Child Education in the Children's Houses with Additions and Revis...","https://m.media-amazon.com/images/I/711t+Z82VzL._AC_UY218_.jpg"
31,4,266,"B01BAYWZM0",false,0,"USD",0,0,0,2441,4.4,"https://www.amazon.com/dp/B01BAYWZM0","10740.40",false,false,false,false,"The Education of Dixie Dupree","https://m.media-amazon.com/images/I/816lP3OPgdL._AC_UY218_.jpg"
3,14,267,"B00QXKGK6E",false,41.99,"USD",0,0,0,460,4.7,"https://www.amazon.com/dp/B00QXKGK6E","2162.00",false,false,false,false,"Positive Child Guidance","https://m.media-amazon.com/images/I/91u3FnSsWgL._AC_UY218_.jpg"
31,5,268,"B0BVRBWGQR",false,8.06,"USD",0,0,0,2,5,"https://www.amazon.com/dp/B0BVRBWGQR","10.00",false,false,false,false,"Childbirth Education For Parents: A guide for labour, birth and newborn care","https://m.media-amazon.com/images/I/81h-A9X5c0L._AC_UY218_.jpg"
3,15,269,"B07L2QJ7RT",true,0,"USD",31.93,31.93,100,1931,4.8,"https://www.amazon.com/dp/B07L2QJ7RT","9268.80",false,false,true,false,"The Call of the Wild and Free: Reclaiming the Wonder in Your Child's Education, A New Way to Homeschool","https://m.media-amazon.com/images/I/81fRuX6xE4L._AC_UY218_.jpg"
31,6,270,"B097Z9L6HJ",false,0,"USD",0,0,0,26,4.9,"https://www.amazon.com/dp/B097Z9L6HJ","127.40",false,false,false,false,"Answering Autism: The Doman Method® Plan for Autism, ADD and Neurodevelopmental Delays (The Doman Method® Series)","https://m.media-amazon.com/images/I/61PQc7s38dS._AC_UY218_.jpg"
3,16,271,"B074TRR8GM",true,9.99,"USD",25.99,16,61.56,108,4.8,"https://www.amazon.com/dp/B074TRR8GM","518.40",false,false,false,false,"Get Out Now: Why You Should Pull Your Child from Public School Before It's Too Late","https://m.media-amazon.com/images/I/81R+E4g7noL._AC_UY218_.jpg"
31,7,272,"B0C1Q937QQ",false,0,"USD",0,0,0,4,5,"https://www.amazon.com/dp/B0C1Q937QQ","20.00",false,false,false,false,"Unlocking Your Child's Brain: Strategies for Parents to Combat Post Pandemic Learning Loss in Your Teenagers - A Social-Em...","https://m.media-amazon.com/images/I/71W7T4E+xhL._AC_UY218_.jpg"
31,8,273,"B07HCTXG6Y",true,10.99,"USD",12.99,2,15.4,369,4.7,"https://www.amazon.com/dp/B07HCTXG6Y","1734.30",false,false,false,false,"Unschooled: Raising Curious, Well-Educated Children Outside the Conventional Classroom","https://m.media-amazon.com/images/I/81wf1fw+ClL._AC_UY218_.jpg"
32,1,275,"B09R525W1Q",true,0,"USD",14.99,14.99,100,20,4.5,"https://www.amazon.com/dp/B09R525W1Q","90.00",false,false,false,false,"Essential Sex Education Book for Parents: Guided Conversations to Have with Your Tweens and Teens","https://m.media-amazon.com/images/I/71X2VG1LtbL._AC_UY218_.jpg"
32,2,276,"B08W1PV57T",false,29.99,"USD",0,0,0,18,5,"https://www.amazon.com/dp/B08W1PV57T","90.00",false,false,false,false,"Every Child Can Learn: Your Roadmap to Inclusive Education","https://m.media-amazon.com/images/I/6105dUpsN0L._AC_UY218_.jpg"
32,3,277,"B09GHS7WJY",true,16.49,"USD",21.99,5.5,25.01,41,4.7,"https://www.amazon.com/dp/B09GHS7WJY","192.70",false,false,false,false,"Your Children Are Very Greatly in Danger: School Segregation in Rochester, New York","https://m.media-amazon.com/images/I/91QRyTDumSL._AC_UY218_.jpg"
32,4,278,"B07ZQQWVZL",true,22.49,"USD",29.95,7.46,24.91,21,4.7,"https://www.amazon.com/dp/B07ZQQWVZL","98.70",false,false,false,false,"Trauma-Responsive Strategies for Early Childhood","https://m.media-amazon.com/images/I/71IBOX3324L._AC_UY218_.jpg"
32,5,279,"B01DTD7EA8",true,0,"USD",13.99,13.99,100,223,4.8,"https://www.amazon.com/dp/B01DTD7EA8","1070.40",false,false,false,false,"The Disciple-Making Parent: A Comprehensive Guidebook for Raising Your Children to Love and Follow Jesus Christ","https://m.media-amazon.com/images/I/71FURZB8iBL._AC_UY218_.jpg"
32,6,280,"B004OBZWRC",true,14.74,"USD",170,155.26,91.33,5,5,"https://www.amazon.com/dp/B004OBZWRC","25.00",false,false,false,false,"Rethinking Play and Pedagogy in Early Childhood Education: Concepts, Contexts and Cultures","https://m.media-amazon.com/images/I/512mpSzeCSL._AC_UY218_.jpg"
32,7,281,"B073RNJ6DD",false,3.99,"USD",0,0,0,7,3.2,"https://www.amazon.com/dp/B073RNJ6DD","22.40",false,false,false,false,"Los cisnes salvajes – 야생의 백조 (español – coreano): Libro bilingüe para niños basado en un cuento de hadas de Hans Christian...","https://m.media-amazon.com/images/I/818d-xFyMtL._AC_UY218_.jpg"
33,1,283,"B0073XR7BM",true,9.99,"USD",17.99,8,44.47,194,4.6,"https://www.amazon.com/dp/B0073XR7BM","892.40",false,false,false,false,"The Good News Club: The Christian Right's Stealth Assault on America's Children","https://m.media-amazon.com/images/I/A11yKvWEiRL._AC_UY218_.jpg"
33,2,284,"B01ACKKR8M",true,17.02,"USD",30.95,13.93,45.01,93,4.6,"https://www.amazon.com/dp/B01ACKKR8M","427.80",false,false,false,false,"Trauma-Sensitive Schools: Learning Communities Transforming Children's Lives, K–5","https://m.media-amazon.com/images/I/81uyAsylMCL._AC_UY218_.jpg"
33,3,285,"B0BHPVDBDH",false,0,"USD",0,0,0,10,4.8,"https://www.amazon.com/dp/B0BHPVDBDH","48.00",false,false,false,false,"A Police Officer's Busy Day: Community Helpers - You Can Be Anything You Want To Be (Busy Days)","https://m.media-amazon.com/images/I/71UyR1lpgKL._AC_UY218_.jpg"
33,5,287,"B07N69F1W7",true,11.99,"USD",17.99,6,33.35,3271,4.7,"https://www.amazon.com/dp/B07N69F1W7","15373.70",false,false,false,false,"Permission to Feel: Unlocking the Power of Emotions to Help Our Kids, Ourselves, and Our Society Thrive","https://m.media-amazon.com/images/I/81mYY5X1nqL._AC_UY218_.jpg"
33,6,288,"B08WPH3ZG1",false,0,"USD",0,0,0,35,4.5,"https://www.amazon.com/dp/B08WPH3ZG1","157.50",false,false,false,false,"Cousins Forever - Ξαδέρφια για πάντα: Α bilingual children's book in Greek and English (Greek Bilingual Books - Fostering ...","https://m.media-amazon.com/images/I/61BCILKhlLL._AC_UY218_.jpg"
33,7,289,"B099XB9JVT",true,34.99,"USD",44.95,9.96,22.16,6,4.6,"https://www.amazon.com/dp/B099XB9JVT","27.60",false,false,false,false,"Introduction to Early Childhood Education and Care: An Intercultural Perspective","https://m.media-amazon.com/images/I/81SiJKRuUHL._AC_UY218_.jpg"
33,8,290,"B00PDDNT48",true,31.16,"USD",34.95,3.79,10.84,77,4.4,"https://www.amazon.com/dp/B00PDDNT48","338.80",false,false,false,false,"One Child, Two Languages: A Guide for Early Childhood Educators of Children Learning English as a Second Language, Second ...","https://m.media-amazon.com/images/I/51IjJ3bPltL._AC_UY218_.jpg"
33,9,291,"B07R4C53X5",true,74.99,"USD",106.65,31.66,29.69,114,4.5,"https://www.amazon.com/dp/B07R4C53X5","513.00",false,false,false,false,"Foundations and Best Practices in Early Childhood Education: History, Theories, and Approaches to Learning","https://m.media-amazon.com/images/I/71pRJn1OHcL._AC_UY218_.jpg"
34,1,292,"B077ZJLHJX",false,0,"USD",0,0,0,2,3,"https://www.amazon.com/dp/B077ZJLHJX","6.00",false,false,false,false,"An Introduction to the Wonderful World of Robotics - Science Book for Kids | Children's Science Education Books","https://m.media-amazon.com/images/I/91HVaMhw3JL._AC_UY218_.jpg"
34,2,293,"B075SSXN7J",true,6.99,"USD",12.6,5.61,44.52,120,4.5,"https://www.amazon.com/dp/B075SSXN7J","540.00",false,false,false,false,"McGraw-Hill Education Math Grade 2, Second Edition","https://m.media-amazon.com/images/I/81pVDHIVqcL._AC_UY218_.jpg"
34,3,294,"B007V919LC",false,7.49,"USD",0,0,0,7,5,"https://www.amazon.com/dp/B007V919LC","35.00",false,false,false,false,"Influencing Children to Become World Changers","https://m.media-amazon.com/images/I/81ZFollVAuL._AC_UY218_.jpg"
34,4,295,"B09YCZGPZL",true,23.7,"USD",24.95,1.25,5.01,5,5,"https://www.amazon.com/dp/B09YCZGPZL","25.00",false,false,false,false,"Children of the Dragonfly: Native American Voices on Child Custody and Education","https://m.media-amazon.com/images/I/81Ipo3uI5nL._AC_UY218_.jpg"
34,5,296,"B0BWSQXKXY",false,0,"USD",0,0,0,2,4,"https://www.amazon.com/dp/B0BWSQXKXY","8.00",false,false,false,false,"Tout sur la sécurité des corps: Mon guide pour garder le corps en sécurité (French Edition) (Livre d'images pour les enfan...","https://m.media-amazon.com/images/I/71U4tfCkTBL._AC_UY218_.jpg"
34,6,297,"B0043XXIPE",false,0,"USD",0,0,0,50,4.5,"https://www.amazon.com/dp/B0043XXIPE","225.00",false,false,false,false,"PAPA PICCOLO-Families, Fatherhood, Caring and Nurturing Text-Only Children's Book (Character Education Picture eBooks for ...","https://m.media-amazon.com/images/I/71SaG9gNMSL._AC_UY218_.jpg"
34,7,298,"B01EHOIIJO",false,74.99,"USD",0,0,0,185,4.6,"https://www.amazon.com/dp/B01EHOIIJO","851.00",false,false,false,false,"Young Child, The: Development from Prebirth Through Age Eight (What's New in Ed Psych / Tests & Measurements)","https://m.media-amazon.com/images/I/81sRXpnpGxL._AC_UY218_.jpg"
34,8,299,"B00HWGLWGG",true,2.99,"USD",17.99,15,83.38,104,4.3,"https://www.amazon.com/dp/B00HWGLWGG","447.20",false,false,false,false,"I Learn from Children: An Adventure in Progressive Education","https://m.media-amazon.com/images/I/711Tz2qjuYL._AC_UY218_.jpg"
