"position.page","position.position","position.global_position","asin","price.discounted","price.current_price","price.currency","price.before_price","price.savings_amount","price.savings_percent","reviews.total_reviews","reviews.rating","url","score","sponsored","amazonChoice","bestSeller","amazonPrime","title","thumbnail"
30,14,775,"B07L53J9L3",true,0,"USD",13,13,100,247,4.1,"https://www.amazon.com/dp/B07L53J9L3","1012.70",false,false,false,false,"Endomorph Diet: Strategically Use Intermittent Fasting and Flexible Dieting to Work with Your Body Type","https://m.media-amazon.com/images/I/A1bh1IOUNEL._AC_UY218_.jpg"
30,15,776,"B08R2KW8DN",true,14.99,"USD",28.99,14,48.29,1230,4.7,"https://www.amazon.com/dp/B08R2KW8DN","5781.00",false,false,false,false,"The Shift: 7 Powerful Mindset Changes for Lasting Weight Loss","https://m.media-amazon.com/images/I/71f5w3F7HJL._AC_UY218_.jpg"
30,16,777,"B072WMP9F4",true,0,"USD",19.22,19.22,100,193,3.4,"https://www.amazon.com/dp/B072WMP9F4","656.20",false,false,false,false,"FISICO AL TOP. Esercizi e Programmi Di Allenamento a Corpo Libero per Migliorare Forza e Forma Fisica. I Segreti Della Fit...","https://m.media-amazon.com/images/I/81j6w05ZeLL._AC_UY218_.jpg"
31,10,779,"B0BZTF73VH",false,0,"USD",0,0,0,1,1,"https://www.amazon.com/dp/B0BZTF73VH","1.00",false,false,false,false,"SHIBARI FOR STARTERS TO PRO: A Step-by-Step Guide to Becoming a Master of Japanese Rope Bondage and Kinbaku","https://m.media-amazon.com/images/I/71+KsRVUoZL._AC_UY218_.jpg"
31,12,781,"B07G13W11T",true,8.49,"USD",9.99,1.5,15.02,1236,4.2,"https://www.amazon.com/dp/B07G13W11T","5191.20",false,false,false,false,"Allen Carr's Easy Way for Women to Lose Weight: The original Easyway method (Allen Carr's Easyway Book 2)","https://m.media-amazon.com/images/I/71WCz9S-uPL._AC_UY218_.jpg"
31,13,782,"B08QHVCHPS",false,3.99,"USD",0,0,0,1059,4.5,"https://www.amazon.com/dp/B08QHVCHPS","4765.50",false,false,false,false,"Clever Guts Diet Recipe Book: 150 delicious recipes to mend your gut and boost your health and wellbeing","https://m.media-amazon.com/images/I/71p8ZiNT6OL._AC_UY218_.jpg"
31,14,783,"B01N7KAFYY",true,17.09,"USD",39.99,22.9,57.26,3015,4.7,"https://www.amazon.com/dp/B01N7KAFYY","14170.50",false,false,false,false,"Essential Oils: Ancient Medicine for a Modern World","https://m.media-amazon.com/images/I/916t7klSB6L._AC_UY218_.jpg"
31,16,785,"B07JQC9NZN",true,0,"USD",13,13,100,59,4.1,"https://www.amazon.com/dp/B07JQC9NZN","241.90",false,false,false,false,"Intermittent Fasting: The Spartan Approach to Diet, Fat Loss, and Health","https://m.media-amazon.com/images/I/71TVCvls6xL._AC_UY218_.jpg"
32,9,786,"B00SA56KD8",false,0,"USD",0,0,0,141,3.9,"https://www.amazon.com/dp/B00SA56KD8","549.90",false,false,false,false,"The French Diet: French Secrets to Weight Loss, Health, and Happiness","https://m.media-amazon.com/images/I/81upDshp6IL._AC_UY218_.jpg"
32,10,787,"B00J1JPTNY",true,13.99,"USD",17.99,4,22.23,1013,4.4,"https://www.amazon.com/dp/B00J1JPTNY","4457.20",false,false,false,false,"Microbiome Diet: The Scientifically Proven Way to Restore Your Gut Health and Achieve Permanent Weight Loss (Microbiome Me...","https://m.media-amazon.com/images/I/71XEEcBB-TL._AC_UY218_.jpg"
32,11,788,"B0BCJDL12M",true,39.55,"USD",52.95,13.4,25.31,26,4.2,"https://www.amazon.com/dp/B0BCJDL12M","109.20",false,false,false,false,"Your Dieting Daughter: Antidotes Parents can Provide for Body Dissatisfaction, Excessive Dieting, and Disordered Eating","https://m.media-amazon.com/images/I/41m+veBUZ7L._AC_UY218_.jpg"
32,12,789,"B086MWVB79",true,0,"USD",14.95,14.95,100,23,4.1,"https://www.amazon.com/dp/B086MWVB79","94.30",false,false,false,false,"Mediterranean Diet for Beginners: 7 The Magic Number to Lose Weight Without Dieting, Boost Your Health, and Avoid Unpleasa...","https://m.media-amazon.com/images/I/A1wJH3WS-SL._AC_UY218_.jpg"
32,13,790,"B07CQW685M",true,0,"USD",6.04,6.04,100,111,4,"https://www.amazon.com/dp/B07CQW685M","444.00",false,false,false,false,"INTERMITTENT FASTING FOR WEIGHT LOSS: A BEGINNERS GUIDE TO 16:8: Keto Dieting 101 For Women & Men Fat Burning, Belly Fat, ...","https://m.media-amazon.com/images/I/81K3GMz2kVL._AC_UY218_.jpg"
32,14,791,"B013RYIONU",false,0,"USD",0,0,0,410,4.6,"https://www.amazon.com/dp/B013RYIONU","1886.00",false,false,false,false,"How Vaccines Wreck Human Immunity: A Forbidden Doctor Publication (1)","https://m.media-amazon.com/images/I/91ofUWyosrL._AC_UY218_.jpg"
32,15,792,"B00LUCZZGG",false,0,"USD",0,0,0,17,3.6,"https://www.amazon.com/dp/B00LUCZZGG","61.20",false,false,false,false,"Lose Weight Without Dieting: I lost 80 Pounds in 6 Months and I Was Not Even on a Diet","https://m.media-amazon.com/images/I/81qTS06qpSL._AC_UY218_.jpg"
32,16,793,"B0102OKBUC",false,0,"USD",0,0,0,17,3.3,"https://www.amazon.com/dp/B0102OKBUC","56.10",false,false,false,false,"Narcissist: How To Understand, Love, Survive And Thrive With Your Narcissist (Or Overcome Manipulative Behavior, Break Up ...","https://m.media-amazon.com/images/I/91VBSlyYJAL._AC_UY218_.jpg"
33,9,794,"B01CZ2J7AE",true,5.65,"USD",5.99,0.34,5.68,6,4.4,"https://www.amazon.com/dp/B01CZ2J7AE","26.40",false,false,false,false,"User's Guide to Energy-Boosting Supplements: Discover the Best Supplements for Safely Enhancing Your Energy Levels (Basic ...","https://m.media-amazon.com/images/I/81Cg2ObpLfL._AC_UY218_.jpg"
33,11,796,"B074PDMVMY",true,6.49,"USD",6.99,0.5,7.15,75,4.5,"https://www.amazon.com/dp/B074PDMVMY","337.50",false,false,false,false,"Your Health Your Choice","https://m.media-amazon.com/images/I/81VxzxWVrEL._AC_UY218_.jpg"
33,12,797,"B07C9XQSTP",true,9.99,"USD",16.99,7,41.2,1187,4.4,"https://www.amazon.com/dp/B07C9XQSTP","5222.80",false,false,false,false,"The DASH Diet Mediterranean Solution: The Best Eating Plan to Control Your Weight and Improve Your Health for Life (A DASH...","https://m.media-amazon.com/images/I/91keg80gYuL._AC_UY218_.jpg"
33,13,798,"B00APKG5D6",false,12.99,"USD",0,0,0,43,4,"https://www.amazon.com/dp/B00APKG5D6","172.00",false,false,false,false,"Gut Reaction: A day-by-day programme for choosing and combining foods for better health and easy weight loss (Positive Hea...","https://m.media-amazon.com/images/I/81BCNQ2cGrL._AC_UY218_.jpg"
33,15,800,"B0BZN5KCX4",false,0,"USD",0,0,0,2,5,"https://www.amazon.com/dp/B0BZN5KCX4","10.00",false,false,false,false,"Consciously Improve Your Health And Fitness: A Guidebook","https://m.media-amazon.com/images/I/71tQpAufU5L._AC_UY218_.jpg"
33,16,801,"B07B24W6Y9",false,0,"USD",0,0,0,719,3.9,"https://www.amazon.com/dp/B07B24W6Y9","2804.10",false,false,false,false,"How to Lose 10 Pounds in A Week: The Ultimate 7 Day Weight Loss Kick-Start for Optimum Health (Emma Greens Weight loss boo...","https://m.media-amazon.com/images/I/91r8uBKo5LL._AC_UY218_.jpg"
34,9,802,"B00CJJDCSW",false,0,"USD",0,0,0,33,3.9,"https://www.amazon.com/dp/B00CJJDCSW","128.70",false,false,false,false,"Treadmill Desk Revolution: The Easy Way to Lose Up to 50 Pounds in a Year – Without Dieting","https://m.media-amazon.com/images/I/71k6biGe+cL._AC_UY218_.jpg"
34,10,803,"B0C38Q5GDM",false,0,"USD",0,0,0,1,5,"https://www.amazon.com/dp/B0C38Q5GDM","5.00",false,false,false,false,"UNLOCKING LONGEVITY: KEYS TO A LONG & HEALTHY LIFE","https://m.media-amazon.com/images/I/71oDeEyfZTL._AC_UY218_.jpg"
34,11,804,"B087T7KM58",false,0,"USD",0,0,0,4,4.6,"https://www.amazon.com/dp/B087T7KM58","18.40",false,false,false,false,"VINAGRE DE MANZANA: ORO DEL BIENESTAR Salud, Belleza, Cocina (Spanish Edition)","https://m.media-amazon.com/images/I/61vLqn2WLtL._AC_UY218_.jpg"
34,12,805,"B005WALIM2",false,2.99,"USD",0,0,0,29,4.2,"https://www.amazon.com/dp/B005WALIM2","121.80",false,false,false,false,"The Oat Bran Guide (Delicious Dieting Book 1)","https://m.media-amazon.com/images/I/41L7sdNwyKL._AC_UY218_.jpg"
34,13,806,"B000FC2PKQ",true,13.99,"USD",16.95,2.96,17.46,2699,4.4,"https://www.amazon.com/dp/B000FC2PKQ","11875.60",false,false,false,false,"French Women Don't Get Fat","https://m.media-amazon.com/images/I/818guE3PenL._AC_UY218_.jpg"
34,14,807,"B01LDGLEP4",false,0,"USD",0,0,0,9,4.6,"https://www.amazon.com/dp/B01LDGLEP4","41.40",false,false,false,false,"The 80/20 Plan: Nutrition Reinvented: The Key to Dieting Without Deprivation","https://m.media-amazon.com/images/I/81TZmLj47pL._AC_UY218_.jpg"
34,15,808,"B00ASP94XQ",false,0,"USD",0,0,0,57,4,"https://www.amazon.com/dp/B00ASP94XQ","228.00",false,false,false,false,"The Smart Diet Plan: Permanent Weight Loss without Dieting or Starving","https://m.media-amazon.com/images/I/817ey3XanKL._AC_UY218_.jpg"
34,16,809,"B07B26QCYL",false,0,"USD",0,0,0,519,3.9,"https://www.amazon.com/dp/B07B26QCYL","2024.10",false,false,false,false,"How I Lost a 100 Pounds!: My Personal Weight Loss Strategies for Optimal Health and Happiness (Emma Greens Weight loss boo...","https://m.media-amazon.com/images/I/81gHMsJ8asL._AC_UY218_.jpg"
35,9,810,"B0C1ZZFGWW",false,0,"USD",0,0,0,1,5,"https://www.amazon.com/dp/B0C1ZZFGWW","5.00",false,false,false,false,"INTRODUCTION TO MAGIC HEALING OF INDIAN LIFE SCIENCE AYURVEDA : The connection between Ayurveda and vedic astrology","https://m.media-amazon.com/images/I/81apKD1OD1L._AC_UY218_.jpg"
35,10,811,"B07M9CWF9D",false,0,"USD",0,0,0,110,4.4,"https://www.amazon.com/dp/B07M9CWF9D","484.00",false,false,false,false,"MSM: On Our Way Back To Health with Sulfur: The Forgotten Nutrient (Health Learning Handbooks)","https://m.media-amazon.com/images/I/81rA3fpMzdL._AC_UY218_.jpg"
35,11,812,"B003EVJKEO",true,9.99,"USD",14.99,5,33.36,301,4.5,"https://www.amazon.com/dp/B003EVJKEO","1354.50",false,false,false,false,"The Rules of ""Normal"" Eating: A Commonsense Approach for Dieters, Overeaters, Undereaters, Emotional Eaters, and Everyone ...","https://m.media-amazon.com/images/I/51sbBIR8w6L._AC_UY218_.jpg"
35,12,813,"B07Y9NGMYQ",false,0,"USD",0,0,0,37,4.3,"https://www.amazon.com/dp/B07Y9NGMYQ","159.10",false,false,false,false,"Como Sobreviver na Selva Urbana: Um protocolo para a cura da Asma, Alergia, TPM e Obesidade (Austrian Health System Livro ...","https://m.media-amazon.com/images/I/71sD+Lk-NGL._AC_UY218_.jpg"
35,13,814,"B09V8DZ9R7",false,0,"USD",0,0,0,2,3,"https://www.amazon.com/dp/B09V8DZ9R7","6.00",false,false,false,false,"Exercise for senior over 60: Health,fitness and dieting, A simple guide with the necessary knowledge to carry out physical...","https://m.media-amazon.com/images/I/81AtM0beY4L._AC_UY218_.jpg"
35,14,815,"B0C2BM9SDQ",false,0,"USD",0,0,0,6,5,"https://www.amazon.com/dp/B0C2BM9SDQ","30.00",false,false,false,false,"11-Minute Chair Exercises for Seniors: 8 Simple Workouts With 75+ Illustrated Moves To Supercharge Strength, Balance & Ove...","https://m.media-amazon.com/images/I/81kzbKs-mKL._AC_UY218_.jpg"
35,15,816,"B005UGFDZG",false,16.99,"USD",0,0,0,416,4.6,"https://www.amazon.com/dp/B005UGFDZG","1913.60",false,false,false,false,"The Men's Health Big Book of 15-Minute Workouts: A Leaner, Stronger Body--in 15 Minutes a Day!","https://m.media-amazon.com/images/I/81HkRtyNuYL._AC_UY218_.jpg"
35,16,817,"B0C18BD5RL",false,0,"USD",0,0,0,1,5,"https://www.amazon.com/dp/B0C18BD5RL","5.00",false,false,false,false,"Nail Care Essentials: Your Complete Guide to Healthy, Beautiful Nails.","https://m.media-amazon.com/images/I/71NGz08w9yL._AC_UY218_.jpg"
36,9,818,"B01DHIIW3I",false,0,"USD",0,0,0,8,3.6,"https://www.amazon.com/dp/B01DHIIW3I","28.80",false,false,false,false,"Fast Metabolism Diet: Lose Weight & Reduce Stress - Guide to Rapid Weight Loss and a Healthy Body (Weight Loss, Dieting, D...","https://m.media-amazon.com/images/I/91Cl4Ok1rNL._AC_UY218_.jpg"
36,10,819,"B00LQ99TMY",false,0,"USD",0,0,0,20,4.6,"https://www.amazon.com/dp/B00LQ99TMY","92.00",false,false,false,false,"Easy Ways to Lose Weight Without Dieting: How to Lose Weight Naturally (Without Weird Diets or Crazy Workout Regimens)","https://m.media-amazon.com/images/I/71BhrQFby4L._AC_UY218_.jpg"
36,11,820,"B00VWKAJ1W",true,12.99,"USD",16.99,4,23.54,671,4.4,"https://www.amazon.com/dp/B00VWKAJ1W","2952.40",false,false,false,false,"Smoothies for Kidney Health: A Delicious Approach to the Prevention and Management of Kidney Problems and So Much More","https://m.media-amazon.com/images/I/510o4hqon7L._AC_UY218_.jpg"
36,12,821,"B084GS6SJ5",false,0,"USD",0,0,0,1,3,"https://www.amazon.com/dp/B084GS6SJ5","3.00",false,false,false,false,"EATING: (2 Books in 1) Emotional Eating and Intuitive Eating: Stop Compulsive Eating, Stop Dieting, Eating Disorders and B...","https://m.media-amazon.com/images/I/81nhN27GZxL._AC_UY218_.jpg"
36,13,822,"B085DCHL8P",false,0,"USD",0,0,0,3,3,"https://www.amazon.com/dp/B085DCHL8P","9.00",false,false,false,false,"IIFYM & Flexible Dieting: Beginner's ""If It Fits Your Macros"" Flexible Macros Calorie Counting Diet Guide - Everything You...","https://m.media-amazon.com/images/I/81D+sga1I7L._AC_UY218_.jpg"
36,14,823,"B00MSZE6N2",false,0,"USD",0,0,0,75,3.9,"https://www.amazon.com/dp/B00MSZE6N2","292.50",false,false,false,false,"WEIGHT LOSS WITH WALKING: A Simple but Honestly Working Guide on How to Lose Weight with Walking (Weight Loss, Lose Fat, W...","https://m.media-amazon.com/images/I/81k6M3pmreL._AC_UY218_.jpg"
36,16,825,"B01FRPN7MK",true,2.99,"USD",14.99,12,80.05,2,5,"https://www.amazon.com/dp/B01FRPN7MK","10.00",false,false,false,false,"DEMENTIA ALZHEIMERS COOKBOOK: Recipes For Brain Health Longevity & Nutrition (SPECIAL DIET)","https://m.media-amazon.com/images/I/81xFhdEOZ2L._AC_UY218_.jpg"
37,9,826,"B0047Y0FFU",true,11.99,"USD",18.99,7,36.86,1122,4.4,"https://www.amazon.com/dp/B0047Y0FFU","4936.80",false,false,false,false,"21-Day Weight Loss Kickstart: Boost Metabolism, Lower Cholesterol, and Dramatically Improve Your Health","https://m.media-amazon.com/images/I/81uZv6TigpL._AC_UY218_.jpg"
37,10,827,"B015GT9X48",true,0.99,"USD",6.04,5.05,83.61,3,2.9,"https://www.amazon.com/dp/B015GT9X48","8.70",false,false,false,false,"Mediterranean Diet For Heart Health and Weight Loss: My 24 Weeks Research And Findings With 5 Overweight People On Mediter...","https://m.media-amazon.com/images/I/81pAkjWUTIL._AC_UY218_.jpg"
37,11,828,"B01KU2O6ZC",false,3.99,"USD",0,0,0,6,3.3,"https://www.amazon.com/dp/B01KU2O6ZC","19.80",false,false,false,false,"WEIGHT LOSS MAGIC SOUPS + CELEBRITY DIET SECRETS, HEALTHY EATING TIPS, GREEN SMOOTHIES, and Much More (EDIBLE EXCELLENCE, ...","https://m.media-amazon.com/images/I/81FqPRXO0ML._AC_UY218_.jpg"
37,12,829,"B00DD3APDI",false,0,"USD",0,0,0,174,4,"https://www.amazon.com/dp/B00DD3APDI","696.00",false,false,false,false,"The Prostate Health Diet: What to Eat to Prevent and Heal Prostate Problems Including Prostate Cancer, BPH Enlarged Prosta...","https://m.media-amazon.com/images/I/71wgw+9jRFL._AC_UY218_.jpg"
37,13,830,"B011BR45H4",false,0,"USD",0,0,0,4,4.6,"https://www.amazon.com/dp/B011BR45H4","18.40",false,false,false,false,"Low Carb High Protein Diet Made Easy: 70 Mouthwatering recipes using 10 MAIN INGREDIENTS ONLY! Weight Loss Guaranteed in ...","https://m.media-amazon.com/images/I/91VQCZ4tKWL._AC_UY218_.jpg"
37,14,831,"B0029PBVAC",true,13.49,"USD",16.99,3.5,20.6,185,4.5,"https://www.amazon.com/dp/B0029PBVAC","832.50",false,false,false,false,"TCM: A Natural Guide to Weight Loss That Lasts (Traditional Chinese Medicine)","https://m.media-amazon.com/images/I/51cvgdv3tGL._AC_UY218_.jpg"
37,15,832,"B00Z022VW8",false,0,"USD",0,0,0,8,3.7,"https://www.amazon.com/dp/B00Z022VW8","29.60",false,false,false,false,"HIIT Workouts: Learn How And Why HIIT Shreds Fat And How To Implement Starting Today! (HIIT, Interval Training, Cross Trai...","https://m.media-amazon.com/images/I/91ZW1fzc5aL._AC_UY218_.jpg"
37,16,833,"B07DT6YTR3",false,0,"USD",0,0,0,46,4.5,"https://www.amazon.com/dp/B07DT6YTR3","207.00",false,false,false,false,"Beat the Binge - Control Your Impulsive Overeating: Help! I'm Out of Control: The Connection Between Emotions and Impulsiv...","https://m.media-amazon.com/images/I/711hqfxN2XL._AC_UY218_.jpg"
38,9,834,"B076134V88",true,0,"USD",13,13,100,1660,4.3,"https://www.amazon.com/dp/B076134V88","7138.00",false,false,false,false,"Eat Stop Eat: Intermittent Fasting for Health and Weight Loss (English)","https://m.media-amazon.com/images/I/81yHV8ln7AL._AC_UY218_.jpg"
38,10,835,"B07C9WT97Q",false,13.99,"USD",0,0,0,173,4.4,"https://www.amazon.com/dp/B07C9WT97Q","761.20",false,false,false,false,"Men's Health Killing Fat: Use the Science of Thermodynamics to Blast Belly Bloat, Destroy Flab, and Stoke Your Metabolism","https://m.media-amazon.com/images/I/719BHfHImaL._AC_UY218_.jpg"
38,11,836,"B08KH95ZPY",true,0,"USD",13,13,100,31,4.2,"https://www.amazon.com/dp/B08KH95ZPY","130.20",false,false,false,false,"Plant-Based Diet: How to Lose Weight, Improve Your Health and Make Plant-Based Diet a Lifestyle: 30+ Delicious and Easy to...","https://m.media-amazon.com/images/I/81BLkOtkHKL._AC_UY218_.jpg"
38,12,837,"B07BJYWGPN",true,2.99,"USD",15.99,13,81.3,212,4.1,"https://www.amazon.com/dp/B07BJYWGPN","869.20",false,false,false,false,"Go Lean Vegan: The Revolutionary 30-day Diet Plan to Lose Weight and Feel Great","https://m.media-amazon.com/images/I/91WRJi+xDZL._AC_UY218_.jpg"
38,13,838,"B00FGOL8JW",true,8.85,"USD",17.35,8.5,48.99,575,4.4,"https://www.amazon.com/dp/B00FGOL8JW","2530.00",false,false,false,false,"The Thin Woman's Brain: Re-wiring the Brain for Permanent Weight Loss","https://m.media-amazon.com/images/I/81mb2dYHzJL._AC_UY218_.jpg"
38,14,839,"B01CZ2J6DW",true,3.64,"USD",7.99,4.35,54.44,15,4.5,"https://www.amazon.com/dp/B01CZ2J6DW","67.50",false,false,false,false,"User's Guide to Calcium & Magnesium (Basic Health Publications User's Guide)","https://m.media-amazon.com/images/I/71mSAlqt9IL._AC_UY218_.jpg"
38,15,840,"B006N2Z5CW",false,0,"USD",0,0,0,223,3.9,"https://www.amazon.com/dp/B006N2Z5CW","869.70",false,false,false,false,"CUT THE CRAP - lose weight fast without dieting, hypnosis OR motivation! (weight loss books)","https://m.media-amazon.com/images/I/71fiXnW50UL._AC_UY218_.jpg"
38,16,841,"B010546GS0",true,18.49,"USD",27.99,9.5,33.94,2267,4.6,"https://www.amazon.com/dp/B010546GS0","10428.20",false,false,false,false,"The Fully Raw Diet: 21 Days to Better Health, with Meal and Exercise Plans, Tips, and 75 Recipes","https://m.media-amazon.com/images/I/91Pmol5A+fL._AC_UY218_.jpg"
39,10,843,"B0871P7K7Q",true,3.99,"USD",12.99,9,69.28,12,5,"https://www.amazon.com/dp/B0871P7K7Q","60.00",false,false,false,false,"Stop Heart Attack Now - 3 Step Formula To Stop The Number One Killer Of Men And Women (Heart Health Book 1)","https://m.media-amazon.com/images/I/71c-es5SenL._AC_UY218_.jpg"
39,11,844,"B09HNJ9RLS",false,0,"USD",0,0,0,24,4.4,"https://www.amazon.com/dp/B09HNJ9RLS","105.60",false,false,false,false,"Self-Health Fix: How to Stop Being a Forever Patient and Start Taking Charge of Your Well-Being - PLUS Your Personal Healt...","https://m.media-amazon.com/images/I/71Bqg6+uMIL._AC_UY218_.jpg"
39,12,845,"B073SLYZ1W",false,15.99,"USD",0,0,0,140,4.4,"https://www.amazon.com/dp/B073SLYZ1W","616.00",false,false,false,false,"Men's Health The MetaShred Diet: Your 28-Day Rapid Fat-Loss Plan. Simple. Effective. Amazing.","https://m.media-amazon.com/images/I/A1X7pHnO0xL._AC_UY218_.jpg"
39,14,847,"B00DQN7TJI",true,7.99,"USD",12.95,4.96,38.3,9,4.2,"https://www.amazon.com/dp/B00DQN7TJI","37.80",false,false,false,false,"The Complete Idiot's Guide to Losing 20 Pounds in 2 Months Fast-Track: The Essential Plan You Need to Quickly Shed Weight ...","https://m.media-amazon.com/images/I/714YvqGntEL._AC_UY218_.jpg"
39,15,848,"B07DC2X5K8",true,7.99,"USD",22.99,15,65.25,735,4.5,"https://www.amazon.com/dp/B07DC2X5K8","3307.50",false,false,false,false,"Radiant: Recipes to heal your skin from within (Hannah Sillitoe Books)","https://m.media-amazon.com/images/I/71QS5y7P9bL._AC_UY218_.jpg"
39,16,849,"B00LG0BTJY",true,9.99,"USD",20.97,10.98,52.36,19,4,"https://www.amazon.com/dp/B00LG0BTJY","76.00",false,false,false,false,"Beyond Food: The 5 Keys to Kickstart Your Health","https://m.media-amazon.com/images/I/71bA6YzzP2L._AC_UY218_.jpg"
40,9,850,"B06W2P6VRF",true,8.99,"USD",17,8.01,47.12,869,4.7,"https://www.amazon.com/dp/B06W2P6VRF","4084.30",false,false,false,false,"Healing Mushrooms: A Practical and Culinary Guide to Using Mushrooms for Whole Body Health","https://m.media-amazon.com/images/I/91erb8xW6JL._AC_UY218_.jpg"
40,11,852,"B01CZ2J85I",true,5.65,"USD",5.99,0.34,5.68,1,1,"https://www.amazon.com/dp/B01CZ2J85I","1.00",false,false,false,false,"User's Guide to Natural Allergy Relief: Learn about the Many Natural Ways to Reduce Your Allergies (Basic Health Publicati...","https://m.media-amazon.com/images/I/717R18zUT9L._AC_UY218_.jpg"
40,14,855,"B014DIW0N4",true,9.99,"USD",15.99,6,37.52,151,4.3,"https://www.amazon.com/dp/B014DIW0N4","649.30",false,false,false,false,"The Breast Cancer Cookbook: Over 100 Easy Recipes for Cancer Prevention and to Boost Health During Treatment","https://m.media-amazon.com/images/I/91K4oectS6L._AC_UY218_.jpg"
41,9,858,"B00L3H5112",false,0,"USD",0,0,0,258,4,"https://www.amazon.com/dp/B00L3H5112","1032.00",false,false,false,false,"Anti-Inflammatory Diet: Your Ultimate Guide To Healing Inflammation, Alleviating Pain and Restoring Physical Health With 5...","https://m.media-amazon.com/images/I/91B4scrbXwL._AC_UY218_.jpg"
41,10,859,"B01BXRMC2W",false,0,"USD",0,0,0,1,5,"https://www.amazon.com/dp/B01BXRMC2W","5.00",false,false,false,false,"Weight Loss Naturally Simple Guide to Using Natural Herbs for a Boost of Energy and a Healthy Body! (Healthy eating, herba...","https://m.media-amazon.com/images/I/81u8vCBN4oL._AC_UY218_.jpg"
41,11,860,"B08C766QSX",false,18.17,"USD",0,0,0,9,4.7,"https://www.amazon.com/dp/B08C766QSX","42.30",false,false,false,false,"The Heart Health Guide","https://m.media-amazon.com/images/I/91Cq-EaIJpL._AC_UY218_.jpg"
41,12,861,"B01BYFBNZK",true,6.99,"USD",9.99,3,30.03,238,4.6,"https://www.amazon.com/dp/B01BYFBNZK","1094.80",false,false,false,false,"World Peace Diet (Tenth Anniversary Edition): Eating for Spiritual Health and Social Harmony","https://m.media-amazon.com/images/I/71gj+FRpCOL._AC_UY218_.jpg"
41,14,863,"B082J5LR62",true,0,"USD",18.99,18.99,100,839,4.6,"https://www.amazon.com/dp/B082J5LR62","3859.40",false,false,false,false,"The Everything Macro Diet Cookbook: 300 Satisfying Recipes for Shedding Pounds and Gaining Lean Muscle (Everything®)","https://m.media-amazon.com/images/I/715uQHwsFzL._AC_UY218_.jpg"
41,15,864,"B01L28CDOY",true,0,"USD",6.04,6.04,100,20,4,"https://www.amazon.com/dp/B01L28CDOY","80.00",false,false,false,false,"Pregnancy: Your Baby Guide Week For Week (Parenting, Baby Guide, New Parent Books, Childbirth, Motherhood)","https://m.media-amazon.com/images/I/81WVixAcEXL._AC_UY218_.jpg"
41,16,865,"B01H0PPKKC",false,0,"USD",0,0,0,17,4.4,"https://www.amazon.com/dp/B01H0PPKKC","74.80",false,false,false,false,"99 Health Ranger Rules for Reading Food and Product Labels: How to avoid disease-causing toxins in foods, supplements, per...","https://m.media-amazon.com/images/I/81uQ77wHf8L._AC_UY218_.jpg"
42,9,866,"B007RR8COU",false,4.99,"USD",0,0,0,4,3.5,"https://www.amazon.com/dp/B007RR8COU","14.00",false,false,false,false,"Dementia caused by Type 3 Diabetes can be Controlled with Vitamin B1(Benfotiamine)","https://m.media-amazon.com/images/I/51sZv9gYggL._AC_UY218_.jpg"
42,10,867,"B081DJZWNZ",false,0,"USD",0,0,0,8,3.3,"https://www.amazon.com/dp/B081DJZWNZ","26.40",false,false,false,false,"The Mayo Clinic Diet: meal plan for improved health, better weight loss and gaining muscle (10 diet choices Book 6)","https://m.media-amazon.com/images/I/81U-vqUIovL._AC_UY218_.jpg"
42,11,868,"B075MQDHTR",false,0,"USD",0,0,0,80,4.5,"https://www.amazon.com/dp/B075MQDHTR","360.00",false,false,false,false,"Beyond Cancer: The Powerful Effect of Plant-Based Eating: How to Adopt a Plant-Based Diet to Optimize Cancer Survival and ...","https://m.media-amazon.com/images/I/A1pGU3PsuoL._AC_UY218_.jpg"
42,12,869,"B08Y92F4W1",false,0,"USD",0,0,0,1,5,"https://www.amazon.com/dp/B08Y92F4W1","5.00",false,false,false,false,"Yin Yoga Chakras: ebook para descubrir los chakras con la práctica de yoga y la escritura (Spanish Edition)","https://m.media-amazon.com/images/I/81VoOvMCYOL._AC_UY218_.jpg"
42,14,871,"B00C8S9VYI",true,11.99,"USD",18.49,6.5,35.15,388,4.4,"https://www.amazon.com/dp/B00C8S9VYI","1707.20",false,false,false,false,"The Diet Fix: Why Diets Fail and How to Make Yours Work","https://m.media-amazon.com/images/I/71L7CQKuhCL._AC_UY218_.jpg"
42,15,872,"B0011UEEPA",false,14.99,"USD",0,0,0,50,3.8,"https://www.amazon.com/dp/B0011UEEPA","190.00",false,false,false,false,"Women's Health Perfect Body Diet: The Ultimate Weight Loss and Workout Plan to Drop Stubborn Pounds and Get Fit for Life!","https://m.media-amazon.com/images/I/91IJ4tGQBML._AC_UY218_.jpg"
42,16,873,"B0BVW6NYTQ",true,6.01,"USD",15.64,9.63,61.57,11,5,"https://www.amazon.com/dp/B0BVW6NYTQ","55.00",false,false,false,false,"Mind Over Matter: How To Build The Ultimate Dieting Mindset","https://m.media-amazon.com/images/I/71GKFcNIqbL._AC_UY218_.jpg"
43,9,874,"B00256Z2HI",true,15.99,"USD",28,12.01,42.89,10373,4.6,"https://www.amazon.com/dp/B00256Z2HI","47715.80",false,false,true,false,"Eat Right 4 Your Type (Revised and Updated): The Individualized Blood Type Diet Solution","https://m.media-amazon.com/images/I/81vfKG2H-uL._AC_UY218_.jpg"
43,10,875,"B07LGT75G4",false,0,"USD",0,0,0,41,4.7,"https://www.amazon.com/dp/B07LGT75G4","192.70",false,false,false,false,"The Health and Happiness Society Collection","https://m.media-amazon.com/images/I/91gOqNPVSIL._AC_UY218_.jpg"
43,12,877,"B00VCA7O6K",false,0,"USD",0,0,0,9,2.8,"https://www.amazon.com/dp/B00VCA7O6K","25.20",false,false,false,false,"PILATE EXERCISE: THE CURE TO ARTHRITIS?","https://m.media-amazon.com/images/I/81bQeT5KSYL._AC_UY218_.jpg"
