"position.page","position.position","position.global_position","asin","price.discounted","price.current_price","price.currency","price.before_price","price.savings_amount","price.savings_percent","reviews.total_reviews","reviews.rating","url","score","sponsored","amazonChoice","bestSeller","amazonPrime","title","thumbnail"
33,5,286,"B07Q9FXP86",true,13.07,"USD",24.99,11.92,47.7,1306,4.7,"https://www.amazon.com/dp/B07Q9FXP86","6138.20",false,false,false,false,"The Complete Baby and Toddler Cookbook: The Very Best Baby and Toddler Food Recipe Book (America's Test Kitchen Kids)","https://m.media-amazon.com/images/I/51yssWo3TzL._AC_UY218_.jpg"
33,6,287,"B0C2HY25SL",false,0,"USD",0,0,0,462,5,"https://www.amazon.com/dp/B0C2HY25SL","2310.00",false,false,false,false,"Canning Meat Cookbook for Beginners: The Complete Guide with Step-by-Step Instructions to Preserve Your Favorite Meats. It...","https://m.media-amazon.com/images/I/91NbMcWYB3L._AC_UY218_.jpg"
33,7,288,"B012QH4X2A",true,20.99,"USD",35,14.01,40.03,1125,4.6,"https://www.amazon.com/dp/B012QH4X2A","5175.00",false,false,false,false,"The Love and Lemons Cookbook: An Apple-to-Zucchini Celebration of Impromptu Cooking","https://m.media-amazon.com/images/I/91RKy9LJQ5L._AC_UY218_.jpg"
33,8,289,"B01COAICZS",true,12.99,"USD",32.5,19.51,60.03,2849,4.5,"https://www.amazon.com/dp/B01COAICZS","12820.50",false,false,false,false,"Molly on the Range: Recipes and Stories from An Unlikely Life on a Farm: A Cookbook","https://m.media-amazon.com/images/I/91bf9hpIjPL._AC_UY218_.jpg"
34,1,290,"B089GQ48M8",false,0,"USD",0,0,0,114,4.1,"https://www.amazon.com/dp/B089GQ48M8","467.40",false,false,false,false,"Ultimate Armenian Cookbook: TOP 111 Armenian traditional recipes you can cook right now (World Cuisines Book 1)","https://m.media-amazon.com/images/I/91azaQbEnAL._AC_UY218_.jpg"
34,2,291,"B081GDBHBF",true,0,"USD",17.99,17.99,100,633,4.6,"https://www.amazon.com/dp/B081GDBHBF","2911.80",false,false,false,false,"Dairy-Free Gluten-Free Baking Cookbook: 75+ Delicious Cookies, Cakes, Pies, Breads & More","https://m.media-amazon.com/images/I/919svkxUoaL._AC_UY218_.jpg"
34,4,293,"B0C1PP8QP7",false,0,"USD",0,0,0,2,3,"https://www.amazon.com/dp/B0C1PP8QP7","6.00",false,false,false,false,"Po’Boy Sandwich Cookbook: Delicious PoBoy Recipes From New Orleans and Beyond","https://m.media-amazon.com/images/I/81m2FFijRCL._AC_UY218_.jpg"
34,5,294,"B0BHXNL8WZ",false,0,"USD",0,0,0,233,4.8,"https://www.amazon.com/dp/B0BHXNL8WZ","1118.40",false,false,false,false,"Italian Cookbook: 600 Modern & Authentic Recipes For Amazing American Italian Cooking (pasta pizza cookbook)","https://m.media-amazon.com/images/I/A1UZDtNvYaL._AC_UY218_.jpg"
34,6,295,"B09T3VGYPF",false,0,"USD",0,0,0,5,4.3,"https://www.amazon.com/dp/B09T3VGYPF","21.50",false,false,false,false,"Bison Cookbook: Delicious Bison Burgers, Meatballs, Chili and Other Recipes","https://m.media-amazon.com/images/I/81kDOtqR5KL._AC_UY218_.jpg"
34,7,296,"B0BNL48MZR",false,0,"USD",0,0,0,288,4.8,"https://www.amazon.com/dp/B0BNL48MZR","1382.40",false,false,false,false,"Clean Eating Cookbook for Beginners: Eat Better, Feel Better, 500 No-Fuss Clean Recipes Incl. Whole Foods, Diabetic Recipe...","https://m.media-amazon.com/images/I/91vMOAP-DDL._AC_UY218_.jpg"
34,8,297,"B09NGQS72W",false,0,"USD",0,0,0,33,4.4,"https://www.amazon.com/dp/B09NGQS72W","145.20",false,false,false,false,"Potluck Cookbook : Favorite Crowd-pleasing Recipes to Bring Along","https://m.media-amazon.com/images/I/81PkY0zAp+L._AC_UY218_.jpg"
34,9,298,"B08SMQ8SMK",true,0,"USD",24.99,24.99,100,2029,4,"https://www.amazon.com/dp/B08SMQ8SMK","8116.00",false,false,false,false,"Ninja Foodi 2-Basket Air Fryer Cookbook: Easy & Delicious Air Fry, Dehydrate, Roast, Bake, Reheat, and More Recipes for Be...","https://m.media-amazon.com/images/I/91GZ+hxgiEL._AC_UY218_.jpg"
35,1,299,"B0734F7VTX",true,0,"USD",15.99,15.99,100,954,4.3,"https://www.amazon.com/dp/B0734F7VTX","4102.20",false,false,false,false,"The Easy Low Sodium Diet Plan and Cookbook: Quick-Fix and Slow Cooker Meals to Start (and Stick to) a Low Salt Diet","https://m.media-amazon.com/images/I/91lbl+-LqkL._AC_UY218_.jpg"
35,2,300,"B00DOPIXSO",true,8.99,"USD",20,11.01,55.05,481,4.3,"https://www.amazon.com/dp/B00DOPIXSO","2068.30",false,false,false,false,"The Fat Chance Cookbook: More Than 100 Recipes Ready in Under 30 Minutes to Help You Lose the Sugar and the Weight","https://m.media-amazon.com/images/I/81g1M8CLEJL._AC_UY218_.jpg"
35,3,301,"B0BBSVSZYH",false,0,"USD",0,0,0,57,4.5,"https://www.amazon.com/dp/B0BBSVSZYH","256.50",false,false,false,false,"Small-Batch Keto Baking Cookbook: Perfect Portions of Low-Carb Breads, Cookies, Cakes, and More","https://m.media-amazon.com/images/I/81bgcU6ZDbL._AC_UY218_.jpg"
35,4,302,"B00480OV08",true,4.99,"USD",40,35.01,87.52,2894,4.7,"https://www.amazon.com/dp/B00480OV08","13601.80",false,false,false,false,"Momofuku: A Cookbook","https://m.media-amazon.com/images/I/41JP5ZOVPlL._AC_UY218_.jpg"
35,5,303,"B00I885178",false,0,"USD",0,0,0,99,4.2,"https://www.amazon.com/dp/B00I885178","415.80",false,false,false,false,"The Thrifty Bean Cookbook: 35 Bean Recipes To Warm Your Heart & Your Belly (Hillbilly Housewife Cookbooks)","https://m.media-amazon.com/images/I/91W1Uv7OgVL._AC_UY218_.jpg"
35,6,304,"B0184IM61K",true,0,"USD",16.99,16.99,100,2720,4.4,"https://www.amazon.com/dp/B0184IM61K","11968.00",false,false,false,false,"Renal Diet Cookbook: The Low Sodium, Low Potassium, Healthy Kidney Cookbook","https://m.media-amazon.com/images/I/A1vly23BwML._AC_UY218_.jpg"
35,7,305,"B072XLWHFJ",false,0,"USD",0,0,0,130,4.3,"https://www.amazon.com/dp/B072XLWHFJ","559.00",false,false,false,false,"Chinese Takeout Cookbook: Make-At-Home Recipes From Your Favorite Chinese Takeout Restaurants","https://m.media-amazon.com/images/I/71OivgKTtJL._AC_UY218_.jpg"
35,8,306,"B007FW0PI8",true,2.99,"USD",24.99,22,88.04,4796,4.4,"https://www.amazon.com/dp/B007FW0PI8","21102.40",false,false,false,false,"The Shredded Chef: 125 Recipes for Building Muscle, Getting Lean, and Staying Healthy (The Thinner Leaner Stronger Series ...","https://m.media-amazon.com/images/I/91K3c9fl8aL._AC_UY218_.jpg"
36,1,307,"B01AQO0IFQ",true,14.99,"USD",30,15.01,50.03,4147,4.7,"https://www.amazon.com/dp/B01AQO0IFQ","19490.90",false,false,false,false,"Skinnytaste Fast and Slow: Knockout Quick-Fix and Slow Cooker Recipes: A Cookbook","https://m.media-amazon.com/images/I/91sUVK-K8tL._AC_UY218_.jpg"
36,2,308,"B0BNW6Q815",false,0,"USD",0,0,0,549,4.9,"https://www.amazon.com/dp/B0BNW6Q815","2690.10",false,false,false,false,"Ninja CREAMI Cookbook With Color Pictures: 1500-Days Quick and Easy Recipes Ice Creams, Sorbets, tasty Ice Cream Mix-Ins, ...","https://m.media-amazon.com/images/I/91vPFX9e7pL._AC_UY218_.jpg"
36,3,309,"B0BZQYRQ5Y",true,0,"USD",12.99,12.99,100,4,5,"https://www.amazon.com/dp/B0BZQYRQ5Y","20.00",false,false,false,false,"Air Fryer Recipes Cookbook with Pictures (Recipe Books)","https://m.media-amazon.com/images/I/61+GR8zkuwL._AC_UY218_.jpg"
36,4,310,"B00DP7UJM4",true,4.58,"USD",5.95,1.37,23.03,1203,4.3,"https://www.amazon.com/dp/B00DP7UJM4","5172.90",false,false,false,false,"The First American Cookbook: A Facsimile of ""American Cookery,"" 1796","https://m.media-amazon.com/images/I/91BZdNOmmBL._AC_UY218_.jpg"
36,6,312,"B07KPB64RP",false,4.99,"USD",0,0,0,1480,4.5,"https://www.amazon.com/dp/B07KPB64RP","6660.00",false,false,false,false,"The Wagamama Cookbook (Wagamama Titles)","https://m.media-amazon.com/images/I/71hmYFb5HvL._AC_UY218_.jpg"
36,7,313,"B0BWF8CFZK",false,0,"USD",0,0,0,177,4.9,"https://www.amazon.com/dp/B0BWF8CFZK","867.30",false,false,false,false,"Bariatric Cookbook Bible : The Most Complete Guide with 365 Days of Healthy Recipes with Up to 5 Ingredients to Cook in 30...","https://m.media-amazon.com/images/I/91doxaAet0L._AC_UY218_.jpg"
36,8,314,"B07V6W1PW9",true,0,"USD",21.99,21.99,100,306,4.3,"https://www.amazon.com/dp/B07V6W1PW9","1315.80",false,false,false,false,"The Complete Vegan Instant Pot Cookbook: 550 Easy and Delicious Plant-based Recipes for Your Pressure Cooker (21-Day Meal ...","https://m.media-amazon.com/images/I/A1hILyvEUOL._AC_UY218_.jpg"
37,1,315,"B0176M3X80",true,9.99,"USD",17.99,8,44.47,2151,4,"https://www.amazon.com/dp/B0176M3X80","8604.00",false,false,false,false,"Hello, Sunshine: A Novel","https://m.media-amazon.com/images/I/8138r8DaapL._AC_UY218_.jpg"
37,2,316,"B08BZWCZ14",true,16.99,"USD",24.99,8,32.01,719,4.6,"https://www.amazon.com/dp/B08BZWCZ14","3307.40",false,false,false,false,"The Plant-Based Cookbook: Vegan, Gluten-Free, Oil-Free Recipes for Lifelong Health","https://m.media-amazon.com/images/I/81SYtFfAXvL._AC_UY218_.jpg"
37,4,318,"B00IUXDR4K",true,6.99,"USD",14.99,8,53.37,1356,4.3,"https://www.amazon.com/dp/B00IUXDR4K","5830.80",false,false,false,false,"The Mediterranean Slow Cooker Cookbook: A Mediterranean Cookbook with 101 Easy Slow Cooker Recipes","https://m.media-amazon.com/images/I/91KP3P1JDUL._AC_UY218_.jpg"
37,5,319,"B094HCL2HW",false,0,"USD",0,0,0,76,4.3,"https://www.amazon.com/dp/B094HCL2HW","326.80",false,false,false,false,"The Ultimate Irish Cookbook: 111 Dishes From Ireland To Cook Right Now (World Cuisines Book 26)","https://m.media-amazon.com/images/I/81TiL4yVxjS._AC_UY218_.jpg"
37,6,320,"B0B74P2J75",false,0,"USD",0,0,0,172,4.4,"https://www.amazon.com/dp/B0B74P2J75","756.80",false,false,false,false,"The Complete Bread Machine Cookbook: 1000 Foolproof Recipes for Perfect Family-Friendly Homemade Bread","https://m.media-amazon.com/images/I/91asQg+L7rL._AC_UY218_.jpg"
37,7,321,"B07ZWQ28JP",true,0,"USD",34.99,34.99,100,3488,4.6,"https://www.amazon.com/dp/B07ZWQ28JP","16044.80",false,false,false,false,"The Official Big Ninja Foodi Pressure Cooker Cookbook: 175 Recipes and 3 Meal Plans for Your Favorite Do-It-All Multicooker","https://m.media-amazon.com/images/I/81I48-D1YWL._AC_UY218_.jpg"
37,8,322,"B085F25KCB",false,0,"USD",0,0,0,11,4.6,"https://www.amazon.com/dp/B085F25KCB","50.60",false,false,false,false,"Hello! 365 Cabbage Recipes: Best Cabbage Cookbook Ever For Beginners [Chinese Soup Cookbook, Asian Salad Cookbook, Tomato ...","https://m.media-amazon.com/images/I/71jWLx7xUjL._AC_UY218_.jpg"
38,1,323,"B0BQRVHVXK",true,10.99,"USD",21.99,11,50.02,32,4.4,"https://www.amazon.com/dp/B0BQRVHVXK","140.80",false,false,false,false,"Tasty. Healthy. Cheap.: Budget-Friendly Recipes with Exciting Flavors: A Cookbook","https://m.media-amazon.com/images/I/91x4JGa-TaL._AC_UY218_.jpg"
38,2,324,"B0B6GK12PJ",false,0,"USD",0,0,0,15,4.6,"https://www.amazon.com/dp/B0B6GK12PJ","69.00",false,false,false,false,"Picnic Cookbook: Quick and Easy Portable Recipes to Enjoy in the Great Outdoors","https://m.media-amazon.com/images/I/918OGTN1zsL._AC_UY218_.jpg"
38,3,325,"B082J5LR62",true,0,"USD",18.99,18.99,100,839,4.6,"https://www.amazon.com/dp/B082J5LR62","3859.40",false,false,false,false,"The Everything Macro Diet Cookbook: 300 Satisfying Recipes for Shedding Pounds and Gaining Lean Muscle (Everything®)","https://m.media-amazon.com/images/I/715uQHwsFzL._AC_UY218_.jpg"
38,4,326,"B07BB5K1NV",false,0,"USD",0,0,0,404,4.4,"https://www.amazon.com/dp/B07BB5K1NV","1777.60",false,false,false,false,"Plant-Based High-Protein Cookbook: Nutrition Guide With 90+ Delicious Recipes (Including 30-Day Meal Plan) (Vegan Meal Pre...","https://m.media-amazon.com/images/I/91rIaY7U73L._AC_UY218_.jpg"
38,5,327,"B0096SQPQK",false,6.99,"USD",0,0,0,25,4.1,"https://www.amazon.com/dp/B0096SQPQK","102.50",false,false,false,false,"The Spam Cookbook","https://m.media-amazon.com/images/I/81tjB1GaCOL._AC_UY218_.jpg"
38,6,328,"B00WBGA04C",false,0,"USD",0,0,0,151,4.3,"https://www.amazon.com/dp/B00WBGA04C","649.30",false,false,false,false,"The Samosa Cookbook: 30 Crispy and Crunchy Samosa Recipes","https://m.media-amazon.com/images/I/81atizbXVkL._AC_UY218_.jpg"
38,7,329,"B08VSJXRH9",false,0,"USD",0,0,0,499,4.5,"https://www.amazon.com/dp/B08VSJXRH9","2245.50",false,false,false,false,"5 Ingredient Smoothie Recipe Book: 100 Nutrient-Packed Smoothies","https://m.media-amazon.com/images/I/91m3HWCEIXL._AC_UY218_.jpg"
38,8,330,"B0921DDDD1",true,0,"USD",15.99,15.99,100,203,4.5,"https://www.amazon.com/dp/B0921DDDD1","913.50",false,false,false,false,"Plant-Based Slow Cooker Cookbook: 100 Whole-Food Recipes Made Simple","https://m.media-amazon.com/images/I/91xZRdMDekL._AC_UY218_.jpg"
39,1,331,"B09S3RCD84",true,16.99,"USD",31.1,14.11,45.37,16,4.6,"https://www.amazon.com/dp/B09S3RCD84","73.60",false,false,false,false,"Win Son Presents a Taiwanese American Cookbook","https://m.media-amazon.com/images/I/91oZcF9OkSL._AC_UY218_.jpg"
39,2,332,"B0BTTBCKF4",false,0,"USD",0,0,0,183,4.9,"https://www.amazon.com/dp/B0BTTBCKF4","896.70",false,false,false,false,"The Complete Air Fryer Cookbook 2023: 600 Easy and Affordable Recipes for Healthy and Fast Air-Fried Meals for Beginners a...","https://m.media-amazon.com/images/I/81Jv2Z4LemL._AC_UY218_.jpg"
39,3,333,"B08SW1TYCM",true,8.99,"USD",26,17.01,65.42,1065,4.8,"https://www.amazon.com/dp/B08SW1TYCM","5112.00",false,false,false,false,"Rise and Run: Recipes, Rituals and Runs to Fuel Your Day: A Cookbook","https://m.media-amazon.com/images/I/91d-UZ7I2DL._AC_UY218_.jpg"
39,4,334,"B01LYJQOVY",true,9.99,"USD",20,10.01,50.05,386,4.6,"https://www.amazon.com/dp/B01LYJQOVY","1775.60",false,false,false,false,"The Edna Lewis Cookbook","https://m.media-amazon.com/images/I/71x9tgADO2L._AC_UY218_.jpg"
39,5,335,"B09ZQDMY9X",true,12.99,"USD",25,12.01,48.04,756,4.7,"https://www.amazon.com/dp/B09ZQDMY9X","3553.20",false,false,false,false,"The French Chef Cookbook","https://m.media-amazon.com/images/I/71cJptqzMPL._AC_UY218_.jpg"
39,6,336,"B0BTCTKY61",false,0,"USD",0,0,0,394,5,"https://www.amazon.com/dp/B0BTCTKY61","1970.00",false,false,false,false,"South Indian Cookbook: More Than 50 Simple and Easy Authentic South Indian Recipes for Beginners","https://m.media-amazon.com/images/I/81KRiXJtKPL._AC_UY218_.jpg"
39,7,337,"B09K5SSDKM",false,0,"USD",0,0,0,10,4.9,"https://www.amazon.com/dp/B09K5SSDKM","49.00",false,false,false,false,"Soups! Irresistible and Nutritious One-Pot Meal Soup Recipes: Heartwarming Soup Cookbook","https://m.media-amazon.com/images/I/81fbIjbPX5L._AC_UY218_.jpg"
40,1,339,"B07C7NFMV9",true,0,"USD",15.99,15.99,100,950,4.3,"https://www.amazon.com/dp/B07C7NFMV9","4085.00",false,false,false,false,"Low Sodium Slow Cooker Cookbook: Over 100 Heart Healthy Recipes that Prep Fast and Cook Slow","https://m.media-amazon.com/images/I/91siIgaK4XL._AC_UY218_.jpg"
40,2,340,"B07FK3L8QR",true,0,"USD",16.99,16.99,100,1642,4.5,"https://www.amazon.com/dp/B07FK3L8QR","7389.00",false,false,false,false,"The Super Easy Air Fryer Cookbook: Crave-Worthy Recipes for Healthier Fried Favorites","https://m.media-amazon.com/images/I/A1K9Ay09PLL._AC_UY218_.jpg"
40,3,341,"B01HWKSBAG",true,5.99,"USD",25,19.01,76.04,508,4.7,"https://www.amazon.com/dp/B01HWKSBAG","2387.60",false,false,false,false,"Hello, My Name Is Ice Cream: The Art and Science of the Scoop: A Cookbook","https://m.media-amazon.com/images/I/91gWezn7TiL._AC_UY218_.jpg"
40,4,342,"B0BSYX84GQ",false,0,"USD",0,0,0,395,4.9,"https://www.amazon.com/dp/B0BSYX84GQ","1935.50",false,false,false,false,"Smoker Cookbook: Mouthwatering Meat-Smoking Recipes for Competent Barbecue Cooks","https://m.media-amazon.com/images/I/81HgAmpHxEL._AC_UY218_.jpg"
40,5,343,"B0BS784BBZ",false,0,"USD",0,0,0,6,3.2,"https://www.amazon.com/dp/B0BS784BBZ","19.20",false,false,false,false,"Cooking with Eggs: Family-Friendly Nutritious Egg Recipes from Breakfast to Dessert (Specific-Ingredient Cookbooks)","https://m.media-amazon.com/images/I/81XahEPI54L._AC_UY218_.jpg"
40,6,344,"B0BSCS2G9H",false,0,"USD",0,0,0,956,5,"https://www.amazon.com/dp/B0BSCS2G9H","4780.00",false,false,false,false,"Heart Healthy Cookbook for Beginners: 1500+ Days of Mouthwatering, Low-sodium and Low Fat Recipes for Effective Blood Pres...","https://m.media-amazon.com/images/I/811Gxp8HHsL._AC_UY218_.jpg"
40,7,345,"B07NY1HF28",true,14.39,"USD",23.99,9.6,40.02,1136,4.8,"https://www.amazon.com/dp/B07NY1HF28","5452.80",false,false,false,false,"Oaxaca: Home Cooking from the Heart of Mexico","https://m.media-amazon.com/images/I/81TajgjFvYL._AC_UY218_.jpg"
40,8,346,"B06XBKP4WK",false,0,"USD",0,0,0,187,4.4,"https://www.amazon.com/dp/B06XBKP4WK","822.80",false,false,false,false,"Ground Beef Cookbook: Main Dishes, Casseroles, Skillet Meals & More! (Southern Cooking Recipes)","https://m.media-amazon.com/images/I/81zFEZVmu7L._AC_UY218_.jpg"
4,9,347,"B0B548BYP7",false,0,"USD",0,0,0,42,4,"https://www.amazon.com/dp/B0B548BYP7","168.00",false,false,false,false,"Old Fashioned Ground Beef Cookbook: Southern Cooking To Stretch Your Ground Beef Budget!","https://m.media-amazon.com/images/I/81cAxBTORpL._AC_UY218_.jpg"
4,10,348,"B07MWB7PHV",true,0,"USD",12.99,12.99,100,1222,4.4,"https://www.amazon.com/dp/B07MWB7PHV","5376.80",false,false,false,false,"Homemade Keto Soup Cookbook: Fat Burning & Delicious Soups, Stews, Broths & Bread (Elizabeth Jane Cookbook)","https://m.media-amazon.com/images/I/71CfRQBdaIL._AC_UY218_.jpg"
41,1,349,"B01FY2BIXQ",false,0,"USD",0,0,0,116,4.3,"https://www.amazon.com/dp/B01FY2BIXQ","498.80",false,false,false,false,"Italian Takeout Cookbook: Easy Italian Recipes to Make at Home Including Pizza and Pasta","https://m.media-amazon.com/images/I/91x2VWqbvTL._AC_UY218_.jpg"
41,2,350,"B0BSCLF61X",false,0,"USD",0,0,0,665,4.6,"https://www.amazon.com/dp/B0BSCLF61X","3059.00",false,false,false,false,"THE EASY AIR FRYER COOKBOOK FOR BEGINNERS: Many quick and delicious recipes for healthy frying. Including tips and tricks...","https://m.media-amazon.com/images/I/91JB4ArHrrL._AC_UY218_.jpg"
4,11,351,"B084FV3CVH",true,14.99,"USD",35,20.01,57.17,17296,4.8,"https://www.amazon.com/dp/B084FV3CVH","83020.80",false,false,false,false,"Modern Comfort Food: A Barefoot Contessa Cookbook","https://m.media-amazon.com/images/I/81LUor7XnRL._AC_UY218_.jpg"
41,3,352,"B0BHKWNQWY",false,0,"USD",0,0,0,41,4.6,"https://www.amazon.com/dp/B0BHKWNQWY","188.60",false,false,false,false,"Mediterranean Diet Cookbook: Change Your Lifestyle: The Best Easy-To-Prepare, Juicy, and Quick Mediterranean Recipes To Sl...","https://m.media-amazon.com/images/I/91nXl3EDOaL._AC_UY218_.jpg"
4,12,353,"B07NCMDGGL",true,5.99,"USD",29.99,24,80.03,12148,4.8,"https://www.amazon.com/dp/B07NCMDGGL","58310.40",false,false,false,false,"Half Baked Harvest Super Simple: More Than 125 Recipes for Instant, Overnight, Meal-Prepped, and Easy Comfort Foods: A Coo...","https://m.media-amazon.com/images/I/918hS2AqW5L._AC_UY218_.jpg"
4,13,354,"B07CZSYHGF",true,0,"USD",17.99,17.99,100,8102,4.4,"https://www.amazon.com/dp/B07CZSYHGF","35648.80",false,false,false,false,"Diabetic Cookbook and Meal Plan for the Newly Diagnosed: A 4-Week Introductory Guide to Manage Type 2 Diabetes","https://m.media-amazon.com/images/I/91MDzo9--cL._AC_UY218_.jpg"
41,4,355,"B008HALLIK",true,12.99,"USD",27.99,15,53.59,2359,4.4,"https://www.amazon.com/dp/B008HALLIK","10379.60",false,false,false,false,"Wheat Belly Cookbook: 150 Recipes to Help You Lose the Wheat, Lose the Weight, and Find Your Path Back to Health","https://m.media-amazon.com/images/I/91up0AQaerL._AC_UY218_.jpg"
4,14,356,"B01HFUFGSS",true,0,"USD",16.99,16.99,100,11823,4.3,"https://www.amazon.com/dp/B01HFUFGSS","50838.90",false,false,false,false,"The Complete Air Fryer Cookbook: Amazingly Easy Recipes to Fry, Bake, Grill, and Roast with Your Air Fryer","https://m.media-amazon.com/images/I/8198Mw5YeVL._AC_UY218_.jpg"
41,5,357,"B0BHWRPZS9",false,0,"USD",0,0,0,1019,4.3,"https://www.amazon.com/dp/B0BHWRPZS9","4381.70",false,false,true,false,"The Complete Instant Pot Cookbook 2023: 1000+ Super Easy, Delicious & Healthy Instant Pot Recipes That Turn Out Perfectly ...","https://m.media-amazon.com/images/I/91AeADft11L._AC_UY218_.jpg"
4,15,358,"B09NN7WMPW",true,2.99,"USD",17.99,15,83.38,106,4.5,"https://www.amazon.com/dp/B09NN7WMPW","477.00",false,false,false,false,"The Spice Cookbook","https://m.media-amazon.com/images/I/81Q4rXmU7PL._AC_UY218_.jpg"
41,6,359,"B08HJJ2SM5",false,0,"USD",0,0,0,121,4.3,"https://www.amazon.com/dp/B08HJJ2SM5","520.30",false,false,false,false,"Keto Copycat Recipes: Replicate The Most Wanted Recipes From Your Favorite Restaurants at Home (Copycat Cookbooks On A Bud...","https://m.media-amazon.com/images/I/81YDoxw4FrL._AC_UY218_.jpg"
4,16,360,"B00BVJG2GK",true,4.99,"USD",35,30.01,85.74,1747,4.7,"https://www.amazon.com/dp/B00BVJG2GK","8210.90",false,false,false,false,"The Barefoot Contessa Cookbook","https://m.media-amazon.com/images/I/81eQDD-M1YL._AC_UY218_.jpg"
41,7,361,"B07PCV783M",true,0,"USD",19.99,19.99,100,738,4.5,"https://www.amazon.com/dp/B07PCV783M","3321.00",false,false,false,false,"The Essential Kamado Grill Cookbook: Core Techniques and Recipes to Master Grilling, Smoking, Roasting, and More","https://m.media-amazon.com/images/I/91UH2anMyVL._AC_UY218_.jpg"
41,8,362,"B07C8G6W78",false,0,"USD",0,0,0,268,4.1,"https://www.amazon.com/dp/B07C8G6W78","1098.80",false,false,false,false,"The Lectin Free Cookbook: Easy and Fast Lectin Free Recipes for Your Instant Pot Electric Pressure Cooker","https://m.media-amazon.com/images/I/A19VZtTaSZL._AC_UY218_.jpg"
42,1,363,"B0B3X8PDN7",false,0,"USD",0,0,0,343,4.8,"https://www.amazon.com/dp/B0B3X8PDN7","1646.40",false,false,false,false,"Whole Body Reset Diet Cookbook: Control your Weight and Muscle Mass with Delicious Recipes Designed to Get you The Right A...","https://m.media-amazon.com/images/I/91F7Hh1clYL._AC_UY218_.jpg"
42,2,364,"B09FQ9L3CQ",true,0,"USD",12.99,12.99,100,95,4.5,"https://www.amazon.com/dp/B09FQ9L3CQ","427.50",false,false,false,false,"Super Easy Taco Cookbook: Traditional & Creative Recipes for Taco Lovers","https://m.media-amazon.com/images/I/91dvGptoacL._AC_UY218_.jpg"
42,3,365,"B07FL648X4",false,0,"USD",0,0,0,28,4.2,"https://www.amazon.com/dp/B07FL648X4","117.60",false,false,false,false,"Risotto Cookbook: Delicious Risotto Recipes in an Easy Risotto Cookbook","https://m.media-amazon.com/images/I/91dFJV74H1L._AC_UY218_.jpg"
42,4,366,"B07PS9BQ2N",true,8.99,"USD",30,21.01,70.03,4940,4.6,"https://www.amazon.com/dp/B07PS9BQ2N","22724.00",false,false,false,false,"Fix It with Food: More Than 125 Recipes to Address Autoimmune Issues and Inflammation: A Cookbook","https://m.media-amazon.com/images/I/91HhrVJo1TL._AC_UY218_.jpg"
42,5,367,"B078W6M33P",true,14.39,"USD",23.99,9.6,40.02,154,4.6,"https://www.amazon.com/dp/B078W6M33P","708.40",false,false,false,false,"The Austin Cookbook: Recipes and Stories from Deep in the Heart of Texas","https://m.media-amazon.com/images/I/81DrktFvaOL._AC_UY218_.jpg"
42,6,368,"B00ZGTXHAA",false,0,"USD",0,0,0,148,4.4,"https://www.amazon.com/dp/B00ZGTXHAA","651.20",false,false,false,false,"Camping Cookbook: Foil Packet Recipes (Camp Cooking)","https://m.media-amazon.com/images/I/81emE8sCW7L._AC_UY218_.jpg"
42,7,369,"B07PVN5CY9",false,0,"USD",0,0,0,4,3.8,"https://www.amazon.com/dp/B07PVN5CY9","15.20",false,false,false,false,"Easy 3-Ingredient Cookbook: Delicious Recipes Made with Three Ingredients!","https://m.media-amazon.com/images/I/81Rdn3LIhwL._AC_UY218_.jpg"
42,8,370,"B09NDLGZ9W",false,0,"USD",0,0,0,132,4.4,"https://www.amazon.com/dp/B09NDLGZ9W","580.80",false,false,false,false,"Coffee Cookbook: 150+ Homemade Recipes that Taste Exactly Like Bar! Tips and Tricks to Make the Perfect Cappuccino, Iced C...","https://m.media-amazon.com/images/I/91GNvTLlj6L._AC_UY218_.jpg"
43,1,371,"B0B82YK8GC",false,0,"USD",0,0,0,37,4.1,"https://www.amazon.com/dp/B0B82YK8GC","151.70",false,false,false,false,"Classic Southern Cookbook: Living and Eating the Southern Way: An Intense Exposé into Delicious Southern Recipes","https://m.media-amazon.com/images/I/71gF4yFEXUL._AC_UY218_.jpg"
43,2,372,"B07FR4KLDD",false,0,"USD",0,0,0,190,4.3,"https://www.amazon.com/dp/B07FR4KLDD","817.00",false,false,false,false,"Ultimate Breakfast Cookbook: Eggs, Pancakes, Coffee Cakes, Casseroles, Cinnamon Rolls & More! (Southern Cooking Recipes)","https://m.media-amazon.com/images/I/81HeuHAT-ML._AC_UY218_.jpg"
43,3,373,"B01N7YQ7EU",false,0,"USD",0,0,0,637,4.3,"https://www.amazon.com/dp/B01N7YQ7EU","2739.10",false,false,false,false,"Renal Diet Plan and Cookbook:: The Optimal Nutrition Guide to Manage Kidney Disease","https://m.media-amazon.com/images/I/91yS2ow51sL._AC_UY218_.jpg"
43,4,374,"B00OAA02V8",true,0,"USD",9.99,9.99,100,1354,4.2,"https://www.amazon.com/dp/B00OAA02V8","5686.80",false,false,false,false,"The Skinny Steamer Recipe Book: Delicious, Healthy, Low Calorie, Low Fat Steam Cooking Recipes Under 300, 400 & 500 Calories","https://m.media-amazon.com/images/I/81DdBizGu5L._AC_UY218_.jpg"
43,5,375,"B08MCYNGQW",false,0,"USD",0,0,0,25,4,"https://www.amazon.com/dp/B08MCYNGQW","100.00",false,false,false,false,"Easy Cannabis Cookbook: 100+ medical marijuana recipes for delicious edibles","https://m.media-amazon.com/images/I/91bLKpHEkZL._AC_UY218_.jpg"
43,6,376,"B007SGM160",true,16.99,"USD",35,18.01,51.46,5468,4.8,"https://www.amazon.com/dp/B007SGM160","26246.40",false,false,false,false,"Jerusalem: A Cookbook","https://m.media-amazon.com/images/I/51kIzCMwMwL._AC_UY218_.jpg"
43,7,377,"B07P5HDGHH",false,0,"USD",0,0,0,154,4.5,"https://www.amazon.com/dp/B07P5HDGHH","693.00",false,false,false,false,"Copycat Recipes: Making the Applebee’s Grill and Bar Most Popular Recipes at Home (Famous Restaurant Copycat Cookbooks)","https://m.media-amazon.com/images/I/81pLvsWQPlL._AC_UY218_.jpg"
43,8,378,"B0C2Y4H2Y2",false,0,"USD",0,0,0,1,5,"https://www.amazon.com/dp/B0C2Y4H2Y2","5.00",false,false,false,false,"PCOS Cookbook for Women : (Lose Weight, Manage PCOS, and Prevent Prediabetes)","https://m.media-amazon.com/images/I/91QwETtuY5L._AC_UY218_.jpg"
