"position.page","position.position","position.global_position","asin","price.discounted","price.current_price","price.currency","price.before_price","price.savings_amount","price.savings_percent","reviews.total_reviews","reviews.rating","url","score","sponsored","amazonChoice","bestSeller","amazonPrime","title","thumbnail"
27,6,231,"B00AVP5NJ2",false,0,"USD",0,0,0,7,3.7,"https://www.amazon.com/dp/B00AVP5NJ2","25.90",false,false,false,false,"Calories In Calories Out: Lose Weight Without Exercising, Calorie Counting, Fasting, Dieting or Gimmicks","https://m.media-amazon.com/images/I/51zI+TFB45L._AC_UY218_.jpg"
27,7,232,"0718156846",true,17.26,"USD",22.99,5.73,24.92,922,4.6,"https://www.amazon.com/dp/0718156846","4241.20",false,false,false,false,"Anticancer: A New Way of Life","https://m.media-amazon.com/images/I/81yOcigi3sL._AC_UY218_.jpg"
27,8,233,"B07CKZZN58",true,0,"USD",15.99,15.99,100,15,4.3,"https://www.amazon.com/dp/B07CKZZN58","64.50",false,false,false,false,"Healthy Habits for Your Heart: 100 Simple, Effective Ways to Lower Your Blood Pressure and Maintain Your Heart's Health","https://m.media-amazon.com/images/I/71WZP7N8FEL._AC_UY218_.jpg"
28,1,234,"B09P1RVLGR",true,0,"USD",6.04,6.04,100,21,4.2,"https://www.amazon.com/dp/B09P1RVLGR","88.20",false,false,false,false,"GROUNDED FOR HEALTH: Through Earthing, improve your mental and physical well-being by using Earths’ incredible healing pow...","https://m.media-amazon.com/images/I/81Fsqj+VZqL._AC_UY218_.jpg"
28,3,236,"B08764HJXY",false,0,"USD",0,0,0,3,3.8,"https://www.amazon.com/dp/B08764HJXY","11.40",false,false,false,false,"THE NEW MIND DIET: Easy ,Quick and Delicious Recipes and Cookbook for Enhancing Brain Function,Treating and Helping Preven...","https://m.media-amazon.com/images/I/717AidytnuL._AC_UY218_.jpg"
28,4,237,"B0881XRN7Y",false,0,"USD",0,0,0,58,4.5,"https://www.amazon.com/dp/B0881XRN7Y","261.00",false,false,false,false,"Oxygenate with Baking Soda for Greater Health: Using Sodium Bicarbonate to stay Healthy","https://m.media-amazon.com/images/I/81yzqSu6rEL._AC_UY218_.jpg"
28,5,238,"B00N3EA6LI",true,0,"USD",0.99,0.99,100,72,3.2,"https://www.amazon.com/dp/B00N3EA6LI","230.40",false,false,false,false,"Mastering the Real Paleo Diet: All You Can Eat Meat, and All You Can Handle Health and Leanness","https://m.media-amazon.com/images/I/A1D6BXN-VcL._AC_UY218_.jpg"
28,6,239,"B006X0EIUY",true,14.99,"USD",21.55,6.56,30.44,164,4.3,"https://www.amazon.com/dp/B006X0EIUY","705.20",false,false,false,false,"The Cognitive Behavioral Workbook for Weight Management: A Step-by-Step Program (A New Harbinger Self-Help Workbook)","https://m.media-amazon.com/images/I/71MNB8gEsDL._AC_UY218_.jpg"
28,7,240,"B09GB35XHX",true,0.99,"USD",6.04,5.05,83.61,8,4,"https://www.amazon.com/dp/B09GB35XHX","32.00",false,false,false,false,"Letting Go of Overeating: A 7-Day Audiotherapy Program for Weight Loss without Dieting (Stop Overeating Books)","https://m.media-amazon.com/images/I/714UdSGvwIL._AC_UY218_.jpg"
28,8,241,"B09ZJ3SW5J",false,0,"USD",0,0,0,1,1,"https://www.amazon.com/dp/B09ZJ3SW5J","1.00",false,false,false,false,"Weight Loss With Tiny Habits: How to Stop Dieting, Make Healthy Living Easy, and Build Strong New Habits","https://m.media-amazon.com/images/I/81IuCOsxWCL._AC_UY218_.jpg"
29,1,242,"B00T59F01Q",false,0,"USD",0,0,0,8,3.5,"https://www.amazon.com/dp/B00T59F01Q","28.00",false,false,false,false,"Health and Fitness: 7 Habits That Help You Lose Weight And Live a Healthy Life (Weight Loss,Morning Habits,Dieting,Burning...","https://m.media-amazon.com/images/I/61KgOAbhjLL._AC_UY218_.jpg"
29,2,243,"B07SHKX27N",false,11.99,"USD",0,0,0,119,4.7,"https://www.amazon.com/dp/B07SHKX27N","559.30",false,false,false,false,"The Better Period Food Solution: Eat Your Way to a Lifetime of Healthier Cycles","https://m.media-amazon.com/images/I/71BNq0hTN6L._AC_UY218_.jpg"
29,3,244,"B00Y7USB14",true,0,"USD",35,35,100,26546,4.7,"https://www.amazon.com/dp/B00Y7USB14","124766.20",false,false,true,false,"How Not to Die: Discover the Foods Scientifically Proven to Prevent and Reverse Disease","https://m.media-amazon.com/images/I/81SS0bNR0jL._AC_UY218_.jpg"
29,4,245,"B089RSVBGH",true,0,"USD",0.99,0.99,100,18,4,"https://www.amazon.com/dp/B089RSVBGH","72.00",false,false,false,false,"Living with a Small Bowel Obstruction","https://m.media-amazon.com/images/I/81kmZmVF9UL._AC_UY218_.jpg"
29,5,246,"B00K8DSRS6",true,13.99,"USD",16.99,3,17.66,548,4.3,"https://www.amazon.com/dp/B00K8DSRS6","2356.40",false,false,false,false,"The Gut Balance Revolution: Boost Your Metabolism, Restore Your Inner Ecology, and Lose the Weight for Good!","https://m.media-amazon.com/images/I/81mcE4Px5OL._AC_UY218_.jpg"
29,6,247,"B07KJQRV8P",false,0,"USD",0,0,0,125,4.3,"https://www.amazon.com/dp/B07KJQRV8P","537.50",false,false,false,false,"Healthy Living Journal: Track Your Healthy Eating and Living Habits for Improved Health and Well-Being (Healthy Living Ser...","https://m.media-amazon.com/images/I/81qwV64OCjL._AC_UY218_.jpg"
29,7,248,"B00G2GA3JY",false,0,"USD",0,0,0,9,3.8,"https://www.amazon.com/dp/B00G2GA3JY","34.20",false,false,false,false,"The Flourishing Female's Guide To Hormone Balancing Through Diet","https://m.media-amazon.com/images/I/81+-u4N-bOL._AC_UY218_.jpg"
29,8,249,"B07M5PMFQJ",false,0,"USD",0,0,0,253,4.5,"https://www.amazon.com/dp/B07M5PMFQJ","1138.50",false,false,false,false,"The Sugar Belly Secret: Subtract the Sugar, Lose the Weight, and Transform Your Life","https://m.media-amazon.com/images/I/81x+QoUFW1L._AC_UY218_.jpg"
30,1,250,"B083W195KJ",true,11.49,"USD",14.99,3.5,23.35,310,4.4,"https://www.amazon.com/dp/B083W195KJ","1364.00",false,false,false,false,"Love to Eat, Hate to Eat: Breaking the Bondage of Destructive Eating Habits","https://m.media-amazon.com/images/I/71cMDGQCLML._AC_UY218_.jpg"
30,2,251,"B00SGIYYDC",true,9.95,"USD",9.99,0.04,0.4,987,4.5,"https://www.amazon.com/dp/B00SGIYYDC","4441.50",false,false,false,false,"Fasting and Eating for Health: A Medical Doctor's Program For Conquering Disease","https://m.media-amazon.com/images/I/81VbY80u6OL._AC_UY218_.jpg"
30,3,252,"B09BRHCKZ6",false,0,"USD",0,0,0,15,3.5,"https://www.amazon.com/dp/B09BRHCKZ6","52.50",false,false,false,false,"Peripheral Neuropathy: Nerve Repair Meal Recipes to Numbness, Pain and Restore Normal Health","https://m.media-amazon.com/images/I/81dUj76FX3L._AC_UY218_.jpg"
30,4,253,"B09ZVQMN4Y",false,0,"USD",0,0,0,9,3.1,"https://www.amazon.com/dp/B09ZVQMN4Y","27.90",false,false,false,false,"The New Perfect 2022 Ornish Diet Cookbook: 100+Guide To Reversing Heart Disease And Losing Weight For A Vibrant Health Con...","https://m.media-amazon.com/images/I/71InST5lqyL._AC_UY218_.jpg"
30,5,254,"B06XSPWFXN",false,9.99,"USD",0,0,0,771,4.7,"https://www.amazon.com/dp/B06XSPWFXN","3623.70",false,false,false,false,"Self Heal By Design- The Role Of Micro-Organisms For Health By Barbara O'Neill","https://m.media-amazon.com/images/I/71uh4qhr3aL._AC_UY218_.jpg"
30,6,255,"B0B96KKT9W",true,4.99,"USD",7.99,3,37.55,16,5,"https://www.amazon.com/dp/B0B96KKT9W","80.00",false,false,false,false,"A Nutritionist Appoach to Weight Loss: Improve your lifestyle without dieting","https://m.media-amazon.com/images/I/61dGIV3BJ9L._AC_UY218_.jpg"
30,7,256,"B00EA8UEU4",false,9.99,"USD",0,0,0,692,4.6,"https://www.amazon.com/dp/B00EA8UEU4","3183.20",false,false,true,false,"Cultured Food for Life: How to Make and Serve Delicious Probiotic Foods for Better Health and Wellness","https://m.media-amazon.com/images/I/81BOFBmOXAL._AC_UY218_.jpg"
30,8,257,"B0BDR87NWS",true,4.99,"USD",20.9,15.91,76.12,3537,4.4,"https://www.amazon.com/dp/B0BDR87NWS","15562.80",false,false,false,false,"Fast 800 Keto: Eat well, burn fat, manage your weight long-term (The Fast 800 Series)","https://m.media-amazon.com/images/I/712cK1QIcYL._AC_UY218_.jpg"
3,9,258,"B0BZWHGJCB",false,0,"USD",0,0,0,2,4,"https://www.amazon.com/dp/B0BZWHGJCB","8.00",false,false,false,false,"How To Start Running","https://m.media-amazon.com/images/I/71Amqh1dsAL._AC_UY218_.jpg"
31,1,260,"1472119231",false,11.86,"USD",0,0,0,101,4.5,"https://www.amazon.com/dp/1472119231","454.50",false,false,false,false,"Weight Escape","https://m.media-amazon.com/images/I/810iZxEfutL._AC_UY218_.jpg"
3,11,262,"B0098PYV7Q",true,2.99,"USD",24.99,22,88.04,7771,4.4,"https://www.amazon.com/dp/B0098PYV7Q","34192.40",false,false,true,false,"Thinner Leaner Stronger: The Simple Science of Building the Ultimate Female Body (The Thinner Leaner Stronger Series Book 1)","https://m.media-amazon.com/images/I/81K2iw2gzVL._AC_UY218_.jpg"
31,3,263,"B00GPDHUVI",false,0,"USD",0,0,0,536,3.6,"https://www.amazon.com/dp/B00GPDHUVI","1929.60",false,false,false,false,"Counting Calories: A True Story From An Average Jane Who Lost Over 120 Pounds In Less Than 6 Months","https://m.media-amazon.com/images/I/81MRkNmwaTL._AC_UY218_.jpg"
3,12,264,"B01G7LS4O4",false,0.99,"USD",0,0,0,12,3.8,"https://www.amazon.com/dp/B01G7LS4O4","45.60",false,false,false,false,"the 21 Myths Of Fat loss: 21 Dieting and Weight loss Myths you Believed","https://m.media-amazon.com/images/I/8132omcM-ML._AC_UY218_.jpg"
3,13,265,"B00QQK8GKE",false,0,"USD",0,0,0,92,3.8,"https://www.amazon.com/dp/B00QQK8GKE","349.60",false,false,false,false,"Endomorph Weight Loss: Dieting and Exercise Strategies to Fight Fat Genes","https://m.media-amazon.com/images/I/81-Y+WnCucL._AC_UY218_.jpg"
31,5,268,"B0170TD1HM",false,0,"USD",0,0,0,29,4.6,"https://www.amazon.com/dp/B0170TD1HM","133.40",false,false,false,false,"The Key to a Healthy Digestion: How to eat warm and cold foods to improve your health","https://m.media-amazon.com/images/I/81gzAiUESAL._AC_UY218_.jpg"
3,15,269,"B003UHV2FC",true,0,"USD",9.12,9.12,100,95,3.9,"https://www.amazon.com/dp/B003UHV2FC","370.50",false,false,false,false,"Get Real and Stop Dieting!","https://m.media-amazon.com/images/I/5124ZE7K2NL._AC_UY218_.jpg"
31,6,270,"B086H53SRR",true,8.99,"USD",17.35,8.36,48.18,714,4.5,"https://www.amazon.com/dp/B086H53SRR","3213.00",false,false,false,false,"Heal Your Body, Cure Your Mind: Gut Health, Adrenal Fatigue, Liver Detox, Mental Health, Anxiety, Depression, Disease & Tr...","https://m.media-amazon.com/images/I/81j+OTpGjhL._AC_UY218_.jpg"
3,16,271,"B07J1YBQQT",false,0,"USD",0,0,0,2,4.5,"https://www.amazon.com/dp/B07J1YBQQT","9.00",false,false,false,false,"Ketogenic Diet: Your Complete Beginners Guide to the Keto Lifestyle (Ketogenic Diet, Weight Loss, Fat Loss, Health, Dietin...","https://m.media-amazon.com/images/I/918-fvz65vL._AC_UY218_.jpg"
31,7,272,"B00UERD7TK",true,0,"USD",8.99,8.99,100,11,3.2,"https://www.amazon.com/dp/B00UERD7TK","35.20",false,false,false,false,"Dash Diet Cookbook: Dash Diet in 15 minutes: 75 Quick & Easy DASH Diet recipes in under 15 Minutes (DASH Diet Cookbooks)","https://m.media-amazon.com/images/I/814ntehJ9yL._AC_UY218_.jpg"
31,8,273,"B00CO7FNSQ",true,11.99,"USD",18,6.01,33.39,1083,3.6,"https://www.amazon.com/dp/B00CO7FNSQ","3898.80",false,false,false,false,"The Pound a Day Diet: Lose Up to 5 Pounds in 5 Days by Eating the Foods You Love","https://m.media-amazon.com/images/I/91hAV42siOL._AC_UY218_.jpg"
32,1,274,"B00DW0YP2E",true,2.99,"USD",19.95,16.96,85.01,9391,4.5,"https://www.amazon.com/dp/B00DW0YP2E","42259.50",false,false,false,false,"Don'T Lose Your Mind, Lose Your Weight","https://m.media-amazon.com/images/I/7130vxEywrL._AC_UY218_.jpg"
32,2,275,"B01CLTH12C",false,0,"USD",0,0,0,33,4.3,"https://www.amazon.com/dp/B01CLTH12C","141.90",false,false,false,false,"Fermented Beverages for Healthy Guts: 50 Easy Fermentation Recipes - Kombucha and Jun Teas - Juices - Kefir - Lacto-Fermen...","https://m.media-amazon.com/images/I/81CcoDRB0eL._AC_UY218_.jpg"
32,3,276,"B084M7LY63",false,0,"USD",0,0,0,154,4.1,"https://www.amazon.com/dp/B084M7LY63","631.40",false,false,false,false,"Low FODMAP diet cookbook: 101 Easy, healthy & fast recipes for yours low-FODMAP diet + 28 days helpful meal plans (Dieting...","https://m.media-amazon.com/images/I/8100wl3cOiL._AC_UY218_.jpg"
32,5,278,"B00ECFF92S",true,7.97,"USD",12.97,5,38.55,36,4.5,"https://www.amazon.com/dp/B00ECFF92S","162.00",false,false,false,false,"Flying Squirrels as Pets. Facts and Information. Including Japanese, Northern and Southern Flying Squirrels. Habitat, die...","https://m.media-amazon.com/images/I/81FL2mS2i0L._AC_UY218_.jpg"
32,6,279,"B07RHPZ1C6",false,0,"USD",0,0,0,3,2.6,"https://www.amazon.com/dp/B07RHPZ1C6","7.80",false,false,false,false,"INTERMITTENT FASTING: A COMPREHENSIVE GUIDE ON HOW TO LOSE WEIGHT AND KEEP IT OFF WITHOUT DIETING","https://m.media-amazon.com/images/I/811-OVKAgpL._AC_UY218_.jpg"
32,7,280,"B0845P26KX",false,0,"USD",0,0,0,2,4.5,"https://www.amazon.com/dp/B0845P26KX","9.00",false,false,false,false,"Teacherplant Cannabis: Shamanic Ceremonies for Meditation, Health & Sports","https://m.media-amazon.com/images/I/61WwoF+JhFL._AC_UY218_.jpg"
32,8,281,"B00256Z2I2",true,13.99,"USD",20,6.01,30.05,863,4.5,"https://www.amazon.com/dp/B00256Z2I2","3883.50",false,false,false,false,"Cook Right 4 Your Type: The Practical Kitchen Companion to Eat Right 4 Your Type","https://m.media-amazon.com/images/I/7182mtvFdkL._AC_UY218_.jpg"
33,1,282,"B08G1WWGRH",false,0,"USD",0,0,0,19,4.1,"https://www.amazon.com/dp/B08G1WWGRH","77.90",false,false,false,false,"Intuitive Eating for Teens: The Teenagers Guide To Stop Dieting, Overcome Eating Disorders, Emotional and Binge Eating. Lo...","https://m.media-amazon.com/images/I/91ArK5W7CUL._AC_UY218_.jpg"
33,2,283,"B076ZWF44V",false,0,"USD",0,0,0,19,4.7,"https://www.amazon.com/dp/B076ZWF44V","89.30",false,false,false,false,"Eating Made Simple: Stop Dieting and Simply Eat (Nutrition)","https://m.media-amazon.com/images/I/81clcS+9-GL._AC_UY218_.jpg"
33,3,284,"B0C21SKJCK",false,0,"USD",0,0,0,2,5,"https://www.amazon.com/dp/B0C21SKJCK","10.00",false,false,false,false,"Sacred Healing: Unlocking the Power of Gua Sha for Optimal Health and Wellness (Sacred Healing Series)","https://m.media-amazon.com/images/I/71j8zsR3jrL._AC_UY218_.jpg"
33,4,285,"B087CLB339",true,19.99,"USD",28.99,9,31.05,3454,4.5,"https://www.amazon.com/dp/B087CLB339","15543.00",false,false,false,false,"Fast This Way: Burn Fat, Heal Inflammation, and Eat Like the High-Performing Human You Were Meant to Be (Bulletproof Book 6)","https://m.media-amazon.com/images/I/81D2W4Yvi6L._AC_UY218_.jpg"
33,5,286,"B00XHC19HG",false,0,"USD",0,0,0,9,4.7,"https://www.amazon.com/dp/B00XHC19HG","42.30",false,false,false,false,"Diet: Health, Fitness & Dieting: Weight No Longer! 50 Savory Salad Recipes To Shed Pounds and Lose Weight Instantly (low c...","https://m.media-amazon.com/images/I/917YS5FQrAL._AC_UY218_.jpg"
33,8,289,"B00N3EA4S8",true,0.99,"USD",3.43,2.44,71.14,16,1.8,"https://www.amazon.com/dp/B00N3EA4S8","28.80",false,false,false,false,"The Raw Vegan Bible: Detoxify Your Body and Achieve a Higher Level of Consciousness with Raw Vegan Foods!","https://m.media-amazon.com/images/I/A1I76Wp5uzL._AC_UY218_.jpg"
34,1,290,"B07B24W6Y9",false,0,"USD",0,0,0,719,3.9,"https://www.amazon.com/dp/B07B24W6Y9","2804.10",false,false,false,false,"How to Lose 10 Pounds in A Week: The Ultimate 7 Day Weight Loss Kick-Start for Optimum Health (Emma Greens Weight loss boo...","https://m.media-amazon.com/images/I/91r8uBKo5LL._AC_UY218_.jpg"
34,2,291,"B003ZSHOSK",false,0,"USD",0,0,0,53,4.2,"https://www.amazon.com/dp/B003ZSHOSK","222.60",false,false,false,false,"The Decaf Diet: Is Caffeine Making You Fat?","https://m.media-amazon.com/images/I/7102ZnsmMIL._AC_UY218_.jpg"
34,3,292,"B072HL8H6X",false,0,"USD",0,0,0,1,1,"https://www.amazon.com/dp/B072HL8H6X","1.00",false,false,false,false,"Sugar Free Desserts: 50 Delectable Sugar Free Dessert Recipes","https://m.media-amazon.com/images/I/71IuwAt94iL._AC_UY218_.jpg"
34,4,293,"B0BB7RKD3L",false,0,"USD",0,0,0,3,2.1,"https://www.amazon.com/dp/B0BB7RKD3L","6.30",false,false,false,false,"The O Positive Blood Type Diet: Everything You Need to Know About the Best Diet for Your Health","https://m.media-amazon.com/images/I/71ZurLj77pL._AC_UY218_.jpg"
34,5,294,"B006QO3JWA",true,11.99,"USD",25.99,14,53.87,101,4.1,"https://www.amazon.com/dp/B006QO3JWA","414.10",false,false,false,false,"The Men's Health Diet: 27 Days to Sculpted Abs, Maximum Muscle & Superhuman Sex!","https://m.media-amazon.com/images/I/91HqavRDGCL._AC_UY218_.jpg"
34,6,295,"B07BVNY35B",true,13.99,"USD",26,12.01,46.19,126,4.2,"https://www.amazon.com/dp/B07BVNY35B","529.20",false,false,false,false,"Dressing on the Side (and Other Diet Myths Debunked): 11 Science-Based Ways to Eat More, Stress Less, and Feel Great about...","https://m.media-amazon.com/images/I/81Arw5Q1zML._AC_UY218_.jpg"
34,7,296,"B01J16LJU8",true,11.99,"USD",17.99,6,33.35,481,4.6,"https://www.amazon.com/dp/B01J16LJU8","2212.60",false,false,false,false,"The Endurance Diet: Discover the 5 Core Habits of the World's Greatest Athletes to Look, Feel, and Perform Better","https://m.media-amazon.com/images/I/91sa-WxER7L._AC_UY218_.jpg"
34,8,297,"B00914ANF8",false,2.99,"USD",0,0,0,18,3.8,"https://www.amazon.com/dp/B00914ANF8","68.40",false,false,false,false,"Low-Fat & Low-Carb Sauces: Dukan Diet Friendly Recipes (Delicious Dieting Book 2)","https://m.media-amazon.com/images/I/81Ar+s2dIoL._AC_UY218_.jpg"
35,1,298,"B07B26QCYL",false,0,"USD",0,0,0,519,3.9,"https://www.amazon.com/dp/B07B26QCYL","2024.10",false,false,false,false,"How I Lost a 100 Pounds!: My Personal Weight Loss Strategies for Optimal Health and Happiness (Emma Greens Weight loss boo...","https://m.media-amazon.com/images/I/81gHMsJ8asL._AC_UY218_.jpg"
35,3,300,"B01CZ2IYD0",false,4.99,"USD",0,0,0,4,5,"https://www.amazon.com/dp/B01CZ2IYD0","20.00",false,false,false,false,"Greens Are Good for You! (Basic Health Guides)","https://m.media-amazon.com/images/I/81xpBjIgAgL._AC_UY218_.jpg"
35,4,301,"B08BYDB8ZT",true,11.99,"USD",18.99,7,36.86,1760,4.4,"https://www.amazon.com/dp/B08BYDB8ZT","7744.00",false,false,false,false,"Fast Burn!: The Power of Negative Energy Balance","https://m.media-amazon.com/images/I/71ETQA7AkjL._AC_UY218_.jpg"
35,5,302,"B07W19RR5L",false,0,"USD",0,0,0,29,3.6,"https://www.amazon.com/dp/B07W19RR5L","104.40",false,false,false,false,"Shortcut to Achieving Dr. Herbert Benson’s Relaxation Response: A Short Guide To Learn How To Relax, Eliminate Stress, and...","https://m.media-amazon.com/images/I/81vU5oKtgzL._AC_UY218_.jpg"
35,7,304,"B003ZSISC6",false,9.95,"USD",0,0,0,48,4.4,"https://www.amazon.com/dp/B003ZSISC6","211.20",false,false,false,false,"Diets Still Don't Work: How to Lose Weight Step-by-Step Even After You'Ve Failed at Dieting","https://m.media-amazon.com/images/I/512TWEBJBTL._AC_UY218_.jpg"
35,8,305,"B00LD1S2VE",true,14.99,"USD",19.99,5,25.01,126,4.6,"https://www.amazon.com/dp/B00LD1S2VE","579.60",false,false,false,false,"The Mindful Diet: How to Transform Your Relationship with Food for Lasting Weight Loss and Vibrant Health","https://m.media-amazon.com/images/I/81YRxnr8lyL._AC_UY218_.jpg"
36,1,306,"B0C18BD5RL",false,0,"USD",0,0,0,1,5,"https://www.amazon.com/dp/B0C18BD5RL","5.00",false,false,false,false,"Nail Care Essentials: Your Complete Guide to Healthy, Beautiful Nails.","https://m.media-amazon.com/images/I/71NGz08w9yL._AC_UY218_.jpg"
36,3,308,"B07B299WS9",false,0,"USD",0,0,0,215,4.2,"https://www.amazon.com/dp/B07B299WS9","903.00",false,false,false,false,"50 Top Paleo Recipes: Quick and Easy Paleo Diet Recipes for Weight Loss and Optimum Health (Emma Greens Weight loss books ...","https://m.media-amazon.com/images/I/91-eS2TaE2L._AC_UY218_.jpg"
36,4,309,"B00C1ZROS8",false,0,"USD",0,0,0,14,4.1,"https://www.amazon.com/dp/B00C1ZROS8","57.40",false,false,false,false,"The Body Secret: Using The Law of Attraction To Lose Weight Without Dieting or Exercise","https://m.media-amazon.com/images/I/61v6Qe1y13L._AC_UY218_.jpg"
36,5,310,"B0791JZ3JN",false,0,"USD",0,0,0,48,4.2,"https://www.amazon.com/dp/B0791JZ3JN","201.60",false,false,false,false,"The Food Addict's Meal Prep Manual: Save Yourself From Food Addiction In Only 2 Hours A Week","https://m.media-amazon.com/images/I/81ZnRr3yGWL._AC_UY218_.jpg"
36,6,311,"B08BJDXSTQ",true,0,"USD",13,13,100,23,4.2,"https://www.amazon.com/dp/B08BJDXSTQ","96.60",false,false,false,false,"7 Easy Habits for Optimal Health: A Practical Guide to Weight Loss, Mental Clarity, and More Energy - How to Live a Health...","https://m.media-amazon.com/images/I/71SWKh5p-1L._AC_UY218_.jpg"
36,7,312,"B00AQ0ANBA",true,10.99,"USD",18.99,8,42.13,119,4.6,"https://www.amazon.com/dp/B00AQ0ANBA","547.40",false,false,false,false,"Faithfully Fit: A 40-Day Devotional Plan to End the Yo-Yo Lifestyle of Chronic Dieting","https://m.media-amazon.com/images/I/715TrmXVZEL._AC_UY218_.jpg"
36,8,313,"B0BXBFQMCM",false,0,"USD",0,0,0,3,4,"https://www.amazon.com/dp/B0BXBFQMCM","12.00",false,false,false,false,"Quick Start HIIT (High Intensity Interval Training) for Seniors: Maximize your exercise routine for weight loss, cardiovas...","https://m.media-amazon.com/images/I/71gL0hRh5rL._AC_UY218_.jpg"
37,1,314,"B0C2T7GPCW",false,0,"USD",0,0,0,5,5,"https://www.amazon.com/dp/B0C2T7GPCW","25.00",false,false,false,false,"THE NAKED TRUTH | Look Great Naked : Health Journal, Fitness Log, Workout Tracker, Food Diary","https://m.media-amazon.com/images/I/71Y+-qEHDCL._AC_UY218_.jpg"
37,2,315,"B077TGQH5H",true,0,"USD",6.04,6.04,100,22,4.1,"https://www.amazon.com/dp/B077TGQH5H","90.20",false,false,false,false,"IIFYM & Flexible Dieting: The Ultimate Beginner's Flexible Calorie Counting Diet Guide To Eat All The Foods You Love, If I...","https://m.media-amazon.com/images/I/81ixzUy68VL._AC_UY218_.jpg"
37,3,316,"B07PG9WV1J",true,8.99,"USD",17.99,9,50.03,1647,4.6,"https://www.amazon.com/dp/B07PG9WV1J","7576.20",false,false,false,false,"Wheat Belly (Revised and Expanded Edition): Lose the Wheat, Lose the Weight, and Find Your Path Back to Health","https://m.media-amazon.com/images/I/81d0qUrTdZL._AC_UY218_.jpg"
37,4,317,"B00P31XMK6",false,0,"USD",0,0,0,446,4.2,"https://www.amazon.com/dp/B00P31XMK6","1873.20",false,false,false,false,"Vitamin K2: Understanding How a Little Known Vitamin Impacts Your Health","https://m.media-amazon.com/images/I/81Qz8gZacbL._AC_UY218_.jpg"
37,5,318,"B0721JTBVF",false,0,"USD",0,0,0,22,3.8,"https://www.amazon.com/dp/B0721JTBVF","83.60",false,false,false,false,"WEIGHT LOSS with STRENGTH TRAINING. How to Lose Fat and Build Muscle with Strength Training, Flexible Dieting and Goal Set...","https://m.media-amazon.com/images/I/71RI+1vkVYL._AC_UY218_.jpg"
37,6,319,"B07BCKXQ6X",false,6.99,"USD",0,0,0,258,4.3,"https://www.amazon.com/dp/B07BCKXQ6X","1109.40",false,false,false,false,"Living Low Oxalate: When Oxalate Rich Foods Destroy Your Health","https://m.media-amazon.com/images/I/81GjisHQmxL._AC_UY218_.jpg"
37,8,321,"B07TRW274K",false,0,"USD",0,0,0,24,3.6,"https://www.amazon.com/dp/B07TRW274K","86.40",false,false,false,false,"MY DIRTY KETO: F**K EATING CLEAN: Benefits of Dirty Dieting Include: Weight Loss, Crystal Clear Mind, More Energy and More...","https://m.media-amazon.com/images/I/810xIpiFDwL._AC_UY218_.jpg"
38,1,322,"B008EYHSA4",false,0,"USD",0,0,0,4,4.5,"https://www.amazon.com/dp/B008EYHSA4","18.00",false,false,false,false,"What To Eat With Diabetes Type 1 and 2 - How To Manage Diabetes and Live Life to the Fullest.","https://m.media-amazon.com/images/I/81sYLgZBEGL._AC_UY218_.jpg"
38,2,323,"B010MSYK96",false,0,"USD",0,0,0,9,2.7,"https://www.amazon.com/dp/B010MSYK96","24.30",false,false,false,false,"HIIT Workouts: Get HIIT Fit - Fast-track Your Way To A Shredded Super-fit New You With HIIT Workouts (HIIT training, high ...","https://m.media-amazon.com/images/I/81XrLjG1OXL._AC_UY218_.jpg"
38,3,324,"B07MML3CPH",false,0,"USD",0,0,0,45,3.9,"https://www.amazon.com/dp/B07MML3CPH","175.50",false,false,false,false,"HOW TO STOP SMOKING FOREVER: Kick-start your future health and happiness right now!","https://m.media-amazon.com/images/I/81nsmulhXLL._AC_UY218_.jpg"
38,4,325,"B003AYZBAW",true,14.99,"USD",18.99,4,21.06,1084,4.1,"https://www.amazon.com/dp/B003AYZBAW","4444.40",false,false,false,false,"The New ME Diet: Eat More, Work Out Less, and Actually Lose Weight While You Rest","https://m.media-amazon.com/images/I/91RgSZIIleL._AC_UY218_.jpg"
38,5,326,"B07LF6GFRR",true,0,"USD",32.5,32.5,100,5460,4.7,"https://www.amazon.com/dp/B07LF6GFRR","25662.00",false,false,false,false,"How Not to Diet: The Groundbreaking Science of Healthy, Permanent Weight Loss","https://m.media-amazon.com/images/I/81EHiUPdg6L._AC_UY218_.jpg"
38,6,327,"B0188MUN2G",false,0,"USD",0,0,0,25,4.2,"https://www.amazon.com/dp/B0188MUN2G","105.00",false,false,false,false,"Ginga and Grow Strong: Improve your Health, Fitness, and Family Life through the Art of Brazilian Capoeira (Ginga Series B...","https://m.media-amazon.com/images/I/91sDzdy8BQL._AC_UY218_.jpg"
38,7,328,"B07NMMQ5G6",true,2.99,"USD",22.95,19.96,86.97,212,4.4,"https://www.amazon.com/dp/B07NMMQ5G6","932.80",false,false,false,false,"Half the Sugar, All the Love: 100 Easy, Low-Sugar Recipes for Every Meal of the Day","https://m.media-amazon.com/images/I/81c0av1c7dL._AC_UY218_.jpg"
38,8,329,"B09XMDRSMM",true,11.99,"USD",28.99,17,58.64,432,4.5,"https://www.amazon.com/dp/B09XMDRSMM","1944.00",false,false,false,false,"The Female Factor: Making women’s health count – and what it means for you","https://m.media-amazon.com/images/I/61pHLCF1JuL._AC_UY218_.jpg"
39,1,330,"B08LYT5878",false,0,"USD",0,0,0,50,4.9,"https://www.amazon.com/dp/B08LYT5878","245.00",false,false,false,false,"Health: A Natural Approach: Take Charge of Your Health","https://m.media-amazon.com/images/I/713AbQ99JAL._AC_UY218_.jpg"
39,2,331,"B011364ODS",true,0,"USD",6.04,6.04,100,52,4.1,"https://www.amazon.com/dp/B011364ODS","213.20",false,false,false,false,"Diet & Weight Loss Motivation Secrets You Wish You Knew: Stop the Struggle, End the Guilt, and Enjoy Vibrant Health","https://m.media-amazon.com/images/I/812jic2cBeL._AC_UY218_.jpg"
