"position.page","position.position","position.global_position","asin","price.discounted","price.current_price","price.currency","price.before_price","price.savings_amount","price.savings_percent","reviews.total_reviews","reviews.rating","url","score","sponsored","amazonChoice","bestSeller","amazonPrime","title","thumbnail"
51,5,444,"B075BV3DFH",false,0,"USD",0,0,0,3,4.4,"https://www.amazon.com/dp/B075BV3DFH","13.20",false,false,false,false,"Old school dieting","https://m.media-amazon.com/images/I/71v7bG0BsyL._AC_UY218_.jpg"
5,15,445,"B00AS0UUCU",false,0,"USD",0,0,0,646,4.1,"https://www.amazon.com/dp/B00AS0UUCU","2648.60",false,false,false,false,"Run Yourself Skinny: Lose Weight Fast Without Dieting!","https://m.media-amazon.com/images/I/81MELvox91L._AC_UY218_.jpg"
51,6,446,"B0BFMCC943",false,0,"USD",0,0,0,64,4.7,"https://www.amazon.com/dp/B0BFMCC943","300.80",false,false,false,false,"The 2 Keys To Permanent Weight Loss: How to Change Your Overweight Nature Into a Permanent Weight Loss Nature","https://m.media-amazon.com/images/I/81Z8NDMVaSL._AC_UY218_.jpg"
5,16,447,"B00DWIL6F0",true,0,"USD",1,1,100,215,4.2,"https://www.amazon.com/dp/B00DWIL6F0","903.00",false,false,false,false,"The Fitness Expert Next Door: How to Set and Reach Realistic Fitness Goals in 10 Minutes a Day (How to Change Your Life in...","https://m.media-amazon.com/images/I/81aa5MMjTyL._AC_UY218_.jpg"
51,8,449,"B00FBSY3IG",false,0,"USD",0,0,0,15,3.9,"https://www.amazon.com/dp/B00FBSY3IG","58.50",false,false,false,false,"Lowering Triglycerides: Diet and Supplement Tips","https://m.media-amazon.com/images/I/71sADatVcfL._AC_UY218_.jpg"
52,1,450,"B00SU75J88",false,0,"USD",0,0,0,57,3.9,"https://www.amazon.com/dp/B00SU75J88","222.30",false,false,false,false,"Baking Soda: Using Baking Soda And Loving It: Discover The Amazing Cleaning, Health And Hygiene Secrets Of Baking Soda (Ba...","https://m.media-amazon.com/images/I/91SU4-quIuL._AC_UY218_.jpg"
52,3,452,"B00E78HECS",true,11.99,"USD",17.99,6,33.35,112,4.5,"https://www.amazon.com/dp/B00E78HECS","504.00",false,false,false,false,"The Science of Skinny Cookbook: 175 Healthy Recipes to Help You Stop Dieting -- and Eat for Life!","https://m.media-amazon.com/images/I/81ytLEYZesL._AC_UY218_.jpg"
52,4,453,"B00CLRDYNA",false,5.95,"USD",0,0,0,40,4.1,"https://www.amazon.com/dp/B00CLRDYNA","164.00",false,false,false,false,"Edgar Cayce's Diet Plan for Optimal Health and Weight Loss","https://m.media-amazon.com/images/I/51rgstjFyYL._AC_UY218_.jpg"
52,5,454,"B00B0PFNCE",false,12.99,"USD",0,0,0,1020,3.8,"https://www.amazon.com/dp/B00B0PFNCE","3876.00",false,false,false,false,"The Viva Mayr Diet: 14 days to a flatter stomach and a younger you","https://m.media-amazon.com/images/I/81VpCPItPYL._AC_UY218_.jpg"
52,6,455,"B005FLOETM",true,0,"USD",26,26,100,781,4.3,"https://www.amazon.com/dp/B005FLOETM","3358.30",false,false,false,false,"The 17 Day Diet Cookbook: 80 All New Recipes for Healthy Weight Loss","https://m.media-amazon.com/images/I/71kH6jzjJ7L._AC_UY218_.jpg"
52,7,456,"B0BRY7RXKN",false,0,"USD",0,0,0,2,3,"https://www.amazon.com/dp/B0BRY7RXKN","6.00",false,false,false,false,"THE ACID-ALKALINE BALANCED DIET BOOK: A Beginner's Quick Guide To Uncover The Benefits of Balancing Your pH Levels for Opt...","https://m.media-amazon.com/images/I/81prG7uvMIL._AC_UY218_.jpg"
52,8,457,"B005LW5K8Y",true,9.99,"USD",15.95,5.96,37.37,239,4.5,"https://www.amazon.com/dp/B005LW5K8Y","1075.50",false,false,false,false,"The Rotation Diet (Revised and Updated)","https://m.media-amazon.com/images/I/51RLnm-f-qL._AC_UY218_.jpg"
53,1,458,"B00NEPDTYC",true,7.99,"USD",9.99,2,20.02,527,4,"https://www.amazon.com/dp/B00NEPDTYC","2108.00",false,false,false,false,"The Easy Way to Lose Weight (Allen Carr's Easyway Book 7)","https://m.media-amazon.com/images/I/81h8oAVJI-L._AC_UY218_.jpg"
53,2,459,"B0731FV7SD",true,9.99,"USD",24.95,14.96,59.96,72,4.3,"https://www.amazon.com/dp/B0731FV7SD","309.60",false,false,false,false,"The Diet Detox: Why Your Diet Is Making You Fat and What to Do About It: 10 Simple Rules to Help You Stop Dieting, Start E...","https://m.media-amazon.com/images/I/71xX7C9W-5S._AC_UY218_.jpg"
53,3,460,"B00M70SA1C",true,5.99,"USD",17.99,12,66.7,810,4.4,"https://www.amazon.com/dp/B00M70SA1C","3564.00",false,false,false,false,"The Beck Diet Solution Weight Loss Workbook: The 6-Week Plan to Train Your Brain to Think Like a Thin Person (eBook Original)","https://m.media-amazon.com/images/I/71QcHJrnZ3L._AC_UY218_.jpg"
53,4,461,"B003UBAX8A",true,9.99,"USD",18.99,9,47.39,65,4.4,"https://www.amazon.com/dp/B003UBAX8A","286.00",false,false,false,false,"The Don't Diet, Live-It! Workbook: Healing Food, Weight and Body Issues","https://m.media-amazon.com/images/I/51v7HdWI73L._AC_UY218_.jpg"
53,5,462,"B09JWRMCLJ",false,0,"USD",0,0,0,9,4.1,"https://www.amazon.com/dp/B09JWRMCLJ","36.90",false,false,false,false,"Trauma Comfrey, Nature's Healing Herb: Wounds, Sports Injuries, Sprains and Strains, Back & Joint Pain and More!","https://m.media-amazon.com/images/I/81mY0RQ+25L._AC_UY218_.jpg"
53,7,464,"B01CL40SKO",false,0,"USD",0,0,0,1,5,"https://www.amazon.com/dp/B01CL40SKO","5.00",false,false,false,false,"Whole: 30 Days Food Challenge: Top 30 Winning Recipes Help You to Lose Weight and have Life-changing Impact to Your Health...","https://m.media-amazon.com/images/I/81-fiVQCe7L._AC_UY218_.jpg"
53,8,465,"B07WZH2V53",false,0,"USD",0,0,0,7,4.5,"https://www.amazon.com/dp/B07WZH2V53","31.50",false,false,false,false,"Fat Loss: Diet Habits to Transform your Body and Burn Fat (Habit-Based Diet, Stop Dieting. Form New Habits. Change Your Li...","https://m.media-amazon.com/images/I/711YdwZ77UL._AC_UY218_.jpg"
54,1,466,"B00IJLGCPO",false,0,"USD",0,0,0,86,4.1,"https://www.amazon.com/dp/B00IJLGCPO","352.60",false,false,false,false,"Peripheral Neuropathy: Nine Simple Steps To Reduce The Pain","https://m.media-amazon.com/images/I/61F7vPD452L._AC_UY218_.jpg"
54,2,467,"B07FMHFGLT",true,17.99,"USD",32,14.01,43.78,756,4.6,"https://www.amazon.com/dp/B07FMHFGLT","3477.60",false,false,false,false,"Deep Medicine: How Artificial Intelligence Can Make Healthcare Human Again","https://m.media-amazon.com/images/I/712eBjZWS9L._AC_UY218_.jpg"
54,3,468,"B00F2MPYAC",false,0,"USD",0,0,0,7,3.1,"https://www.amazon.com/dp/B00F2MPYAC","21.70",false,false,false,false,"The Wheat Belly Fat Burning Cookbook: Lose 10 Pounds of Wheat Belly Fat In 10 Days By Burning Your Wheat Belly.","https://m.media-amazon.com/images/I/611GuC4rqvL._AC_UY218_.jpg"
54,4,469,"B004J4WLNC",true,14.99,"USD",26.99,12,44.46,551,4.6,"https://www.amazon.com/dp/B004J4WLNC","2534.60",false,false,false,false,"The Men's Health Big Book of Food & Nutrition: Your Completely Delicious Guide to Eating Well, Looking Great, and Staying ...","https://m.media-amazon.com/images/I/91HpHThG6GL._AC_UY218_.jpg"
54,5,470,"B078XLSMHW",false,0,"USD",0,0,0,14,3.2,"https://www.amazon.com/dp/B078XLSMHW","44.80",false,false,false,false,"How To SLEEP IT OFF And KEEP IT OFF: A Sleep Focused Weight Loss And Health Guide","https://m.media-amazon.com/images/I/81VYIWjV-ML._AC_UY218_.jpg"
54,6,471,"B086V5XRN9",false,0,"USD",0,0,0,30,3.8,"https://www.amazon.com/dp/B086V5XRN9","114.00",false,false,false,false,"Low FODMAP diet: The Beginner's Guide, including 7 days Meal Plan + 45 Easy, healthy & fast recipes and all information yo...","https://m.media-amazon.com/images/I/91-S+Gor24L._AC_UY218_.jpg"
54,7,472,"B000XPRSAC",true,9.99,"USD",17.1,7.11,41.58,236,4.2,"https://www.amazon.com/dp/B000XPRSAC","991.20",false,false,false,false,"Crack the Fat-Loss Code: Outsmart Your Metabolism and Conquer the Diet Plateau","https://m.media-amazon.com/images/I/81SpwGaLpcL._AC_UY218_.jpg"
54,8,473,"B07SGQ9BRJ",true,11.99,"USD",18.99,7,36.86,1708,4.5,"https://www.amazon.com/dp/B07SGQ9BRJ","7686.00",false,false,false,false,"Food Fix: How to Save Our Health, Our Economy, Our Communities, and Our Planet--One Bite at a Time (The Dr. Mark Hyman Lib...","https://m.media-amazon.com/images/I/7129-VutvnL._AC_UY218_.jpg"
55,1,474,"B0B2V3KXJL",false,0,"USD",0,0,0,16,4.8,"https://www.amazon.com/dp/B0B2V3KXJL","76.80",false,false,false,false,"Goodbye Concussion: Your Guide to Complete Concussion Recovery","https://m.media-amazon.com/images/I/71z7NU0dF4L._AC_UY218_.jpg"
55,2,475,"B00Y2HG5JW",false,0,"USD",0,0,0,12,2.9,"https://www.amazon.com/dp/B00Y2HG5JW","34.80",false,false,false,false,"Magnesium: The Miracle of Making up Magnesium Deficiency for Women's Health, Relief and Longevity (Essential Oils, aromath...","https://m.media-amazon.com/images/I/913QgCyw8bL._AC_UY218_.jpg"
55,3,476,"B0BVBZL1RS",false,0,"USD",0,0,0,1,5,"https://www.amazon.com/dp/B0BVBZL1RS","5.00",false,false,false,false,"The Complete Guide to Intermittent Fasting: Lose Weight and Improve Health with This Simple and Effective Eating Plan","https://m.media-amazon.com/images/I/712YTKYdR8L._AC_UY218_.jpg"
55,4,477,"B00KJO2K0U",false,0,"USD",0,0,0,126,3.9,"https://www.amazon.com/dp/B00KJO2K0U","491.40",false,false,false,false,"Conquering Health Anxiety: How To Break Free From The Hypochondria Trap","https://m.media-amazon.com/images/I/81DDs8ctXUL._AC_UY218_.jpg"
55,5,478,"B00655EJ56",true,13.99,"USD",16.99,3,17.66,1218,4.4,"https://www.amazon.com/dp/B00655EJ56","5359.20",false,false,false,false,"Clean Gut: The Breakthrough Plan for Eliminating the Root Cause of Disease and Revolutionizing Your Health","https://m.media-amazon.com/images/I/71N1zsTBVEL._AC_UY218_.jpg"
55,7,480,"B00KLDEKZC",true,9.99,"USD",14.63,4.64,31.72,957,4.5,"https://www.amazon.com/dp/B00KLDEKZC","4306.50",false,false,false,false,"Eat Bacon, Don't Jog: Get Strong. Get Lean. No Bullshit.","https://m.media-amazon.com/images/I/71oYSj8w6TL._AC_UY218_.jpg"
55,8,481,"B07Z3QVCGR",true,20.99,"USD",29.99,9,30.01,1354,4.7,"https://www.amazon.com/dp/B07Z3QVCGR","6363.80",false,false,false,false,"Fit Gurl: The Total-Body Turnaround Program","https://m.media-amazon.com/images/I/81gHRLU-+mL._AC_UY218_.jpg"
56,2,483,"B00YB0AED8",true,3.99,"USD",8.99,5,55.62,92,3.8,"https://www.amazon.com/dp/B00YB0AED8","349.60",false,false,false,false,"How to be Slim and Healthy: A French-inspired journey to slimness and good health","https://m.media-amazon.com/images/I/71V+4W0SLjL._AC_UY218_.jpg"
56,3,484,"B07CK2CKH1",false,0,"USD",0,0,0,20,3.9,"https://www.amazon.com/dp/B07CK2CKH1","78.00",false,false,false,false,"42,000 Steps: 100 Simple Ways to Maximize Your Daily Step Count! (Supercharge Your Walking Life Book 1)","https://m.media-amazon.com/images/I/717qkEBTH2L._AC_UY218_.jpg"
56,5,486,"B07QXF5CS4",true,16.99,"USD",35,18.01,51.46,3582,4.6,"https://www.amazon.com/dp/B07QXF5CS4","16477.20",false,false,false,false,"Ultimate Veg: Easy & Delicious Meals for Everyone [American Measurements]","https://m.media-amazon.com/images/I/71snEYIEU6L._AC_UY218_.jpg"
56,7,488,"B07KMKX9SZ",true,0,"USD",25.99,25.99,100,648,4.4,"https://www.amazon.com/dp/B07KMKX9SZ","2851.20",false,false,false,false,"Clean Keto Lifestyle: The Complete Guide to Transforming Your Life and Health","https://m.media-amazon.com/images/I/91+lacZ6KAL._AC_UY218_.jpg"
56,8,489,"B08GJWSJDB",false,0,"USD",0,0,0,1,5,"https://www.amazon.com/dp/B08GJWSJDB","5.00",false,false,false,false,"Weight Loss For Men Over 40: How I Got Six Pack Abs Fast!","https://m.media-amazon.com/images/I/61M5vyVuXbL._AC_UY218_.jpg"
57,1,490,"B0BSNXXFHH",false,0,"USD",0,0,0,6,4.8,"https://www.amazon.com/dp/B0BSNXXFHH","28.80",false,false,false,false,"To My Eating Disorder","https://m.media-amazon.com/images/I/61ES9vrWmjL._AC_UY218_.jpg"
57,2,491,"B004QX07AK",true,12.99,"USD",19.99,7,35.02,2690,4.3,"https://www.amazon.com/dp/B004QX07AK","11567.00",false,false,false,false,"The Blood Sugar Solution: The UltraHealthy Program for Losing Weight, Preventing Disease, and Feeling Great Now! (The Dr. ...","https://m.media-amazon.com/images/I/81OEiH203nL._AC_UY218_.jpg"
57,3,492,"B01CZ2J696",true,5.36,"USD",5.99,0.63,10.52,9,3.7,"https://www.amazon.com/dp/B01CZ2J696","33.30",false,false,false,false,"User's Guide to Brain-Boosting Supplements: Learn about the Vitamins and Other Nutrients That Can Boost Your Memory and En...","https://m.media-amazon.com/images/I/81LmxKCLhRL._AC_UY218_.jpg"
57,4,493,"B0085CDJQW",true,7.59,"USD",13.95,6.36,45.59,8,4.8,"https://www.amazon.com/dp/B0085CDJQW","38.40",false,false,false,false,"Whole Weigh: How to Quit Dieting and Start Living a Healthy and Whole Life.","https://m.media-amazon.com/images/I/51+jxbRFadL._AC_UY218_.jpg"
57,5,494,"B08ZNWFBKG",false,0,"USD",0,0,0,41,4.6,"https://www.amazon.com/dp/B08ZNWFBKG","188.60",false,false,false,false,"Pillars of Wellness: Achieve and Uphold Holistic Health, Vitality, and Longevity—A Natural Approach to Optimizing Your Lif...","https://m.media-amazon.com/images/I/81WZOk8eZ-L._AC_UY218_.jpg"
57,6,495,"B07H7PYD1G",true,0,"USD",19.95,19.95,100,4,3.1,"https://www.amazon.com/dp/B07H7PYD1G","12.40",false,false,false,false,"IIFYM & Régime Flexible: Guide De Régime Pour Savoir Comment Calculer Vos Calories Et Macronutriments Pour Débutants (Livr...","https://m.media-amazon.com/images/I/81kDNF1JKwL._AC_UY218_.jpg"
57,7,496,"B01LDB360U",false,0,"USD",0,0,0,10,3.2,"https://www.amazon.com/dp/B01LDB360U","32.00",false,false,false,false,"4 Ingredient Slow Cooker: 21 Quick and Easy Slow Cooker Recipe (Healthy Recipes, Crock Pot Recipes, Slow Cooker Recipes, C...","https://m.media-amazon.com/images/I/71pl9s4e1yL._AC_UY218_.jpg"
58,1,498,"B00AG0VMTC",true,10.99,"USD",16.99,6,35.31,1595,4.7,"https://www.amazon.com/dp/B00AG0VMTC","7496.50",false,false,false,false,"Plant-Strong: Discover the World's Healthiest Diet--with 150 Engine 2 Recipes","https://m.media-amazon.com/images/I/91d1ZptGW7L._AC_UY218_.jpg"
58,2,499,"B0866XJ9R8",true,8.99,"USD",9.99,1,10.01,9,4.5,"https://www.amazon.com/dp/B0866XJ9R8","40.50",false,false,false,false,"The Philosopher's Diet: How to Lose Weight & Change the World (Nonpareil Book Book 81)","https://m.media-amazon.com/images/I/81uQY7vvXUL._AC_UY218_.jpg"
58,3,500,"B07L6RDDPD",false,3.99,"USD",0,0,0,9,4.7,"https://www.amazon.com/dp/B07L6RDDPD","42.30",false,false,false,false,"LipZip: Breathe Better to Live Better","https://m.media-amazon.com/images/I/617-5gob9rL._AC_UY218_.jpg"
58,4,501,"B01E84JCDE",false,0,"USD",0,0,0,93,4.2,"https://www.amazon.com/dp/B01E84JCDE","390.60",false,false,false,false,"South Beach Diet: The South Beach Diet Guide For Beginners: How To Feel Great And Healthy With The South Beach Diet","https://m.media-amazon.com/images/I/81ikpKnc0xL._AC_UY218_.jpg"
58,5,502,"B00BSBVDCO",false,12.99,"USD",0,0,0,1531,4.2,"https://www.amazon.com/dp/B00BSBVDCO","6430.20",false,false,false,false,"A Short Guide to a Long Life","https://m.media-amazon.com/images/I/71Uivu3qQRL._AC_UY218_.jpg"
58,6,503,"B01MCZXR2G",false,0,"USD",0,0,0,22,4.5,"https://www.amazon.com/dp/B01MCZXR2G","99.00",false,false,false,false,"NCLEX Cardiovascular Medications: 105 Nursing Practice Questions & Rationales to EASILY Crush the NCLEX! (Nursing Review Q...","https://m.media-amazon.com/images/I/91LfF9sJw+L._AC_UY218_.jpg"
58,7,504,"B0050QIY84",false,2.99,"USD",0,0,0,25,4.3,"https://www.amazon.com/dp/B0050QIY84","107.50",false,false,false,false,"The Hood Health Handbook, Volume Two","https://m.media-amazon.com/images/I/91Kof86II7L._AC_UY218_.jpg"
58,9,506,"B00571F26Y",true,6.99,"USD",25.99,19,73.11,10797,4.4,"https://www.amazon.com/dp/B00571F26Y","47506.80",false,false,false,false,"Wheat Belly: Lose the Wheat, Lose the Weight, and Find Your Path Back to Health","https://m.media-amazon.com/images/I/91-9aWwWoWL._AC_UY218_.jpg"
59,1,507,"B00IAJ3DBQ",false,12.79,"USD",0,0,0,1,1,"https://www.amazon.com/dp/B00IAJ3DBQ","1.00",false,false,false,false,"Being Safe with Weather (Be Safe)","https://m.media-amazon.com/images/I/7110PCQz4EL._AC_UY218_.jpg"
59,2,508,"B00N24PAQA",false,9.99,"USD",0,0,0,160,4.3,"https://www.amazon.com/dp/B00N24PAQA","688.00",false,false,false,false,"Women's Health Lift to Get Lean: A Beginner#s Guide to Fitness & Strength Training in 3 Simple Steps","https://m.media-amazon.com/images/I/81HhfeHD0XL._AC_UY218_.jpg"
59,3,509,"B075DXDTYX",true,10.99,"USD",21.99,11,50.02,83,4.2,"https://www.amazon.com/dp/B075DXDTYX","348.60",false,false,false,false,"Women's Health Healthy Meals for One (or Two) Cookbook: A Simple Guide to Shopping, Prepping, and Cooking for Yourself wit...","https://m.media-amazon.com/images/I/A1OLAygL2VL._AC_UY218_.jpg"
59,4,510,"B091MNQV9X",true,0,"USD",16.99,16.99,100,1042,4.3,"https://www.amazon.com/dp/B091MNQV9X","4480.60",false,false,false,false,"Keto After 50: A Complete Plan For Staying Healthy, Eating Well, and Losing Weight","https://m.media-amazon.com/images/I/81E3j50GEAL._AC_UY218_.jpg"
59,5,511,"B0BZZFSFKB",false,1.99,"USD",0,0,0,1,5,"https://www.amazon.com/dp/B0BZZFSFKB","5.00",false,false,false,false,"Improve Your Gut Health","https://m.media-amazon.com/images/I/51lVBHnHJSL._AC_UY218_.jpg"
59,6,512,"B01MA15YHI",false,0,"USD",0,0,0,5,3.1,"https://www.amazon.com/dp/B01MA15YHI","15.50",false,false,false,false,"Ditch The DIET: A Simple Weight Loss Guide (Heal Your Body Without Dieting Book 1)","https://m.media-amazon.com/images/I/71-yEYJ5LxL._AC_UY218_.jpg"
59,7,513,"B081C972NV",false,0,"USD",0,0,0,21,4,"https://www.amazon.com/dp/B081C972NV","84.00",false,false,false,false,"Yoga for the Pregnant & Postpartum Core: A Handbook for Yoga Students & Teachers","https://m.media-amazon.com/images/I/81hSn4jiRpL._AC_UY218_.jpg"
59,8,514,"B01MG24WTA",true,10.99,"USD",14.99,4,26.68,115,4.6,"https://www.amazon.com/dp/B01MG24WTA","529.00",false,false,false,false,"Why Eating Less and Exercising More Makes You Fat: Current Health Advice is Failing Us - Learn the Four Fundamentals For B...","https://m.media-amazon.com/images/I/61EY9c9oo2L._AC_UY218_.jpg"
60,1,515,"B0BHRNB994",true,10.99,"USD",15.27,4.28,28.03,45,4.6,"https://www.amazon.com/dp/B0BHRNB994","207.00",false,false,false,false,"Your Weight Is Not the Problem: A simple, no-diet plan for healthy habits that stick","https://m.media-amazon.com/images/I/813TWN889rL._AC_UY218_.jpg"
60,2,516,"B07F69FGHJ",true,15.99,"USD",30,14.01,46.7,7607,4.6,"https://www.amazon.com/dp/B07F69FGHJ","34992.20",false,false,false,false,"Eat to Beat Disease: The New Science of How Your Body Can Heal Itself","https://m.media-amazon.com/images/I/81Ifc810d6S._AC_UY218_.jpg"
60,3,517,"B0BZDBC36F",false,0,"USD",0,0,0,1,4,"https://www.amazon.com/dp/B0BZDBC36F","4.00",false,false,false,false,"fck I'M FIFTY: Hit Your Second Prime In Your Fifties & Beyond","https://m.media-amazon.com/images/I/81+0bc+nWtL._AC_UY218_.jpg"
60,5,519,"B00N24PAIS",true,16.99,"USD",25.99,9,34.63,84,4.1,"https://www.amazon.com/dp/B00N24PAIS","344.40",false,false,false,false,"To the Fullest: The Clean Up Your Act Plan to Lose Weight, Rejuvenate, and Be the Best You Can Be","https://m.media-amazon.com/images/I/81mj2l9UQ1L._AC_UY218_.jpg"
60,6,520,"B0B6Y7L7GP",true,14.99,"USD",29.99,15,50.02,62,4.5,"https://www.amazon.com/dp/B0B6Y7L7GP","279.00",false,false,false,false,"The Met Flex Diet: Burn Better Fuel, Burn More Fat","https://m.media-amazon.com/images/I/81Z0yj0MbVL._AC_UY218_.jpg"
60,7,521,"B07XVQ72WG",false,0,"USD",0,0,0,38,4,"https://www.amazon.com/dp/B07XVQ72WG","152.00",false,false,false,false,"Faith, Food, Freedom: Exploring Eating Through a Biblical Lens","https://m.media-amazon.com/images/I/71cQK+0hgDL._AC_UY218_.jpg"
60,8,522,"B01BOEHNP0",false,10.99,"USD",0,0,0,187,4.7,"https://www.amazon.com/dp/B01BOEHNP0","878.90",false,false,false,false,"Healing Foods: Eat Your Way to a Healthier Life","https://m.media-amazon.com/images/I/816AIXTnriL._AC_UY218_.jpg"
6,9,523,"B016FMZCQS",true,0,"USD",0.99,0.99,100,84,3.8,"https://www.amazon.com/dp/B016FMZCQS","319.20",false,false,false,false,"Testosterone: Natural Testosterone Booster: Testosterone Boosting With Tongkat Ali and 7 Potent Herbs","https://m.media-amazon.com/images/I/817DPvQi-LL._AC_UY218_.jpg"
6,10,524,"B01HVWEM3K",false,0,"USD",0,0,0,9,3.6,"https://www.amazon.com/dp/B01HVWEM3K","32.40",false,false,false,false,"Bodybuilding for Women: The Beginners Guide to Becoming Strong, Fit & Healthy (Fitness, Healthy, Bodybuilding Workout, Wei...","https://m.media-amazon.com/images/I/81yAn+E73zL._AC_UY218_.jpg"
61,1,525,"B004EYSWJ4",false,14.99,"USD",0,0,0,29,3.6,"https://www.amazon.com/dp/B004EYSWJ4","104.40",false,false,false,false,"Men's Health The Six-Pack Secret: Sculpt Rock-Hard Abs with the Fastest Muscle-Up, Slim-Down Program Ever Created!","https://m.media-amazon.com/images/I/815LekQfnGL._AC_UY218_.jpg"
61,2,526,"B00JBNPV06",true,0,"USD",6.04,6.04,100,757,4.4,"https://www.amazon.com/dp/B00JBNPV06","3330.80",false,false,false,false,"Eat Meat And Stop Jogging: 'Common' Advice On How To Get Fit Is Keeping You Fat And Making You Sick","https://m.media-amazon.com/images/I/81TDXIsBiQL._AC_UY218_.jpg"
6,11,527,"B0BBKS25G5",false,7.99,"USD",0,0,0,10,4.6,"https://www.amazon.com/dp/B0BBKS25G5","46.00",false,false,false,false,"From Suicidal to Serene: How to Make the Food-Mind-Body-Spirit Connection Work for Your Health and Happiness","https://m.media-amazon.com/images/I/81z4qSLTXDL._AC_UY218_.jpg"
61,3,528,"B07FKW3WQQ",true,0,"USD",0.99,0.99,100,6,3.4,"https://www.amazon.com/dp/B07FKW3WQQ","20.40",false,false,false,false,"Faster Kid: How Sports Parents Can Help Their Kids Run Faster Now","https://m.media-amazon.com/images/I/61R2CqRGOKL._AC_UY218_.jpg"
6,12,529,"B0BJ7WKCP3",false,0,"USD",0,0,0,86,4.7,"https://www.amazon.com/dp/B0BJ7WKCP3","404.20",false,false,false,false,"Intuitive Eating: How to Eat Everything Guilt-Free, Build Self-Love and Get Your Ideal Weight Without Dieting Ever Again (...","https://m.media-amazon.com/images/I/71x2QC0l0TL._AC_UY218_.jpg"
6,13,530,"B00OL1QRSS",true,0,"USD",0.99,0.99,100,134,4,"https://www.amazon.com/dp/B00OL1QRSS","536.00",false,false,false,false,"Ebola Pandemic Survival LISTS: The 7 Lists that Show You How to Prepare and Keep Your Family Alive During a Pandemic Disas...","https://m.media-amazon.com/images/I/81K-dXofvML._AC_UY218_.jpg"
61,4,531,"B08TRCCT1G",false,0,"USD",0,0,0,2,3,"https://www.amazon.com/dp/B08TRCCT1G","6.00",false,false,false,false,"IIFYM FLEXIBLE DIETING FOR BEGINNERS: The Step by Step Guide on the If It Fits Your Macros Diet Plan to Build Muscle, Lose...","https://m.media-amazon.com/images/I/81LC9d9gq8L._AC_UY218_.jpg"
6,14,532,"B07H74QHSS",false,0,"USD",0,0,0,4,4.4,"https://www.amazon.com/dp/B07H74QHSS","17.60",false,false,false,false,"Health and Beauty Black Seed and Black Seed Oil Benefits","https://m.media-amazon.com/images/I/81M4Yhc4asL._AC_UY218_.jpg"
6,15,534,"B08KXKKT46",true,3.99,"USD",8.99,5,55.62,73,4.7,"https://www.amazon.com/dp/B08KXKKT46","343.10",false,false,false,false,"Flower Power: Essences That Heal","https://m.media-amazon.com/images/I/71v2ivpvD7L._AC_UY218_.jpg"
61,6,535,"B00DD0BL8Y",false,0,"USD",0,0,0,68,4.1,"https://www.amazon.com/dp/B00DD0BL8Y","278.80",false,false,false,false,"Posterior Chain Linked: Don't Lift Without It (Simple Strength Book 6)","https://m.media-amazon.com/images/I/81xEulF-XwL._AC_UY218_.jpg"
6,16,536,"B0BSCC5M3H",false,0,"USD",0,0,0,9,3.9,"https://www.amazon.com/dp/B0BSCC5M3H","35.10",false,false,false,false,"Stretching for Seniors: Daily Mobility Exercises and Stretches to Increase Flexibility, Improve Posture, and Prevent Injur...","https://m.media-amazon.com/images/I/71JR+s8UGaL._AC_UY218_.jpg"
61,8,538,"B00B3YWJJW",false,0.99,"USD",0,0,0,85,4.1,"https://www.amazon.com/dp/B00B3YWJJW","348.50",false,false,false,false,"Top 50 Most Delicious Smoothie Recipes - Includes Health Benefits & Easy To Follow Steps For The Best Smoothies (Recipe To...","https://m.media-amazon.com/images/I/91kuRF4NVrL._AC_UY218_.jpg"
62,1,539,"B0070XFCG2",true,12.99,"USD",14.99,2,13.34,563,4.2,"https://www.amazon.com/dp/B0070XFCG2","2364.60",false,false,false,false,"Fit2Fat2Fit: The Unexpected Lessons from Gaining and Losing 75 lbs on Purpose","https://m.media-amazon.com/images/I/51nHTwdifCL._AC_UY218_.jpg"
62,3,541,"B07DXH5PRR",true,0.99,"USD",9.99,9,90.09,215,4.3,"https://www.amazon.com/dp/B07DXH5PRR","924.50",false,false,false,false,"Everyday Smoothies: 99+ Juice & Smoothie Recipes to Boost Your Health, Cleanse the Body & Lose Weight (Easy Healthy Home C...","https://m.media-amazon.com/images/I/81QCUiKIjBL._AC_UY218_.jpg"
62,4,542,"B0BZTDXFZY",false,0,"USD",0,0,0,1,2,"https://www.amazon.com/dp/B0BZTDXFZY","2.00",false,false,false,false,"The Optimum Lyme Disease Cookbook: 150+ Healthy and Delicious Recipes for Treating Chronic Inflammation with 4-week Essent...","https://m.media-amazon.com/images/I/71kDrQges6L._AC_UY218_.jpg"
62,5,543,"B09MJNK541",true,0,"USD",13,13,100,31,4.3,"https://www.amazon.com/dp/B09MJNK541","133.30",false,false,false,false,"Breaking Bad Eating Habits: 3 Crucial Steps to Help you Stop Dieting, Increase Mindfulness and Change Your Life - at Any Age","https://m.media-amazon.com/images/I/81idjOwb0RL._AC_UY218_.jpg"
62,6,544,"B00IAJ3DBQ",false,12.79,"USD",0,0,0,1,1,"https://www.amazon.com/dp/B00IAJ3DBQ","1.00",false,false,false,false,"Being Safe with Weather (Be Safe)","https://m.media-amazon.com/images/I/7110PCQz4EL._AC_UY218_.jpg"
62,7,545,"B00N24PAQA",false,9.99,"USD",0,0,0,160,4.3,"https://www.amazon.com/dp/B00N24PAQA","688.00",false,false,false,false,"Women's Health Lift to Get Lean: A Beginner#s Guide to Fitness & Strength Training in 3 Simple Steps","https://m.media-amazon.com/images/I/81HhfeHD0XL._AC_UY218_.jpg"
62,8,546,"B075DXDTYX",true,10.99,"USD",21.99,11,50.02,83,4.2,"https://www.amazon.com/dp/B075DXDTYX","348.60",false,false,false,false,"Women's Health Healthy Meals for One (or Two) Cookbook: A Simple Guide to Shopping, Prepping, and Cooking for Yourself wit...","https://m.media-amazon.com/images/I/A1OLAygL2VL._AC_UY218_.jpg"
